A1: REVISED INTERNATIONAL TABLE OF GLYCEMIC INDEX (GI) AND GLYCEMIC LOAD (GL)—20021
A3: Food Number and Item | C3: GI 2 | D3: Serve | E3: GL 3
C4: glucose | D4: size | E4: per
C5: =100 | D5: grams | E5: serve
B6: BAKERY PRODUCTS
B7: Cakes
A8: 1 | B8: Angel food cake (Loblaw's, Toronto, Canada) | C8: 67 | D8: 50 | E8: 19
A9: =A8+1 -> 2 | B9: Banana cake, made with sugar | C9: 47±8 | D9: 80 | E9: =(38*47)/100 -> 17.86
A10: =A9+1 -> 3 | B10: Banana cake, made without sugar | C10: 55±10 | D10: 80 | E10: =(29*55)/100 -> 15.95
A11: =A10+1 -> 4 | B11: Chocolate cake made from packet mix with chocolate frosting (Betty Crocker, General Mills | C11: 38±3 | D11: 111 | E11: =(52*38)/100 -> 19.76
B12: Inc., Minneapolis, MN, USA)
A13: =A11+1 -> 5 | B13: Cupcake, strawberry-iced (Squiggles, Farmland, Grocery Holdings, Tooronga, Vic, Australia) | C13: 73±12 | D13: 38 | E13: =(26*73)/100 -> 18.98
A14: =A13+1 -> 6 | B14: Lamingtons (sponge dipped in chocolate and coconut) (Farmland, Grocery Holdings, Australia) | C14: 87±17 | D14: 50 | E14: =(29*87)/100 -> 25.23
A15: =A14+1 -> 7 | B15: Pound cake (Sara Lee Canada, Bramalea, Canada) | C15: 54 | D15: 53 | E15: =(28*54)/100 -> 15.12
A16: =A15+1 -> 8 | B16: Sponge cake, plain | C16: 46±6 | D16: 63 | E16: =(36*46)/100 -> 16.56
A17: =A16+1 -> 9 | B17: Vanilla cake made from packet mix with vanilla frosting (Betty Crocker, USA) | C17: 42±4 | D17: 111 | E17: =(57.6*42)/100 -> 24.192000000000004
A18: =A17+1 -> 10 | B18: Croissant (Food City, Toronto, Canada) | C18: 67 | D18: 57 | E18: =(26.1*67)/100 -> 17.487000000000002
A19: =A18+1 -> 11 | B19: Crumpet (Dempster's Corporate Foods Ltd., Etobicoke, Canada) | C19: 69 | D19: 50 | E19: =(19*69)/100 -> 13.11
A20: =A19+1 -> 12 | B20: Doughnut, cake type (Loblaw's, Canada) | C20: 76 | D20: 47 | E20: =(22.9*76)/100 -> 17.404
A21: =A20+1 -> 13 | B21: Flan cake (Weston's Bakery, Toronto, Canada) | C21: 65 | D21: 70 | E21: =(48*65)/100 -> 31.2
A22: =A21+1 -> 14 | B22: Muffins
B23: Apple, made with sugar4 | C23: 44±6 | D23: 60 | E23: =(29*44)/100 -> 12.76
B24: Apple, made without sugar4 | C24: 48±10 | D24: 60 | E24: =(18.78*48)/100 -> 9.0144000000000002
B25: Apple, oat, sultana, made from packet mix (Defiance Milling Co., Acacia Ridge, Qld, Australia) | C25: 54±4 | D25: 50 | E25: =(26*54)/100 -> 14.04
B26: Apricot, coconut and honey, made from packet mix (Defiance Milling Co., Australia) | C26: 60±4 | D26: 50 | E26: =(26*60)/100 -> 15.6
B27: Banana, oat and honey, made from packet mix (Defiance Milling Co., Australia) | C27: 65±11 | D27: 50 | E27: =(26*65)/100 -> 16.9
B28: Bran (Culinar Inc., Grandma Martin's Muffins, Aurora, Canada) | C28: 60 | D28: 57 | E28: =(24.26*60)/100 -> 14.556000000000001
B29: Blueberry (Culinar Inc., Canada) | C29: 59 | D29: 57 | E29: =(29.26*59)/100 -> 17.263400000000001
B30: Carrot (Culinar Inc., Canada) | C30: 62 | D30: 57 | E30: =(32.39*62)/100 -> 20.081800000000001
B31: Chocolate butterscotch, made from packet mix (Defiance Milling Co., Australia) | C31: 53±5 | D31: 50 | E31: 15
B32: Corn muffin, low-amylose5 | C32: 102 | D32: 57 | E32: =(29*102)/100 -> 29.58
B33: Corn muffin, high-amylose5 | C33: 49
B34: Oatmeal, muffin, made from mix (Quaker Oats Co. of Canada, Peterborough, Canada) | C34: 69 | D34: 50 | E34: =(34.58*69)/100 -> 23.860199999999999
A35: =A22+1 -> 15 | B35: Pancakes, prepared from shake mix (Green's General Foods, Glendenning, NSW, Australia) | C35: 67±5 | D35: 80 | E35: =(58*67)/100 -> 38.86
A36: =A35+1 -> 16 | B36: Pancakes, buckwheat, gluten-free, made from packet mix (Orgran Natural Foods, | C36: 102±11 | D36: 77 | E36: =(21.8*102)/100 -> 22.236000000000001
B37: Carrum Downs, Vic, Australia)
A38: =A36+1 -> 17 | B38: Pastry | C38: 59±6 | D38: 57 | E38: =(26.1*59)/100 -> 15.399000000000001
A39: =A38+1 -> 18 | B39: Pikelets, Golden brand (Tip Top Bakeries, Chatswood, NSW, Australia) | C39: 85±14 | D39: 40 | E39: =(21*85)/100 -> 17.85
A40: =A39+1 -> 19 | B40: Scones, plain, made from packet mix (Defiance Milling Co., Australia) | C40: 92±8 | D40: 25 | E40: 8
A41: =A40+1 -> 20 | B41: Waffles, Aunt Jemima (Quaker Oats Co. of Canada) | C41: 76 | D41: 35 | E41: =(13.06*76)/100 -> 9.9256000000000011
B43: BEVERAGES
A44: =A41+1 -> 21 | B44: Coca Cola ®
B45: Coca Cola®, soft drink (Coca Cola Amatil, Sydney, NSW, Australia) | C45: 53±7 | D45: 250 | E45: =(26.215*53)/100 -> 13.89395
B46: Coca Cola®, soft drink/soda (Coca Cola Bottling Company, Atlanta, GA, USA) | C46: =90*0.7 -> 63 | D46: 250 | E46: =(25.68*63)/100 -> 16.1784
B47: mean of two types | C47: 58±5
A48: =A44+1 -> 22 | B48: Cordial, orange, reconstituted (Berri Ltd., Berri, SA, Australia) | C48: 66±8 | D48: 250 | E48: =(20*66)/100 -> 13.2
A49: =A48+1 -> 23 | B49: Fanta®, orange soft drink (Coca Cola Amatil, Australia) | C49: 68±6 | D49: 250 | E49: =(33.5*68)/100 -> 22.78
A50: =A49+1 -> 24 | B50: Lucozade®, original (sparkling glucose drink) (Glaxo Wellcome Ltd., Uxbridge, Middlesex, UK) | C50: 95±10 | D50: 250 | E50: =(41.8*95)/100 -> 39.71
A51: =A50+1 -> 25 | B51: Smoothie, raspberry (Con Agra Inc., Omaha, NE, USA) | C51: 33±9 | D51: 250 | E51: =(41.243*33)/100 -> 13.610189999999999
A52: =A51+1 -> 26 | B52: Smoothie drink, soy, banana (So Natural Foods, Tarren Point, NSW, Australia)6 | C52: 30±3 | D52: 250 | E52: =(21.93*30)/100 -> 6.5789999999999997
A53: =A52+1 -> 27 | B53: Smoothie drink, soy, chocolate hazelnut (So Natural Foods, Australia)6 | C53: 34±3 | D53: 250 | E53: =(24.76*34)/100 -> 8.4184000000000001
A54: =A53+1 -> 28 | B54: Solo™, lemon squash, soft drink (Cadbury Schweppes, Sydney, NSW, Australia)6 | C54: 58±5 | D54: 250 | E54: =(29.262*58)/100 -> 16.971959999999999
A55: =A54+1 -> 29 | B55: Up & Go, cocoa malt flavor (soy milk, rice cereal liquid breakfast)6 | C55: 43±5 | D55: 250 | E55: =(26.415*43)/100 -> 11.358449999999999
B56: (Sanitarium Health Foods, Berkeley Vale, NSW, Australia)
A57: =A55+1 -> 30 | B57: Up & Go, original malt flavor (soy milk, rice cereal liquid breakfast)6 | C57: 46±5 | D57: 250 | E57: =(23.585*46)/100 -> 10.8491
B58: (Sanitarium Health Foods, Australia)
A59: =A57+1 -> 31 | B59: Xpress, chocolate (soy bean, cereal and legume extract drink with fructose)6 | C59: 39±2 | D59: 250 | E59: =(33.962*39)/100 -> 13.24518
B60: (So Natural Foods, Australia)
B61: Juices
A62: =A59+1 -> 32 | B62: Apple juice
B63: Apple juice, pure, unsweetened, reconstituted (Berri Ltd., Berri, SA, Australia) | C63: 39±5
B64: Apple juice, unsweetened | C64: 40
B65: Apple juice, unsweetened (Allens, Toronto, Canada) | C65: 41
B66: mean of three studies | C66: 40±1 | D66: 250 | E66: =(29.234*40)/100 -> 11.693600000000002
A67: =A62+1 -> 33 | B67: Apple juice, pure, clear, unsweetened (Wild About Fruit, Wandin, Vic, Australia) | C67: 44±2 | D67: 250 | E67: =(30.242*44)/100 -> 13.306480000000001
A68: =A67+1 -> 34 | B68: Apple juice, pure, cloudy, unsweetened (Wild About Fruit, Australia) | C68: 37±3 | D68: 250 | E68: =(28.226*37)/100 -> 10.443620000000001
A69: =A68+1 -> 35 | B69: Apple and cherry juice, pure, unsweetened (Wild About Fruit, Australia) | C69: 43±3 | D69: 250 | E69: =(33.266*43)/100 -> 14.304379999999998
A70: =A69+1 -> 36 | B70: Carrot juice, freshly made (Sydney, Australia)6 | C70: 43±3 | D70: 250 | E70: =(23.306*43)/100 -> 10.02158
A71: =A70+1 -> 37 | B71: Cranberry juice cocktail (Ocean Spray®, Melbourne, Vic, Australia) | C71: 52±3 | D71: 250 | E71: =(30.632*52)/100 -> 15.92864
A72: =A71+1 -> 38 | B72: Cranberry juice cocktail (Ocean Spray® Inc., Lakeville-Middleboro, MA, USA) | C72: 68±3 | D72: 250 | E72: =(35.573*68)/100 -> 24.189640000000001
A73: =A72+1 -> 39 | B73: Cranberry juice drink, Ocean Spray® (Gerber Ltd., Bridgewater, Somerset, UK) | C73: 56±4 | D73: 250 | E73: =(28.656*56)/100 -> 16.047359999999998
A74: =A73+1 -> 40 | B74: Grapefruit juice, unsweetened (Sunpac, Toronto, Canada) | C74: 48 | D74: 250 | E74: =(22.37*48)/100 -> 10.7376
A75: =A74+1 -> 41 | B75: Orange juice
B76: Orange Juice (Canada) | C76: 46±6
B77: Orange juice, unsweetened, reconstituted (Quelch®, Berri Ltd., Carlton, Vic, Australia) | C77: 53±6
B78: mean of two studies | C78: 50±4 | D78: 250 | E78: =(25.5*50)/100 -> 12.75
A79: =A75+1 -> 42 | B79: Pineapple juice, unsweetened (Dole Packaged Foods, Toronto, Canada) | C79: 46 | D79: 250 | E79: =(34*46)/100 -> 15.64
A80: =A79+1 -> 43 | B80: Tomato juice, canned, no added sugar (Berri Ltd., Berri, SA, Australia)6 | C80: 38±4 | D80: 250 | E80: =(9.216*38)/100 -> 3.5020799999999999
A81: =A80+1 -> 44 | B81: Yakult®, fermented milk drink with Lactobacilus casei (Yakult, Dandenong, Vic, Australia) | C81: 46±6 | D81: 65 | E81: =(12*46)/100 -> 5.52
B82: Sports drinks
A83: =A81+1 -> 45 | B83: Gatorade® (Spring Valley Beverages Pty Ltd., Cheltenham, Vic, Australia) | C83: 78±13 | D83: 250 | E83: =(15*78)/100 -> 11.7
A84: =A83+1 -> 46 | B84: Isostar® (Novartis Consumer Health, Nyon, Switzerland) | C84: 70±15 | D84: 250 | E84: 13
A85: =A84+1 -> 47 | B85: Sports Plus® (Berri Ltd., Berri, SA, Australia) | C85: 74±6 | D85: 250 | E85: 13
A86: =A85+1 -> 48 | B86: Sustagen Sport® (Mead Johnson, Rydalmere, NSW, Australia) | C86: 43±9 | D86: 250 | E86: =(49*43)/100 -> 21.07
B87: Drinks made from drinking mix powders
A88: =A86+1 -> 49 | B88: Build-Up™ nutrient-fortified drink, vanilla with fiber, (Nestlé, Sydney, NSW, Australia) | C88: 41±4 | D88: 250 | E88: =(32.93*41)/100 -> 13.501299999999999
A89: =A88+1 -> 50 | B89: Complete Hot Chocolate mix made with hot water (Nestlé, Australia) | C89: 51±3 | D89: 250 | E89: =(22.5*51)/100 -> 11.475
A90: =A89+1 -> 51 | B90: Hi-Pro energy drink mix, vanilla, containing soy protein and whey powder | C90: 36±3 | D90: 250 | E90: =(18.61*36)/100 -> 6.6996000000000002
B91: (Harrod foods, Sefton, NSW, Australia) mixed in reduced-fat (1.5%) cow's milk
A92: =A90+1 -> 52 | B92: Malted milk powder in full-fat cow's milk (Nestlé, Australia) | C92: 45±3 | D92: 250 | E92: =(26.438*45)/100 -> 11.8971
A93: =A92+1 -> 53 | B93: Milo™ (chocolate nutrient-fortified drink powder)
B94: Milo™ (Nestlé, Australia) dissolved in water | C94: 55±3 | D94: 250 | E94: =(15.568*55)/100 -> 8.5624000000000002
B95: Milo™ (Nestlé, Auckland, New Zealand) dissolved in water | C95: 52±5 | D95: 250 | E95: =(16.364*52)/100 -> 8.5092800000000004
B96: mean of two studies | C96: 54±2
B97: Milo™ (Nestlé, Australia) dissolved in full-fat cow's milk | C97: 35±2 | D97: 250 | E97: =(25.553*35)/100 -> 8.9435500000000001
B98: Milo™ (Nestlé, New Zealand) dissolved in full-fat cow's milk | C98: 36±3 | D98: 250 | E98: =(26.327*36)/100 -> 9.4777199999999997
B99: mean of two studies | C99: 36±1
A100: =A93+1 -> 54 | B100: Nutrimeal™, meal replacement drink, Dutch Chocolate (Usana, Salt Lake City, UT, USA) | C100: 26±3 | D100: 250 | E100: =(17.065*26)/100 -> 4.4369000000000005
A101: =A100+1 -> 55 | B101: Quik™ (sweet drink powder)
B102: Quik™, chocolate (Nestlé, Sydney, NSW, Australia), dissolved in water | C102: 53±5 | D102: 250 | E102: =(6.68*53)/100 -> 3.5403999999999995
B103: Quik™, chocolate (Nestlé, Australia), dissolved in 1.5% fat milk | C103: 41±4 | D103: 250 | E103: =(11.49*41)/100 -> 4.7109000000000005
B104: Quik™, strawberry (Nestlé, Australia), dissolved in water | C104: 64±8 | D104: 250 | E104: =(7.6336*64)/100 -> 4.8855040000000001
B105: Quik™, strawberry (Nestlé, Australia), dissolved in 1.5% fat milk | C105: 35±3 | D105: 250 | E105: =(12.408*35)/100 -> 4.3427999999999995
B107: BREADS
A108: =A101+1 -> 56 | B108: Bagel, white, frozen (Lender's Bakery, Montreal, Canada) | C108: 72 | D108: 70 | E108: 25
A109: =A108+1 -> 57 | B109: Baguette, white, plain (France) | C109: 95±15 | D109: 30 | E109: =(15.47*95)/100 -> 14.6965
A110: =A109+1 -> 58 | B110: French baguette with chocolate spread (France) | C110: 72±8 | D110: 70 | E110: =(37.31*72)/100 -> 26.863200000000003
A111: =A110+1 -> 59 | B111: French baguette with butter and strawberry jam (France) | C111: 62±7 | D111: 70 | E111: =(41.23*62)/100 -> 25.562599999999996
A112: =A111+1 -> 60 | B112: Pain au lait (Pasquier, France) | C112: 63±10 | D112: 60 | E112: =(32.1*63)/100 -> 20.223000000000003
A113: =A112+1 -> 61 | B113: Bread stuffing, Paxo (Campbell Soup Co Ltd., Toronto, Canada) | C113: 74 | D113: 30 | E113: =(21.33*74)/100 -> 15.784199999999998
B114: Barley Breads
A115: =A113+1 -> 62 | B115: Coarse barley kernel bread, 75-80% kernels
B116: 75% kernels | C116: 27 | D116: 30 | E116: =(19.71*27)/100 -> 5.3217000000000008
B117: 80% scalded intact kernels (20% white wheat flour) | C117: 34 | D117: 30 | E117: =(19.71*34)/100 -> 6.7013999999999996
B118: 80% intact kernels (20% white wheat flour) | C118: 40 | D118: 30 | E118: =(19.71*40)/100 -> 7.8840000000000012
B119: mean of three studies | C119: 34±4
A120: =A115+1 -> 63 | B120: Barley kernel bread, 50% kernels
B121: 50% kernels (Canada) | C121: 43 | D121: 30 | E121: =(20.43*43)/100 -> 8.7849000000000004
B122: 50% kibbled barley (Australia) | C122: 48 | D122: 30 | E122: =(20.43*48)/100 -> 9.8064
B123: mean of two studies | C123: 46±2 | D123: 30 | E123: =(20.43*46)/100 -> 9.3978000000000002
A124: =A120+1 -> 64 | B124: Sunflower and barley bread (Riga bakeries, Sydney, NSW, Australia) | C124: 57±6 | D124: 30 | E124: =(10.83*57)/100 -> 6.1731000000000007
A125: =A124+1 -> 65 | B125: Barley flour breads
B126: 100% barley flour (Canada); (rye bread composition) | C126: 67 | D126: 30 | E126: =(12.75*67)/100 -> 8.5425000000000004
B127: Wholemeal barley flour (80%) bread (20% white wheat flour) (Sweden) | C127: 67 | D127: 30 | E127: =(19.71*67)/100 -> 13.205700000000002
B128: Wholemeal barley bread, flat, thin, soft | C128: 50 | D128: 30 | E128: =(14.7*50)/100 -> 7.35
B129: (50% regular barley flour, 50% high-fibre barley flour) (Sweden)
B130: Wholemeal barley bread, flat, thin, soft | C130: 43 | D130: 30 | E130: =(11.46*43)/100 -> 4.9278000000000004
B131: (20% regular barley flour, 80% high-fibre barley flour) (Sweden)
A132: =A125+1 -> 66 | B132: Wholemeal barley flour (80%) and white wheat flour (20%) breads -
B133: fermented or with added organic acids or salts (Sweden)
B134: Wholemeal barley flour bread (used as reference for the 5 breads below)5 | C134: =100*0.7 -> 70 | D134: 30 | E134: =(19.714*70)/100 -> 13.799799999999999
B135: Wholemeal barley flour bread with sourdough (lactic acid)5 | C135: 53 | D135: 30 | E135: =(19.714*53)/100 -> 10.448419999999999
B136: Wholemeal barley flour bread with lactic acid5 | C136: 66 | D136: 30 | E136: =(18.86*66)/100 -> 12.4476
B137: Wholemeal barley flour bread with calcium lactate5 | C137: 59 | D137: 30 | E137: =(19.714*59)/100 -> 11.631259999999999
B138: Wholemeal barley flour bread with sodium propionate5 | C138: 65 | D138: 30 | E138: =(19.714*65)/100 -> 12.814099999999998
B139: Wholemeal barley flour bread with higher dose sodium propionate5 | C139: 57 | D139: 30 | E139: =(18.86*57)/100 -> 10.7502
B140: Buckwheat bread
A141: =A132+1 -> 67 | B141: Buckwheat bread, 50% dehusked buckwheat groats and 50% white wheat flour (Sweden) | C141: 47 | D141: 30 | E141: =(20.57*47)/100 -> 9.6678999999999995
B142: Fruit Breads
A143: =A141+1 -> 68 | B143: Bürgen™ Fruit loaf (Tip Top Bakeries, Chatswood, NSW, Australia) | C143: 44±5 | D143: 30 | E143: =(12.86*44)/100 -> 5.6583999999999994
A144: =A143+1 -> 69 | B144: Fruit and Spice Loaf, thick sliced (Buttercup bakeries, Moorebank, NSW, Australia) | C144: 54±6 | D144: 30 | E144: =(15.42*54)/100 -> 8.3267999999999986
A145: =A144+1 -> 70 | B145: Continental fruit loaf, wheat bread with dried fruit (Australia) | C145: 47±6 | D145: 30 | E145: =(15.43*47)/100 -> 7.2521000000000004
A146: =A145+1 -> 71 | B146: Happiness™ (cinnamon, raisin, pecan bread) (Natural Ovens, Mannitowoc, WI, USA) | C146: 63±5 | D146: 30 | E146: =(14.0625*63)/100 -> 8.859375
A147: =A146+1 -> 72 | B147: Muesli bread, made from packet mix in bread making machine (Con Agra Inc., USA) | C147: 54±6 | D147: 30 | E147: =(12.235*54)/100 -> 6.6068999999999996
A148: =A147+1 -> 73 | B148: Hamburger bun (Loblaw's, Toronto, Canada) | C148: 61 | D148: 30 | E148: =(15.09*61)/100 -> 9.2049000000000003
A149: =A148+1 -> 74 | B149: Kaiser rolls (Loblaw's, Canada) | C149: 73 | D149: 30 | E149: =(73*15.79)/100 -> 11.526699999999998
A150: =A149+1 -> 75 | B150: Melba toast, Old London (Best Foods Canada Inc., Etobicoke, Canada) | C150: 70 | D150: 30 | E150: =(22.98*70)/100 -> 16.086000000000002
B151: Gluten-free bread
A152: =A150+1 -> 76 | B152: Gluten-free multigrain bread (Country Life Bakeries, Dandenong, Vic, Australia) | C152: 79±13 | D152: 30 | E152: =(12.69*79)/100 -> 10.0251
A153: =A152+1 -> 77 | B153: Gluten-free white bread, unsliced (gluten-free wheat starch) (UK) | C153: 71 | D153: 30 | E153: =(14.85*71)/100 -> 10.5435
B154: Gluten-free white bread, sliced (gluten-free wheat starch) (UK) | C154: 80 | D154: 30 | E154: =(14.85*80)/100 -> 11.88
B155: mean of two studies | C155: 76±5 | D155: 30 | E155: =(14.85*76)/100 -> 11.286
A156: =A153+1 -> 78 | B156: Gluten-free fiber-enriched, unsliced (gluten-free wheat starch, soya bran) (UK) | C156: 69 | D156: 30 | E156: =(12.6*69)/100 -> 8.6939999999999991
B157: Gluten-free fiber-enriched, sliced (gluten-free wheat starch, soya bran) (UK) | C157: 76 | D157: 30 | E157: =(12.6*76)/100 -> 9.5760000000000005
B158: mean of two studies | C158: 73±4 | D158: 30 | E158: =(12.6*73)/100 -> 9.1980000000000004
B159: Oat Bread
A160: =A156+1 -> 79 | B160: Coarse oat kernel bread, 80% intact oat kernels and 20% white wheat flour (Sweden) | C160: 65 | D160: 30 | E160: =(19.17*65)/100 -> 12.460500000000001
B161: Oat bran bread
A162: =A160+1 -> 80 | B162: 50% oat bran (Australia) | C162: 44 | D162: 30 | E162: =(18.42*44)/100 -> 8.1048000000000009
A163: =A162+1 -> 81 | B163: 45% oat bran and 50% wheat flour (Sweden) | C163: 50 | D163: 30 | E163: =(18.42*50)/100 -> 9.21
B164: mean of two studies | C164: 47±3 | D164: 30 | E164: =(18.42*47)/100 -> 8.6574000000000009
B165: Rice bread
A166: =A163+1 -> 82 | B166: Rice bread, low-amylose Calrose rice (Pav's Allergy Bakery, Ingleburn, NSW, Australia) | C166: 72±9 | D166: 30 | E166: =(11.58*72)/100 -> 8.3376000000000001
A167: =A166+1 -> 83 | B167: Rice bread, high-amylose Doongara rice (Pav's Allergy Bakery, Australia) | C167: 61±9 | D167: 30 | E167: =(11.58*61)/100 -> 7.0637999999999996
B168: Rye Bread
A169: =A167+1 -> 84 | B169: Rye kernel (pumpernickel) bread
B170: Coarse rye kernel bread, 80% intact kernels and 20% white wheat flour (Sweden) | C170: 41 | D170: 30 | E170: =(12.3*41)/100 -> 5.0430000000000001
B171: Rye kernel bread (Pumpernickel) (Canada) | C171: 41 | D171: 30 | E171: =(12.3*41)/100 -> 5.0430000000000001
B172: Wholegrain pumpernickel (Holtzheuser Brothers Ltd., Toronto, Canada) | C172: 46 | D172: 30 | E172: =(11.364*46)/100 -> 5.2274400000000005
B173: Rye kernel bread, Pumpernickel (80% kernels) (Canada) | C173: 55 | D173: 30 | E173: =(12.3*55)/100 -> 6.7649999999999997
B174: Cocktail, sliced (Kasselar Food Products, Toronto, Canada) | C174: 55 | D174: 30 | E174: =(12.3*55)/100 -> 6.7649999999999997
B175: Cocktail, sliced (Kasselar Food Products, Canada) | C175: 62 | D175: 30 | E175: =(12.53*62)/100 -> 7.7686000000000002
B176: mean of six studies | C176: 50±4 | D176: 30 | E176: =(12.336*50)/100 -> 6.168000000000001
A177: =A169+1 -> 85 | B177: Wholemeal rye bread
B178: Wholemeal rye bread (Canada) | C178: 41
B179: Wholemeal rye bread (Canada) | C179: 62
B180: Wholemeal rye bread (Canada) | C180: 63
B181: Wholemeal rye bread (Canada) | C181: 66
B182: mean of four studies | C182: 58±6 | D182: 30 | E182: =(14.49*58)/100 -> 8.4041999999999994
B183: Specialty rye breads
A184: =A177+1 -> 86 | B184: Blackbread, Riga (Berzin's Specialty Bakery, Sydney, NSW, Australia) | C184: 76±14 | D184: 30 | E184: =(12.7*76)/100 -> 9.6519999999999992
A185: =A184+1 -> 87 | B185: Bürgen™ Dark/Swiss rye (Tip Top Bakeries, Australia) | C185: 55±12
B186: Bürgen™ Dark/Swiss rye (Tip Top Bakeries, Australia) | C186: 74±6
B187: mean of two studies | C187: 65±10 | D187: 30 | E187: =(10.125*65)/100 -> 6.5812499999999998
A188: =A185+1 -> 88 | B188: Klosterbrot wholemeal rye bread (Dimpflmeier Bakery Ltd., Canada) | C188: 67 | D188: 30 | E188: =(13.07*67)/100 -> 8.7568999999999999
A189: =A188+1 -> 89 | B189: Light rye (Silverstein's Bakery, Toronto, Canada) | C189: 68 | D189: 30 | E189: =(14.49*68)/100 -> 9.8532000000000011
A190: =A189+1 -> 90 | B190: Linseed rye (Rudolph's Specialty Bakery Ltd., Toronto, Canada) | C190: 55 | D190: 30 | E190: =(12.58*55)/100 -> 6.9189999999999996
A191: =A190+1 -> 91 | B191: Roggenbrot, Vogel's (Stevns & Co, Sydney, NSW, Australia) | C191: 59±5 | D191: 30 | E191: =(13.53*59)/100 -> 7.9826999999999995
A192: =A191+1 -> 92 | B192: Schinkenbrot, Riga (Berzin's Specialty Bakery, Sydney, NSW, Australia) | C192: 86±15 | D192: 30 | E192: =(13.53*86)/100 -> 11.6358
A193: =A192+1 -> 93 | B193: Sourdough rye (Canada) | C193: 57
B194: Sourdough rye (Australia) | C194: 48
B195: mean of two studies | C195: 53±5 | D195: 30 | E195: 6
A196: =A193+1 -> 94 | B196: Volkornbrot, wholemeal rye bread (Dimpflmeier Bakery Ltd., Canada) | C196: 56 | D196: 30 | E196: =(13.07*56)/100 -> 7.3192000000000004
B197: Wheat Breads
A198: =A196+1 -> 95 | B198: Coarse wheat kernel bread, 80% intact kernels and 20% white wheat flour (Sweden) | C198: 52 | D198: 30 | E198: =(19.835*52)/100 -> 10.314200000000001
A199: =A198+1 -> 96 | B199: Cracked wheat kernel (bulgur) bread
B200: 50% cracked wheat kernel (Canada) | C200: 58 | D200: 30 | E200: =(19.83*58)/100 -> 11.501399999999999
B201: 75% cracked wheat kernels (Canada) | C201: 48 | D201: 30 | E201: =(19.83*48)/100 -> 9.5183999999999997
B202: mean of two studies | C202: 53±3 | D202: 30 | E202: =(19.83*53)/100 -> 10.5099
B203: Spelt wheat breads
A204: =A199+1 -> 97 | B204: White spelt wheat bread9 (Slovenia) | C204: 74 | D204: 30 | E204: =(22.89*74)/100 -> 16.938600000000001
A205: =A204+1 -> 98 | B205: Wholemeal spelt wheat bread9 (Slovenia) | C205: =90*0.7 -> 63 | D205: 30 | E205: =(19.05*63)/100 -> 12.0015
A206: =A205+1 -> 99 | B206: Scalded spelt wheat kernel bread9 (Slovenia) | C206: 67 | D206: 30 | E206: =(22.29*67)/100 -> 14.934299999999999
A207: =A206+1 -> 100 | B207: Spelt multigrain bread® (Pav's bakery, Australia) | C207: 54±10 | D207: 30 | E207: =(12.12*54)/100 -> 6.5447999999999986
A208: =A207+1 -> 101 | B208: White wheat flour bread
B209: White flour (Canada) | C209: 69±5 | D209: 30 | E209: =(14.16*69)/100 -> 9.7704000000000004
B210: White flour (USA) | C210: 70 | D210: 30 | E210: =(14.16*70)/100 -> 9.9120000000000008
B211: White flour, Sunblest™ (Tip Top Bakeries, Australia) | C211: 70 | D211: 30 | E211: =(14.143*70)/100 -> 9.9001000000000001
B212: White flour (Dempster's Corporate Foods Ltd., Canada) | C212: 71 | D212: 30 | E212: =(14.257*71)/100 -> 10.12247
B213: White flour (South Africa) | C213: 71±7 | D213: 30 | E213: =(12.5*71)/100 -> 8.875
B214: White flour (Canada) | C214: 71 | D214: 30 | E214: =(14.257*71)/100 -> 10.12247
B215: mean of six studies | C215: 70±0 | D215: 30 | E215: =(13.913*70)/100 -> 9.7391000000000005
A216: =A208+1 -> 102 | B216: White wheat flour bread, hard, toasted (Italian) | C216: 73 | D216: 30 | E216: 11
A217: =A216+1 -> 103 | B217: Wonder™, enriched white bread (Interstate Brands Companies, Kansas City, MO, USA) | C217: 71±9
B218: Wonder™, enriched white bread (Interstate Brands Companies, USA) | C218: 72±4
B219: Wonder™, enriched white bread (Interstate Brands Companies, USA) | C219: 77±3
B220: mean of three studies | C220: 73±2 | D220: 30 | E220: =(14.08*73)/100 -> 10.2784
A221: =A217+1 -> 104 | B221: White Turkish bread (Turkey) | C221: 87 | D221: 30 | E221: =(16.8*87)/100 -> 14.616000000000001
B222: White bread with enzyme inhibitors
A223: =A221+1 -> 105 | B223: White bread + acarbose (200mg) (Mexico) | C223: 18 | D223: 30 | E223: =(16.67*18)/100 -> 3.0006000000000004
B224: White bread + acarbose (200mg) (Mexico) | C224: 50 | D224: 30 | E224: =(16.67*50)/100 -> 8.3350000000000009
B225: mean in two groups of subjects | C225: 34±16 | D225: 30 | E225: =(16.67*34)/100 -> 5.6678000000000006
A226: =A223+1 -> 106 | B226: White bread roll + 3 mg trestatin (pancreatic alpha-amylase inhibitor) (Switzerland)5 | C226: 48 | D226: 30 | E226: =(12.3*48)/100 -> 5.9040000000000008
A227: =A226+1 -> 107 | B227: White bread roll + 6 mg trestatin (Switzerland)5 | C227: 29 | D227: 30 | E227: =(12.3*29)/100 -> 3.5670000000000006
B228: White bread with soluble fiber
A229: =A227+1 -> 108 | B229: White bread + 15 g psyllium fiber (Plantago psyllium) (Mexico) | C229: 41 | D229: 30 | E229: =(16.67*41)/100 -> 6.8347000000000007
B230: White bread + 15 g psyllium fiber (Plantago psyllium) (Mexico) | C230: 65 | D230: 30 | E230: =(16.67*65)/100 -> 10.835500000000001
B231: mean in two groups of subjects | C231: 53±12 | D231: 30 | E231: =(16.67*53)/100 -> 8.8351000000000006
A232: =A229+1 -> 109 | B232: White bread eaten with vinegar as vinaigrette (Sweden) | C232: 45 | D232: 30 | E232: =(14.85*45)/100 -> 6.6825000000000001
A233: =A232+1 -> 110 | B233: White bread eaten with powdered dried seaweed (Nori alga) (Spain) | C233: 48 | D233: 30 | E233: =(14.85*48)/100 -> 7.1279999999999992
A234: =A233+1 -> 111 | B234: White bread containing Eurylon® high-amylose maize starch (France)12 | C234: =60*0.7 -> 42 | D234: 30 | E234: =(19.17*42)/100 -> 8.051400000000001
B235: White fiber-enriched bread
A236: =A234+1 -> 112 | B236: White, high-fiber (Dempster's Corporate Foods Ltd., Canada) | C236: 67
A237: =A236+1 -> 113 | B237: White, high-fiber (Weston's Bakery, Toronto, Canada) | C237: 69
B238: mean of two studies | C238: 68±1 | D238: 30 | E238: =(12.53*68)/100 -> 8.5204000000000004
B239: White resistant starch-enriched bread
A240: =A237+1 -> 114 | B240: Fibre White™ (Nature's Fresh, Auckland, New Zealand) | C240: 77±10 | D240: 30 | E240: =(14.59*77)/100 -> 11.234300000000001
A241: =A240+1 -> 115 | B241: Wonderwhite™ (Buttercup Bakeries, Australia) | C241: 80±8 | D241: 30 | E241: =(14.24*80)/100 -> 11.392000000000001
A242: =A241+1 -> 116 | B242: Wholemeal (whole wheat) wheat flour bread
B243: Wholemeal flour (Canada) | C243: 52 | D243: 30 | E243: =(11.76*52)/100 -> 6.1151999999999997
B244: Wholemeal flour (Canada) | C244: 64 | D244: 30 | E244: =(11.76*64)/100 -> 7.5263999999999998
B245: Wholemeal flour (Canada) | C245: 65 | D245: 30 | E245: =(11.76*65)/100 -> 7.6440000000000001
B246: Wholemeal flour (Canada) | C246: 67 | D246: 30 | E246: =(11.76*67)/100 -> 7.8792
B247: Wholemeal flour (Canada) | C247: 67 | D247: 30 | E247: =(11.76*67)/100 -> 7.8792
B248: Wholemeal flour (Canada) | C248: 69 | D248: 30 | E248: =(11.76*69)/100 -> 8.1143999999999998
B249: Wholemeal flour (Canada) | C249: 71 | D249: 30 | E249: =(11.76*71)/100 -> 8.3496000000000006
B250: Wholemeal flour (Canada) | C250: 72±6 | D250: 30 | E250: =(11.76*72)/100 -> 8.4672000000000001
B251: Wholemeal flour (USA)5 | C251: 73 | D251: 30 | E251: =(13.82*73)/100 -> 10.0886
B252: Wholemeal flour (South Africa) | C252: 75±9 | D252: 30 | E252: =(12.5*75)/100 -> 9.375
B253: Wholemeal flour (Tip Top Bakeries, Australia) | C253: 77±9 | D253: 30 | E253: =(11.7*77)/100 -> 9.0090000000000003
B254: Wholemeal flour (Tip Top Bakeries, Australia) | C254: 78±16 | D254: 30 | E254: =(11.7*78)/100 -> 9.1259999999999994
B255: Wholemeal flour (Kenya) | C255: 87 | D255: 30 | E255: =(12.5*87)/100 -> 10.875
B256: mean of thirteen studies | C256: 71± 2 | D256: 30 | E256: =(13.326*71)/100 -> 9.4614600000000006
A257: =A242+1 -> 117 | B257: Wholemeal Turkish bread | C257: 49 | D257: 30 | E257: =(16.2*49)/100 -> 7.9379999999999997
B258: Specialty wheat breads
A259: =A257+1 -> 118 | B259: Bürgen® Mixed Grain bread (Australia)
B260: Bürgen® Mixed Grain (Tip Top Bakeries, Chatswood, NSW, Australia) | C260: 34±4
B261: Bürgen® Mixed Grain | C261: 45±12
B262: Bürgen® Mixed Grain | C262: 69±6
B263: mean of three studies | C263: 49±10 | D263: 30 | E263: =(11.325*49)/100 -> 5.5492499999999998
A264: =A259+1 -> 119 | B264: Bürgen® Oat Bran & Honey Loaf with Barley (Tip Top Bakeries, Australia) | C264: 31±3 | D264: 30 | E264: =(10.125*31)/100 -> 3.1387499999999999
A265: =A264+1 -> 120 | B265: Bürgen® Soy-Lin, kibbled soy (8%) and linseed (8%) loaf (Tip Top Bakeries, Australia) | C265: 36±4 | D265: 30 | E265: =(8.925*36)/100 -> 3.2130000000000001
A266: =A265+1 -> 121 | B266: English Muffin™ bread (Natural Ovens, USA) | C266: 77±7 | D266: 30 | E266: =(14.12*77)/100 -> 10.872400000000001
A267: =A266+1 -> 122 | B267: Healthy Choice™ Hearty 7 Grain (Con Agra Inc., USA) | C267: 55±6 | D267: 30 | E267: =(14.2*55)/100 -> 7.81
A268: =A267+1 -> 123 | B268: Healthy Choice™ Hearty 100% Whole Grain (Con Agra Inc., USA) | C268: 62±6 | D268: 30 | E268: =(14.2*62)/100 -> 8.8040000000000003
A269: =A268+1 -> 124 | B269: Helga's™ Classic Seed Loaf (Quality Bakers, Sydney, NSW, Australia) | C269: 68±9 | D269: 30 | E269: =(13.67*68)/100 -> 9.2956000000000003
A270: =A269+1 -> 125 | B270: Helga's™ traditional wholemeal bread (Quality Bakers, Australia) | C270: 70±14 | D270: 30 | E270: =(13.3*70)/100 -> 9.31
A271: =A270+1 -> 126 | B271: Hunger Filler™, whole grain bread (Natural Ovens, USA) | C271: 59±8 | D271: 30 | E271: =(12.58*59)/100 -> 7.4222000000000001
A272: =A271+1 -> 127 | B272: Molenberg™ (Goodman Fielder, Auckland, New Zealand) | C272: 75±10
B273: Molenberg™ (Goodman Fielder, New Zealand) | C273: 84±8
B274: mean of two studies | C274: 80±5 | D274: 30 | E274: =(13.99*80)/100 -> 11.192
A275: =A272+1 -> 128 | B275: 9-Grain Multi-Grain (Tip Top Bakeries, Australia) | C275: 43±5 | D275: 30 | E275: =(14.14*43)/100 -> 6.0801999999999996
A276: =A275+1 -> 129 | B276: Multigrain Loaf, spelt wheat flour (Australia) | C276: 54±10 | D276: 30 | E276: 8
A277: =A276+1 -> 130 | B277: Multigrain (50% kibbled wheat grain) (Australia) | C277: 43 | D277: 30 | E277: =(13.92*43)/100 -> 5.9855999999999998
A278: =A277+1 -> 131 | B278: Nutty Natural™, whole grain bread (Natural Ovens, USA) | C278: 59±7 | D278: 30 | E278: =(12.35*59)/100 -> 7.2865000000000002
A279: =A278+1 -> 132 | B279: Performax™ (Country Life Bakeries, Dandenong, Vic, Australia) | C279: 38±3 | D279: 30 | E279: =(12.575*38)/100 -> 4.7784999999999993
A280: =A279+1 -> 133 | B280: Ploughman's™ Wholegrain, original recipe (Quality Bakers, Australia) | C280: 47 | D280: 30 | E280: =(14*47)/100 -> 6.58
A281: =A280+1 -> 134 | B281: Ploughman's™ Wholemeal, smooth milled (Quality Bakers, Australia) | C281: 64±10 | D281: 30 | E281: =(13.3*64)/100 -> 8.5120000000000005
A282: =A281+1 -> 135 | B282: Semolina Bread (Kenya) | C282: 64
A283: =A282+1 -> 136 | B283: Sourdough wheat (Australia) | C283: 54 | D283: 30 | E283: 8
A284: =A283+1 -> 137 | B284: Soy & Linseed bread (made from packet mix in bread maker) (Con Agra Inc., USA) | C284: 50±6 | D284: 30 | E284: =(10.2*50)/100 -> 5.1
A285: =A284+1 -> 138 | B285: Stay Trim™, whole grain bread (Natural Ovens, USA) | C285: 70±10 | D285: 30 | E285: =(14.52*70)/100 -> 10.164
A286: =A285+1 -> 139 | B286: Sunflower & Barley bread, Riga brand (Berzin's Specialty Bakery, Australia) | C286: 57±6 | D286: 30 | E286: =(12.75*57)/100 -> 7.2675000000000001
A287: =A286+1 -> 140 | B287: Vogel's Honey & Oats (Stevns & Co., Sydney, NSW, Australia) | C287: 55±5 | D287: 30 | E287: =(13.6*55)/100 -> 7.48
A288: =A287+1 -> 141 | B288: Vogel's Roggenbrot (Stevns & Co., Australia) | C288: 59±5 | D288: 30 | E288: =(13.53*59)/100 -> 7.9826999999999995
A289: =A288+1 -> 142 | B289: Whole-wheat snack bread (Ryvita Co Ltd., Poole, Dorset, UK) | C289: 74 | D289: 30 | E289: =(21.7*74)/100 -> 16.058
A290: =A289+1 -> 143 | B290: 100% Whole Grain™ bread (Natural Ovens, USA) | C290: 51±11 | D290: 30 | E290: =(13.24*51)/100 -> 6.7523999999999997
A291: =A290+1 -> 144 | B291: White wheat flour flatbread (Sweden) | C291: 79 | D291: 30 | E291: =(16.2375*79)/100 -> 12.827625000000001
B292: Unleavened Breads
A293: =A291+1 -> 145 | B293: Lebanese bread, white (Seda Bakery, Sydney, NSW, Australia) | C293: 75±9 | D293: 30 | E293: =(15.57*75)/100 -> 11.6775
A294: =A293+1 -> 146 | B294: Middle Eastern flatbread | C294: 97±29 | D294: 30 | E294: =(15.79*97)/100 -> 15.316299999999998
A295: =A294+1 -> 147 | B295: Pita bread, white (Canada) | C295: 57 | D295: 30 | E295: =(16.71*57)/100 -> 9.5247000000000011
A296: =A295+1 -> 148 | B296: Wheat flour flatbread (India) | C296: 66±9 | D296: 30 | E296: =(15.79*66)/100 -> 10.421399999999998
A297: =A296+1 -> 149 | B297: Amaranth : wheat (25:75) composite flour flatbread (India) | C297: 66±10 | D297: 30 | E297: =(14.82*66)/100 -> 9.7812000000000001
A298: =A297+1 -> 150 | B298: Amaranth : wheat (50:50) composite flour flatbread (India) | C298: 76±20 | D298: 30 | E298: =(14.82*76)/100 -> 11.263199999999999
B300: BREAKFAST CEREALS AND RELATED PRODUCTS
A301: =A298+1 -> 151 | B301: All-Bran™ (high-fiber, extruded wheat bran cereal)
B302: All-Bran™ (Kellogg's, Pagewood, NSW, Australia)13 | C302: 30 | D302: 30 | E302: =(14.6*30)/100 -> 4.38
B303: All-Bran™ (Kellogg's, Battle Creek, MI, USA) | C303: 38 | D303: 30 | E303: =(22.77*38)/100 -> 8.6525999999999996
B304: All-Bran™ (Kellogg's Inc., Etobicoke, Canada) | C304: 50 | D304: 30 | E304: =(22.77*38)/100 -> 8.6525999999999996
B305: All-Bran™ (Kellogg's Inc., Canada) | C305: 51±5 | D305: 30 | E305: =(22.77*38)/100 -> 8.6525999999999996
B306: mean of four studies | C306: 42±5
A307: =A301+1 -> 152 | B307: All-Bran Fruit 'n Oats™ (Kellogg's, Australia) | C307: 39 | D307: 30 | E307: =(17.47*39)/100 -> 6.813299999999999
A308: =A307+1 -> 153 | B308: All-Bran Soy 'n Fibre™ (Kellogg's, Australia) | C308: 33±3 | D308: 30 | E308: =(13.6*33)/100 -> 4.4880000000000004
A309: =A308+1 -> 154 | B309: Amaranth (Amaranthus esculentum) popped, | C309: 97±19 | D309: 30 | E309: =(19*97)/100 -> 18.43
B310: eaten with milk and non-nutritive sweetener (India)
B311: Barley porridge
A312: =A309+1 -> 155 | B312: Wholemeal barley flour porridge (100% regular barley) | C312: 68 | D312: 50 (dry) | E312: =(34.05*68)/100 -> 23.153999999999996
B313: (flour:water = 1:3), boiled 2.5 min (Sweden)
A314: =A312+1 -> 156 | B314: Wholemeal high-fibre barley flour porridge | C314: 55 | D314: 50 (dry) | E314: =(15.45*55)/100 -> 8.4975000000000005
B315: (50% regular barley flour: 50% high-fibre barley flour) (Sweden)
A316: =A314+1 -> 157 | B316: Barley porridge made from steamed thin (0.5 mm) dehulled barley flakes (Sweden) | C316: 62 | D316: 50 (dry) | E316: =(28.2*62)/100 -> 17.483999999999998
A317: =A316+1 -> 158 | B317: Barley porridge made from steamed thick (1.0 mm) dehulled barley flakes (Sweden) | C317: 65 | D317: 50 (dry) | E317: =(28.2*65)/100 -> 18.33
A318: =A317+1 -> 159 | B318: Bran Buds™ (Kellogg's Inc., Canada)15 | C318: 58 | D318: 30 | E318: =(12*58)/100 -> 6.96
A319: =A318+1 -> 160 | B319: Bran Buds with psyllium (Kellogg's Inc., Canada)15 | C319: 47 | D319: 30 | E319: =(12.15*47)/100 -> 5.7105000000000006
A320: =A319+1 -> 161 | B320: Bran Chex™ (Nabisco Brands Ltd., Toronto, Canada)15 | C320: 58 | D320: 30 | E320: =(19.05*58)/100 -> 11.049000000000001
A321: =A320+1 -> 162 | B321: Bran Flakes™ (Kellogg's, Australia) | C321: 74 | D321: 30 | E321: =(17.8*74)/100 -> 13.172000000000001
A322: =A321+1 -> 163 | B322: Cheerios™ (General Mills Inc., Etobicoke, Canada)15 | C322: 74 | D322: 30 | E322: =(20.22*74)/100 -> 14.9628
A323: =A322+1 -> 164 | B323: Chocapic™ (Nestlé, France) | C323: 84±9 | D323: 30 | E323: =(25.2*84)/100 -> 21.167999999999996
A324: =A323+1 -> 165 | B324: Coco Pops™ (cocoa flavoured puffed rice)
B325: Coco Pops™ (Kellogg's, Australia) | C325: 77±8
B326: Coco Pops™ (Kellogg's, Australia) | C326: 77±3
B327: mean of two studies | C327: 77 | D327: 30 | E327: =(26.2*77)/100 -> 20.173999999999999
A328: =A324+1 -> 166 | B328: Corn Bran™ (Quaker Oats Co. of Canada, Peterborough, Canada)15 | C328: 75 | D328: 30 | E328: =(20.3*75)/100 -> 15.225
A329: =A328+1 -> 167 | B329: Corn Chex™ (Nabisco Brands Ltd., Canada)15 | C329: 83 | D329: 30 | E329: =(25.19*83)/100 -> 20.907699999999998
A330: =A329+1 -> 168 | B330: Cornflakes™
B331: Cornflakes™ (Kellogg's, Auckland, New Zealand) | C331: 72±16 | D331: 30 | E331: =(25.4*72)/100 -> 18.288
B332: Cornflakes™ (Kellogg's, Australia) | C332: 77 | D332: 30 | E332: =(25.4*77)/100 -> 19.558
B333: Cornflakes™ (Kellogg's Inc., Canada) | C333: 80±6 | D333: 30 | E333: =(25.947*80)/100 -> 20.757599999999996
B334: Cornflakes™ (Kellogg's Inc., Canada) | C334: 86 | D334: 30 | E334: =(25.947*86)/100 -> 22.314419999999998
B335: Cornflakes™ (Kellogg's, USA)5 | C335: 92 | D335: 30 | E335: =(25.947*92)/100 -> 23.871239999999997
B336: mean of five studies | C336: 81±3 | D336: 30 | E336: =(25.7282*81)/100 -> 20.839841999999997
A337: =A330+1 -> 169 | B337: Cornflakes, high-fiber (Presidents Choice, Sunfresh Ltd., Toronto, Canada)15 | C337: 74 | D337: 30 | E337: =(22.56*74)/100 -> 16.694399999999998
A338: =A337+1 -> 170 | B338: Cornflakes, Crunchy Nut™ (Kellogg's, Australia) | C338: 72±4 | D338: 30 | E338: =(23.9*72)/100 -> 17.207999999999998
A339: =A338+1 -> 171 | B339: Corn Pops™ (Kellogg's, Australia) | C339: 80±4 | D339: 30 | E339: =(26.2*80)/100 -> 20.96
A340: =A339+1 -> 172 | B340: Cream of Wheat™ (Nabisco Brands Ltd., Canada)15 | C340: 66 | D340: 250 | E340: =(25.75*66)/100 -> 16.995000000000001
A341: =A340+1 -> 173 | B341: Cream of Wheat™, Instant (Nabisco Brands Ltd., Canada)15 | C341: 74 | D341: 250 | E341: =(29.75*74)/100 -> 22.015000000000001
A342: =A341+1 -> 174 | B342: Crispix™ (Kellogg's Inc., Canada)15 | C342: 87 | D342: 30 | E342: =(25.2*87)/100 -> 21.923999999999999
A343: =A342+1 -> 175 | B343: Energy Mix™ (Quaker, France) | C343: 80±7 | D343: 30 | E343: =(24.1*80)/100 -> 19.28
A344: =A343+1 -> 176 | B344: Froot Loops™ (Kellogg's, Australia) | C344: 69±9 | D344: 30 | E344: =(26*69)/100 -> 17.94
A345: =A344+1 -> 177 | B345: Frosties™, sugar-coated cornflakes (Kellogg's, Australia) | C345: 55 | D345: 30 | E345: =(26.4*55)/100 -> 14.52
A346: =A345+1 -> 178 | B346: Fruitful Lite™ (Hubbards, Auckland, New Zealand) | C346: 61±20 | D346: 30 | E346: 12
A347: =A346+1 -> 179 | B347: Fruity-Bix™, berry (Sanitarium, Auckland, New Zealand) | C347: 113±10 | D347: 30 | E347: =(21.75*113)/100 -> 24.577500000000001
A348: =A347+1 -> 180 | B348: Golden Grahams™ (General Mills Inc., Canada)15 | C348: 71 | D348: 30 | E348: =(24.759*71)/100 -> 17.578890000000001
A349: =A348+1 -> 181 | B349: Golden Wheats™ (Kellogg's, Australia) | C349: 71±8 | D349: 30 | E349: 16
A350: =A349+1 -> 182 | B350: Grapenuts™
B351: Grapenuts™ (Post, Kraft General Foods Inc., Toronto, Canada)15 | C351: 67 | D351: 30 | E351: =(19.364*67)/100 -> 12.973880000000001
B352: Grapenuts™ (Kraft Foods Inc., Port Chester, NY, USA) | C352: 75±6 | D352: 30 | E352: =(21.78*75)/100 -> 16.335000000000001
B353: mean of two studies | C353: 71±4 | D353: 30 | E353: =(20.572*71)/100 -> 14.606119999999999
A354: =A350+1 -> 183 | B354: Grapenuts™ Flakes (Post, Kraft General Foods Inc., Canada)15 | C354: 80 | D354: 30 | E354: =(21.81*80)/100 -> 17.448
A355: =A354+1 -> 184 | B355: Guardian™ (Kellogg's, Australia) | C355: 37±9 | D355: 30 | E355: =(12.41*37)/100 -> 4.5917000000000003
A356: =A355+1 -> 185 | B356: Healthwise™ for bowel health (Uncle Toby's, Wahgunyah, Vic, Australia) | C356: 66±9 | D356: 30 | E356: =(18.3*66)/100 -> 12.077999999999999
A357: =A356+1 -> 186 | B357: Healthwise™ for heart health (Uncle Toby's, Australia) | C357: 48±5 | D357: 30 | E357: =(18.6*48)/100 -> 8.9280000000000008
A358: =A357+1 -> 187 | B358: Honey Rice Bubbles™ (Kellogg's, Australia) | C358: 77±4 | D358: 30 | E358: =(26.6*77)/100 -> 20.482000000000003
A359: =A358+1 -> 188 | B359: Honey Smacks™ (Kellogg's, Australia) | C359: 71±10 | D359: 30 | E359: 16
A360: =A359+1 -> 189 | B360: Hot cereal, apple & cinnamon (Con Agra Inc., USA) | C360: 37±6 | D360: 30 | E360: =(22.0625*37)/100 -> 8.1631250000000009
A361: =A360+1 -> 190 | B361: Hot cereal, unflavoured (Con Agra Inc., USA) | C361: 25±5 | D361: 30 | E361: =(19.46*25)/100 -> 4.8650000000000002
A362: =A361+1 -> 191 | B362: Just Right™ (Kellogg's, Australia) | C362: 60±15 | D362: 30 | E362: =(21.53*60)/100 -> 12.918000000000001
A363: =A362+1 -> 192 | B363: Just Right Just Grains™ (Kellogg's, Australia) | C363: 62±11 | D363: 30 | E363: =(23.3*62)/100 -> 14.446000000000002
A364: =A363+1 -> 193 | B364: Komplete™ (Kellogg's, Australia) | C364: 48±5 | D364: 30 | E364: =(20.87*48)/100 -> 10.0176
A365: =A364+1 -> 194 | B365: Life™ (Quaker Oats Co., Canada)15 | C365: 66 | D365: 30 | E365: 16
A366: =A365+1 -> 195 | B366: Mini Wheats™, whole wheat (Kellogg's, Australia) | C366: 58±8 | D366: 30 | E366: =(20.9*58)/100 -> 12.121999999999998
A367: =A366+1 -> 196 | B367: Mini Wheats™, blackcurrant (Kellogg's, Australia) | C367: 72±10 | D367: 30 | E367: =(21.4*72)/100 -> 15.407999999999999
B368: Muesli
A369: =A367+1 -> 197 | B369: Muesli, NS (Canada) | C369: 66±9 | D369: 30 | E369: 16
A370: =A369+1 -> 198 | B370: Alpen Muesli (Wheetabix, France) | C370: 55±10 | D370: 30 | E370: =(18.9*55)/100 -> 10.395
A371: =A370+1 -> 199 | B371: Muesli, gluten-free (Freedom Foods, Cheltenham, Vic, Australia) with 1.5% fat milk | C371: 39±6 | D371: 30 | E371: =(19*39)/100 -> 7.41
A372: =A371+1 -> 200 | B372: Muesli, Lite (Sanitarium, New Zealand) | C372: 54±12 | D372: 30 | E372: =(17.7*54)/100 -> 9.5579999999999998
A373: =A372+1 -> 201 | B373: Muesli, Natural (Sanitarium, New Zealand) | C373: 57±9 | D373: 30 | E373: =(18.97*57)/100 -> 10.812899999999999
A374: =A373+1 -> 202 | B374: Muesli, Natural (Sanitarium, Australia) | C374: 40±6 | D374: 30 | E374: =(18.97*40)/100 -> 7.5879999999999992
B375: mean of two studies | C375: 49±9 | D375: 30 | E375: =(19.59*49)/100 -> 9.5991
A376: =A374+1 -> 203 | B376: Muesli, No Name (Sunfresh Ltd., Toronto, Canada)15 | C376: 60 | D376: 30 | E376: =(17.75*60)/100 -> 10.65
A377: =A376+1 -> 204 | B377: Muesli, Swiss Formula (Uncle Toby's, Australia) | C377: 56±8 | D377: 30 | E377: =(16.4*56)/100 -> 9.1839999999999993
A378: =A377+1 -> 205 | B378: Muesli, toasted (Purina, Sydney, NSW, Australia) | C378: 43+4 | D378: 30 | E378: =(16.53*43)/100 -> 7.1079000000000008
A379: =A378+1 -> 206 | B379: Nutrigrain™ (Kellogg's, Australia) | C379: 66±12 | D379: 30 | E379: =(15*66)/100 -> 9.9
A380: =A379+1 -> 207 | B380: Oat 'n Honey Bake™ (Kellogg's, Australia) | C380: 77±11 | D380: 30 | E380: =(17*77)/100 -> 13.09
A381: =A380+1 -> 208 | B381: Oat bran
B382: Oat bran, raw (Quaker Oats Co., Canada)15 | C382: 50 | D382: 10 | E382: =(4.966*50)/100 -> 2.4830000000000001
B383: Oat bran, raw | C383: 59 | D383: 10 | E383: =(4.966*59)/100 -> 2.9299400000000002
B384: mean of two studies | C384: 55±5 | D384: 10 | E384: 3
A385: =A381+1 -> 209 | B385: Porridge made from rolled oats
B386: Porridge (Uncle Toby's, Australia)13 | C386: 42 | D386: 250 | E386: =(21.25*42)/100 -> 8.9250000000000007
B387: Porridge (Canada)16 | C387: 49±8 | D387: 250 | E387: =(22.75*49)/100 -> 11.147500000000001
B388: Traditional porridge oats (Lowan Whole Foods, Box Hill, Vic, Australia) | C388: 51±8 | D388: 250 | E388: =(21.25*51)/100 -> 10.8375
B389: Porridge (Hubbards, New Zealand) | C389: 58±9 | D389: 250 | E389: =(21.25*58)/100 -> 12.324999999999999
B390: Porridge (Australia) | C390: 58±4 | D390: 250 | E390: =(21.25*58)/100 -> 12.324999999999999
B391: Porridge (Canada) | C391: 62 | D391: 250 | E391: =(22.75*62)/100 -> 14.105
B392: Porridge (Canada) | C392: 69 | D392: 250 | E392: =(22.75*69)/100 -> 15.6975
B393: Porridge (USA)6 | C393: 75 | D393: 250 | E393: =(22.75*75)/100 -> 17.0625
B394: mean of eight studies | C394: 58±4 | D394: 250 | E394: =(22*58)/100 -> 12.76
A395: =A385+1 -> 210 | B395: Wholemeal oat flour porridge (flour:water = 1:3), boiled 2.5 min (Sweden) | C395: 74 | D395: 50 (dry) | E395: =(31.85*74)/100 -> 23.569000000000003
A396: =A395+1 -> 211 | B396: Oat porridge made from thick (1.0 mm) dehulled oat flakes (Sweden) | C396: 55 | D396: 250 | E396: =(27*55)/100 -> 14.85
A397: =A396+1 -> 212 | B397: Oat porridge made from roasted thin (0.5 mm) dehulled oat flakes (Sweden) | C397: 69 | D397: 250 | E397: =(27*69)/100 -> 18.63
A398: =A397+1 -> 213 | B398: Oat porridge made from roasted thick (1.0 mm) dehulled oat flakes (Sweden) | C398: 50 | D398: 250 | E398: =(27*50)/100 -> 13.5
A399: =A398+1 -> 214 | B399: Oat porridge made from roasted and steamed thin (0.5 mm) dehulled oat flakes (Sweden) | C399: 80 | D399: 250 | E399: =(27*80)/100 -> 21.6
A400: =A399+1 -> 215 | B400: Oat porridge made from steamed thick (1.0 mm) dehulled oat flakes (Sweden) | C400: 53 | D400: 250 | E400: =(27*53)/100 -> 14.31
A401: =A400+1 -> 216 | B401: Instant Porridge
B402: Quick Oats (Quaker Oats Co., Canada) | C402: 65
B403: One Minute Oats (Quaker Oats Co., Canada)15 | C403: 66
B404: mean of two studies | C404: 66±1 | D404: 250 | E404: =(25.5*66)/100 -> 16.83
A405: =A401+1 -> 217 | B405: Pop Tarts™, Double Chocolate (Kellogg's, Australia) | C405: 70±2 | D405: 50 | E405: =(35.5*70)/100 -> 24.85
A406: =A405+1 -> 218 | B406: Pro Stars™ (General Mills Inc., Canada)15 | C406: 71 | D406: 30 | E406: =(23.51*71)/100 -> 16.6921
A407: =A406+1 -> 219 | B407: Puffed Wheat
B408: Puffed Wheat (Quaker Oats Co., Canada)15 | C408: 67 | D408: 30 | E408: =(20.096*67)/100 -> 13.464320000000001
B409: Puffed Wheat (Sanitarium, Australia) | C409: 80±11 | D409: 30 | E409: =(21*80)/100 -> 16.8
B410: mean of two studies | C410: 74±7 | D410: 30 | E410: =(21*74)/100 -> 15.54
A411: =A407+1 -> 220 | B411: Raisin Bran™ (Kellogg's, USA) | C411: 61±5 | D411: 30 | E411: =(19.18*61)/100 -> 11.6998
A412: =A411+1 -> 221 | B412: Red River Cereal (Maple Leaf Mills, Toronto, Canada) | C412: 49 | D412: 30 | E412: 11
A413: =A412+1 -> 222 | B413: Rice Bran, extruded (Rice Growers Co-Operative Ltd., Leeton, NSW, Australia) | C413: 19±3 | D413: 30 | E413: =(14.22*19)/100 -> 2.7018
A414: =A413+1 -> 223 | B414: Rice Bubbles™ (puffed rice)
B415: Rice Bubbles™ (Kellogg's, Australia)13 | C415: 81
B416: Rice Bubbles™ (Kellogg's, Australia) | C416: 85±3
B417: Rice Bubbles™ (Kellogg's, Australia) | C417: 95
B418: mean of three studies | C418: 87±4 | D418: 30 | E418: =(25.7*87)/100 -> 22.359000000000002
A419: =A414+1 -> 224 | B419: Rice Chex™ (Nabisco Brands Ltd., Canada)15 | C419: 89 | D419: 30 | E419: =(26.13*89)/100 -> 23.255699999999997
A420: =A419+1 -> 225 | B420: Rice Krispies™ (Kellogg's Inc., Canada)15 | C420: 82 | D420: 30 | E420: 21
A421: =A420+1 -> 226 | B421: Shredded Wheat | D421: 30 | E421: 22
B422: Shredded Wheat (Canada) | C422: 67±10 | D422: 30 | E422: =(19.99*67)/100 -> 13.3933
B423: Shredded Wheat™ (Nabisco Brands Ltd., Canada)15 | C423: 83 | D423: 30 | E423: =(19.99*83)/100 -> 16.591699999999999
B424: mean of two studies | C424: 75±8 | D424: 30 | E424: =(19.99*75)/100 -> 14.9925
B425: Special K™ - formulation of this cereal varies in different countries
A426: =A421+1 -> 227 | B426: Special K™ (Kellogg's, Australia) | C426: 54±4 | D426: 30 | E426: =(21*54)/100 -> 11.34
A427: =A426+1 -> 228 | B427: Special K™ (Kellogg's, USA) | C427: 69±5 | D427: 30 | E427: =(20.79*69)/100 -> 14.3451
A428: =A427+1 -> 229 | B428: Special K™ (Kellogg's, France) | C428: 84±12 | D428: 30 | E428: =(23.6*84)/100 -> 19.824000000000002
A429: =A428+1 -> 230 | B429: Soy Tasty™ (flaked grains, soy nuts, dried fruit) (Sanitarium, Australia) | C429: 60±5 | D429: 30 | E429: =(19.73*60)/100 -> 11.837999999999999
A430: =A429+1 -> 231 | B430: Soytana™, Vogel's, soy and linseed bran crunch with sultanas (20.1 g fiber per 100 g), | C430: 49±3 | D430: 45 | E430: =(25.2*49)/100 -> 12.347999999999999
B431: (Specialty Cereals, Mt Kuring-gai, NSW, Australia)
A432: =A430+1 -> 232 | B432: Sultana Bran™ (Kellogg's, Australia) | C432: 73±13 | D432: 30 | E432: =(18.73*73)/100 -> 13.6729
A433: =A432+1 -> 233 | B433: Sustain™ (Kellogg's, Australia)13 | C433: 68 | D433: 30 | E433: =(21.73*68)/100 -> 14.776400000000001
A434: =A433+1 -> 234 | B434: Team™ (Nabisco Brands Ltd., Canada)15 | C434: 82 | D434: 30 | E434: 17
A435: =A434+1 -> 235 | B435: Thank Goodness™ (Hubbards, New Zealand) | C435: 65±18 | D435: 30 | E435: 15
A436: =A435+1 -> 236 | B436: Total™ (General Mills Inc., Canada)15 | C436: 76 | D436: 30 | E436: 17
A437: =A436+1 -> 237 | B437: Ultra-bran™, Vogel's, soy and linseed extruded wheat bran cereal (30.2 g fiber per 100 g) | C437: 41±4 | D437: 30 | E437: =(12.6*41)/100 -> 5.1660000000000004
B438: (Specialty Cereals, Australia)
A439: =A437+1 -> 238 | B439: Wheat-bites™ (Uncle Toby's, Australia) | C439: 72±11 | D439: 30 | E439: =(25.4*72)/100 -> 18.288
A440: =A439+1 -> 239 | B440: Wheat biscuits (plain flaked wheat)
B441: Vita-Brits™ (Uncle Toby's, Australia)13 | C441: 61 | D441: 30 | E441: =(19.8*61)/100 -> 12.077999999999999
B442: Vita-Brits™ (Uncle Toby's, Australia) | C442: 68±6 | D442: 30 | E442: =(19.8*68)/100 -> 13.464
B443: Weet-Bix™ (Sanitarium, Australia) | C443: 69 | D443: 30 | E443: =(16.7*69)/100 -> 11.523
B444: Weet-Bix™ (Sanitarium, Australia) | C444: 69±4 | D444: 30 | E444: =(16.7*69)/100 -> 11.523
B445: Weetabix™ (Weetabix of Canada Ltd., Thornhill, Canada)15 | C445: 74 | D445: 30 | E445: =(21.592*74)/100 -> 15.97808
B446: Weetabix™ (Weetabix of Canada Ltd.) | C446: 75±10 | D446: 30 | E446: =(21.592*75)/100 -> 16.193999999999999
B447: Whole wheat Goldies™ (Kellogg's, Australia) | C447: 70±4 | D447: 30 | E447: 14
B448: mean of seven studies | C448: 70±2 | D448: 30 | E448: =(18.598*70)/100 -> 13.018599999999999
B449: Wheat biscuits (flaked wheat) with additional ingredients
A450: =A440+1 -> 240 | B450: Good Start™, muesli wheat biscuits (Sanitarium, Australia) | C450: 68±4 | D450: 30 | E450: =(19.9375*68)/100 -> 13.557499999999999
A451: =A450+1 -> 241 | B451: Hi-Bran Weet-Bix™, wheat biscuits with extra wheat bran (Sanitarium, Australia) | C451: 61±4 | D451: 30 | E451: =(16.5*61)/100 -> 10.065
A452: =A451+1 -> 242 | B452: Hi-Bran Weet-Bix™ with soy and linseed (Sanitarium, Australia) | C452: 57±3 | D452: 30 | E452: =(16.3*57)/100 -> 9.2910000000000004
A453: =A452+1 -> 243 | B453: Honey Goldies™ (Kellogg's Australia) | C453: 72±3 | D453: 30 | E453: =(21*72)/100 -> 15.12
A454: =A453+1 -> 244 | B454: Lite-Bix™, plain, no added sugar (Sanitarium, Australia) | C454: 70±3 | D454: 30 | E454: =(19.9*70)/100 -> 13.93
A455: =A454+1 -> 245 | B455: Oat bran Weet-Bix™ (Sanitarium, Australia) | C455: 57±4 | D455: 30 | E455: =(20*57)/100 -> 11.4
A456: =A455+1 -> 246 | B456: Sultana Goldies™ (Kellogg's Australia) | C456: 65±6 | D456: 30 | E456: =(20.5*65)/100 -> 13.324999999999999
B458: BREAKFAST CEREAL BARS
A459: =A456+1 -> 247 | B459: Crunchy Nut Cornflakes™ bar (Kellogg's, Australia) | C459: 72±6 | D459: 30 | E459: =(26*72)/100 -> 18.72
A460: =A459+1 -> 248 | B460: Fibre Plus™ bar (Uncle Toby's, Australia) | C460: 78±9 | D460: 30 | E460: =(23.0233*78)/100 -> 17.958174
A461: =A460+1 -> 249 | B461: Fruity-Bix™ bar, fruit and nut, wheat biscuit cereal with dried fruit and nuts | C461: 56±4 | D461: 30 | E461: =(18.6*56)/100 -> 10.416000000000002
B462: with yoghurt coating (Sanitarium, Australia)
A463: =A461+1 -> 250 | B463: Fruity-Bix™ bar, wild berry, wheat biscuit cereal with fruit and covered with | C463: 51±4 | D463: 30 | E463: =(18.6*51)/100 -> 9.4860000000000007
B464: yoghurt coating (Sanitarium, Australia)
A465: =A463+1 -> 251 | B465: K-Time Just Right™ bar (Kellogg's, Australia) | C465: 72±4 | D465: 30 | E465: =(23.64*72)/100 -> 17.020799999999998
A466: =A465+1 -> 252 | B466: K-Time Strawberry Crunch™ bar (Kellogg's, Australia) | C466: 77±5 | D466: 30 | E466: =(24.783*77)/100 -> 19.082910000000002
A467: =A466+1 -> 253 | B467: Rice Bubble Treat™ bar (Kellogg's, Australia) | C467: 63±11 | D467: 30 | E467: =(23.73*63)/100 -> 14.9499
A468: =A467+1 -> 254 | B468: Sustain™ bar (Kellogg's, Australia) | C468: 57±10 | D468: 30 | E468: =(24.82*57)/100 -> 14.147399999999999
B470: CEREAL GRAINS
B471: Amaranth
A472: =A468+1 -> 255 | B472: Amaranth (Amaranthus esculentum) popped, | C472: 97±19 | D472: 30 | E472: 21
B473: eaten with milk and non-nutritive sweetener (India)
B474: Barley
A475: =A472+1 -> 256 | B475: Pearl Barley
B476: Barley, pearled (Canada) | C476: 22
B477: Barley (Canada) | C477: 22
B478: Barley, pot, boiled in salted water 20 min (Gouda's foods, Concord, Canada) | C478: 25±2
B479: Barley (Canada) | C479: 27
B480: Barley, pearled (Canada) | C480: 29
B481: mean of five studies | C481: 25±1 | D481: 150 | E481: =(42.33*25)/100 -> 10.5825
A482: =A475+1 -> 257 | B482: Barley (Hordeum vulgare) (India) | C482: 37
B483: Barley (Hordeum vulgare) (India) | C483: 48
B484: mean of two groups of subjects | C484: 43±6 | D484: 150 | E484: =(42.33*61)/100 -> 25.821300000000001
A485: =A482+1 -> 258 | B485: Barley, cracked (Malthouth, Tunisia) | C485: 50 | D485: 150 | E485: =(42.49*50)/100 -> 21.245000000000001
A486: =A485+1 -> 259 | B486: Barley, rolled (Australia) | C486: 66±5 | D486: 50 (dry) | E486: =(38.46*66)/100 -> 25.383600000000001
A487: =A486+1 -> 260 | B487: Buckwheat
B488: Buckwheat (Canada) | C488: 49
B489: Buckwheat (Canada) | C489: 51±10
B490: Buckwheat (Canada) | C490: 63
B491: mean of three studies | C491: 54±4 | D491: 150 | E491: =(29.82*54)/100 -> 16.102799999999998
A492: =A487+1 -> 261 | B492: Buckwheat groats, hydrothermally treated, dehusked, boiled 12 min (Sweden) | C492: 45 | D492: 150 | E492: =(29.82*45)/100 -> 13.419
B493: Corn/Maize
A494: =A492+1 -> 262 | B494: Maize (Zea Mays), flour made into chapatti (India) | C494: 59
A495: =A494+1 -> 263 | B495: Maize meal porridge/gruel (Kenya) | C495: 109
A496: =A495+1 -> 264 | B496: Cornmeal
B497: Cornmeal, boiled in salted water 2 min (McNair Products Co. Ltd., Toronto, Canada) | C497: 68 | D497: 150 | E497: =(12.9*68)/100 -> 8.7720000000000002
B498: Cornmeal + margarine (McNair Products Co. Ltd., Canada) | C498: 69 | D498: 150 | E498: =(12.45*69)/100 -> 8.5904999999999987
B499: mean of two studies | C499: 69±1 | D499: 150 | E499: 9
A500: =A496+1 -> 265 | B500: Sweet corn
B501: Sweet corn, 'Honey & Pearl' variety (New Zealand) | C501: 37±12 | D501: 150 | E501: =(29.83*37)/100 -> 11.037100000000001
B502: Sweet corn, on the cob, boiled 20 min (Australia) | C502: 48 | D502: 150 | E502: =(29.83*48)/100 -> 14.318399999999999
B503: Sweet corn (Canada) | C503: 59±11 | D503: 150 | E503: =(33.465*59)/100 -> 19.744350000000001
B504: Sweet corn (USA) | C504: 60 | D504: 150 | E504: =(33.465*60)/100 -> 20.079000000000001
B505: Sweet corn (USA) | C505: 60 | D505: 150 | E505: =(33.465*60)/100 -> 20.079000000000001
B506: Sweet corn (South Africa) | C506: 62±5 | D506: 150 | E506: =(32.75*62)/100 -> 20.305
B507: mean of six studies | C507: 53±4 | D507: 150 | E507: =(32.1342*53)/100 -> 17.031126
A508: =A500+1 -> 266 | B508: Sweet corn, whole kernel, canned, diet-pack, drained (Featherweight, USA) | C508: 46 | D508: 150 | E508: =(27.9*46)/100 -> 12.833999999999998
A509: =A508+1 -> 267 | B509: Sweet corn, frozen, reheated in microwave | C509: 47 | D509: 150 | E509: =(33.49524*47)/100 -> 15.742762800000001
B510: (Green Giant Pillsbury Ltd., Toronto, Canada)
A511: =A509+1 -> 268 | B511: Taco shells, cornmeal-based, baked (Old El Paso Foods Co., Toronto, Canada) | C511: 68 | D511: 20 | E511: =(12.48*68)/100 -> 8.4863999999999997
B512: Couscous
A513: =A511+1 -> 269 | B513: Couscous, boiled 5 min (Near East Food Products Co., Leominster, MA, USA) | C513: 61
B514: Couscous, boiled 5 min (Tunisia) | C514: 69
B515: mean of two studies | C515: 65±4 | D515: 150 | E515: =(34.86*65)/100 -> 22.659000000000002
B516: Millet
A517: =A513+1 -> 270 | B517: Millet, boiled (Canada) | C517: 71±10 | D517: 150 | E517: =(35.51*71)/100 -> 25.2121
A518: =A517+1 -> 271 | B518: Millet flour porridge (Kenya) | C518: 107
B519: Rice, white
A520: =A518+1 -> 272 | B520: Arborio, risotto rice, boiled (Sun Rice brand, Rice Growers Co-Op., Australia) | C520: 69±7 | D520: 150 | E520: =(52.5*69)/100 -> 36.225000000000001
A521: =A520+1 -> 273 | B521: White (Oryza sativa), boiled (India) | C521: 69±15 | D521: 150 | E521: =(43.065*69)/100 -> 29.714849999999998
A522: =A521+1 -> 274 | B522: Rice, boiled white, type NS
B523: Type NS, eaten alone (France) | C523: 45 | D523: 150 | E523: =(30*45)/100 -> 13.5
B524: Type NS (India) | C524: 48 | D524: 150 | E524: =(38*48)/100 -> 18.24
B525: Type NS (Canada) | C525: 51 | D525: 150 | E525: =(41.655*51)/100 -> 21.244050000000001
B526: Type NS (France) | C526: 52 | D526: 150 | E526: =(36.06*52)/100 -> 18.751200000000001
B527: Type NS (Canada) | C527: 56 | D527: 150 | E527: =(41.655*56)/100 -> 23.326800000000002
B528: Type NS (Pakistan) | C528: 69 | D528: 150 | E528: =(38*69)/100 -> 26.22
B529: Type NS (Canada) | C529: 72±9 | D529: 150 | E529: =(41.655*72)/100 -> 29.991599999999998
B530: Type NS, boiled in salted water (India) | C530: 72 | D530: 150 | E530: =(38*72)/100 -> 27.36
B531: Type NS, boiled 13 min (Italy) | C531: 102 | D531: 150 | E531: =(30*102)/100 -> 30.6
B532: Type NS (Kenya) | C532: 112 | D532: 150 | E532: =(42.08*112)/100 -> 47.129600000000003
B533: Type NS, boiled (France) | C533: 43 | D533: 150 | E533: =(30*43)/100 -> 12.9
B534: Type NS, boiled (France) | C534: 47 | D534: 150 | E534: =(30*47)/100 -> 14.1
B535: mean of 12 studies | C535: 64±7 | D535: 150 | E535: =(36.42542*64)/100 -> 23.312268800000002
A536: =A522+1 -> 275 | B536: Type NS, boiled in salted water, refrigerated 16-20h, reheated (India) | C536: 53 | D536: 150 | E536: =(38*53)/100 -> 20.14
A537: =A536+1 -> 276 | B537: Type NS, boiled 13 min, then baked 10 min (Italy) | C537: 104 | D537: 150 | E537: =(30*104)/100 -> 31.2
A538: =A537+1 -> 277 | B538: Long grain, boiled
B539: Long grain, boiled 5 min (Canada) | C539: 41 | D539: 150 | E539: =(40.03*41)/100 -> 16.412300000000002
B540: Long grain, white, unconverted, boiled 15 min (Mahatma brand, Riviana Foods, | C540: 50 | D540: 150 | E540: =(42.75*50)/100 -> 21.375
B541: Wetherill Park, NSW, Australia )
B542: Gem long grain (Dainty Food Inc., Toronto, Canada) | C542: 55 | D542: 150 | E542: =(40.03*55)/100 -> 22.016500000000001
B543: Long grain, white (Uncle Bens, Auckland, New Zealand) | C543: 56±7 | D543: 150 | E543: =(42.75*56)/100 -> 23.94
B544: Long grain, boiled 25 min (Surinam) | C544: 56±2 | D544: 150 | E544: =(42.75*56)/100 -> 23.94
B545: Gem long grain (Dainty Food Inc., Canada) | C545: 57 | D545: 150 | E545: =(40.03*57)/100 -> 22.8171
B546: Long grain, boiled 15 min | C546: 58 | D546: 150 | E546: =(40.03*58)/100 -> 23.217400000000001
B547: Gem long grain (Dainty Food Inc., Canada) | C547: 60 | D547: 150 | E547: =(40.03*60)/100 -> 24.018000000000001
B548: Gem long grain (Dainty Food Inc., Canada) | C548: 60 | D548: 150 | E548: =(40.03*60)/100 -> 24.018000000000001
B549: Long grain, white, boiled 7 min (Star brand, Gouda foods, Concord, Canada) | C549: 64±3 | D549: 150 | E549: =(40.03*64)/100 -> 25.619199999999999
B550: mean of 10 studies | C550: 56±2 | D550: 150 | E550: =(40.846*56)/100 -> 22.873759999999997
B551: Rice, long grain, quick-cooking varieties
A552: =A538+1 -> 278 | B552: Long grain, parboiled 10 min cooking time (Uncle Ben's, Masterfoods, Belgium) | C552: 68±6 | D552: 150 | E552: =(36.86*68)/100 -> 25.064800000000002
A553: =A552+1 -> 279 | B553: Long grain, parboiled, 20 min cooking time (Uncle Ben's, Masterfoods, Belgium) | C553: 75±7 | D553: 150 | E553: =(75*36.86)/100 -> 27.645
A554: =A553+1 -> 280 | B554: Long grain, white, pre-cooked, microwaved 2 min (Express Rice, plain, Uncle Ben's, Masterfoods | C554: 52±5 | D554: 150 | E554: =(36.86*52)/100 -> 19.167200000000001
B555: King's Lynn, Norfolk, UK)
B556: Rice, specialty rices
A557: =A554+1 -> 281 | B557: Cajun Style, Uncle Ben's® (Effem Foods Ltd., Bolton, Canada) | C557: 51 | D557: 150 | E557: =(37.48*51)/100 -> 19.114799999999999
A558: =A557+1 -> 282 | B558: Garden Style, Uncle Ben's® (Effem Foods Ltd., Canada) | C558: 55 | D558: 150 | E558: =(37.48*55)/100 -> 20.613999999999997
A559: =A558+1 -> 283 | B559: Long Grain and Wild, Uncle Ben's® (Effem Foods Ltd., Canada) | C559: 54 | D559: 150 | E559: =(37.48*54)/100 -> 20.239199999999997
A560: =A559+1 -> 284 | B560: Mexican Fast and Fancy, Uncle Ben's® (Effem Foods Ltd., Canada) | C560: 58 | D560: 150 | E560: =(37.48*58)/100 -> 21.738399999999999
A561: =A560+1 -> 285 | B561: Saskatchewan wild rice (Canada) | C561: 57 | D561: 150 | E561: =(32.0122*57)/100 -> 18.246954000000002
A562: =A561+1 -> 286 | B562: Broken rice, white, cooked in rice cooker (Lion Foods, Bangkok, Thailand) | C562: 86±10 | D562: 150 | E562: =(43.023*86)/100 -> 36.999780000000001
A563: =A562+1 -> 287 | B563: Glutinous rice, white, cooked in rice cooker (Bangsue Chia Meng Rice Mill, Bangkok, Thailand) | C563: 98±7 | D563: 150 | E563: =(31.64*98)/100 -> 31.007200000000001
A564: =A563+1 -> 288 | B564: Jasmine rice, white long grain, cooked in rice cooker (Golden World Foods, Bangkok, Thailand) | C564: 109±10 | D564: 150 | E564: =(42.26*109)/100 -> 46.063400000000001
B565: Rice, white low-amylose
A566: =A564+1 -> 289 | B566: Calrose, white, medium grain, boiled (Rice Growers Co-op., Australia) | C566: 83±13 | D566: 150 | E566: =(43.095*83)/100 -> 35.76885
A567: =A566+1 -> 290 | B567: Sungold, Pelde, parboiled (Rice Growers Co-op., Australia) | C567: 87±7 | D567: 150 | E567: =(42.885*87)/100 -> 37.309950000000001
A568: =A567+1 -> 291 | B568: Waxy (0-2% amylose) (Rice Growers Co-op., Australia) | C568: 88±11 | D568: 150 | E568: =(42.885*88)/100 -> 37.738799999999998
A569: =A568+1 -> 292 | B569: Pelde, white (Rice Growers Co-op., Australia) | C569: 93±11 | D569: 150 | E569: =(42.885*93)/100 -> 39.883049999999997
A570: =A569+1 -> 293 | B570: White, low-amylose, boiled (Turkey) | C570: 139 | D570: 150 | E570: =(42.885*139)/100 -> 59.610149999999997
B571: Rice, white high-amylose
A572: =A570+1 -> 294 | B572: Bangladeshi rice variety BR16 (28% amylose) | C572: 37 | D572: 150 | E572: =(38.86*37)/100 -> 14.3782
B573: Bangladeshi rice variety BR16, white, long-grain (27% amylose), boiled 17.5 min | C573: 39 | D573: 150 | E573: =(38.86*39)/100 -> 15.1554
B574: mean of two studies | C574: 38 | D574: 150 | E574: =(38.86*38)/100 -> 14.7668
A575: =A572+1 -> 295 | B575: Doongara, white (Rice Growers Co-op., Australia) | C575: 50±6
B576: Doongara, white (Rice Growers Co-op., Australia) | C576: 64±9
B577: Doongara, white (Rice Growers Co-op., Australia) | C577: 54±7
B578: mean of three studies | C578: 56±4 | D578: 150 | E578: =(38.56*56)/100 -> 21.593600000000002
A579: =A575+1 -> 296 | B579: Koshikari (Japonica), white, short-grain, boiled 15 min then steamed 10 min (Japan) | C579: 48±8 | D579: 150 | E579: =(37.69*48)/100 -> 18.091200000000001
A580: =A579+1 -> 297 | B580: Basmati
B581: Basmati, white, boiled (Mahatma brand, Sydney, NSW, Australia) | C581: 58±8 | D581: 150 | E581: =(37.55*58)/100 -> 21.778999999999996
B582: Precooked basmati rice in pouch, white, reheated in microwave, Uncle Ben's Express® | C582: 57±4 | D582: 150 | E582: =(41.3*57)/100 -> 23.541
B583: (Masterfoods. Kings Lynn, Norfolk, UK)
B584: Quick cooking white basmati, cooked 10 min, Uncle Ben's Superior (Masterfoods Olen, Belgium) | C584: 60±5 | D584: 150 | E584: =(37.55*60)/100 -> 22.53
A585: =A580+1 -> 298 | B585: Rice, brown
B586: Brown (Canada) | C586: 66±5 | D586: 150 | E586: =(32.565*66)/100 -> 21.492899999999999
B587: Brown, steamed (USA)5 | C587: 50 | D587: 150 | E587: =(32.565*50)/100 -> 16.282499999999999
B588: Brown (Oriza Sativa), boiled (South India)5 | C588: 50±19 | D588: 150 | E588: =(32.565*50)/100 -> 16.282499999999999
B589: mean of three studies | C589: 55±5 | D589: 150 | E589: =(32.565*55)/100 -> 17.910749999999997
B590: Calrose brown (Rice Growers Co-op., Australia) | C590: 87±8 | D590: 150 | E590: =(37.63*87)/100 -> 32.738100000000003
B591: Doongara brown, high amylose (Rice Growers Co-op., Australia) | C591: 66±7 | D591: 150 | E591: =(36.845*66)/100 -> 24.317699999999999
B592: Pelde brown (Rice Growers Co-op., Australia) | C592: 76±6 | D592: 150 | E592: =(37.512*76)/100 -> 28.509120000000003
B593: Parboiled, cooked 20 min, Uncle Ben's Natur-reis ® (Masterfoods Olen, Belgium) | C593: 64±7 | D593: 150 | E593: =(36.311*64)/100 -> 23.239039999999999
B594: Sunbrown Quick™ (Rice Growers Co-op., Australia) | C594: 80±7 | D594: 150 | E594: =(38.5*80)/100 -> 30.8
A595: =A585+1 -> 299 | B595: Instant/puffed rice
B596: Instant rice, white, boiled 1 min (Canada) | C596: 46 | D596: 150 | E596: =(41.7*46)/100 -> 19.182000000000002
B597: Instant rice, white, cooked 6 min (Trice brand, Australia) | C597: 87 | D597: 150 | E597: =(41.7*87)/100 -> 36.279000000000003
B598: Puffed, white, cooked 5 min, Uncle Ben's Snabbris® (Masterfoods Olen, Belgium) | C598: 74±5 | D598: 150 | E598: =(41.7*74)/100 -> 30.858000000000001
B599: mean of three studies | C599: 69±12 | D599: 150 | E599: =(41.7*69)/100 -> 28.773000000000003
B600: Instant doongara, white, cooked 5 min (Rice Growers Co-op., Australia) | C600: 94±7 | D600: 150 | E600: =(41.7*84)/100 -> 35.027999999999999
A601: =A595+1 -> 300 | B601: Parboiled rice
B602: Parboiled rice (Canada) | C602: 48 | D602: 150 | E602: =(36.495*48)/100 -> 17.517599999999998
B603: Parboiled rice (USA) | C603: 72 | D603: 150 | E603: =(36.495*72)/100 -> 26.276399999999999
B604: Converted, white, Uncle Ben's® (Effem Foods Ltd., Canada) | C604: 45 | D604: 150 | E604: =(36.495*45)/100 -> 16.422749999999997
B605: Converted, white, boiled 20-30 min, Uncle Ben's® (Masterfoods USA, Vernon, CA) | C605: 38 | D605: 150 | E605: =(36.495*38)/100 -> 13.8681
B606: Converted, white, long grain, boiled 20-30 min, Uncle Ben's® (Masterfoods USA) | C606: 50 | D606: 150 | E606: =(36.495*50)/100 -> 18.247499999999999
B607: Boiled, 12 min (Denmark)6 | C607: 39 | D607: 150 | E607: =(36.495*39)/100 -> 14.233049999999999
B608: Boiled, 12 min (Denmark) | C608: 42 | D608: 150 | E608: =(36.495*42)/100 -> 15.3279
B609: Boiled, 12 min (Denmark) | C609: 43 | D609: 150 | E609: =(36.495*43)/100 -> 15.692849999999998
B610: Boiled, 12 min (Denmark) | C610: 46 | D610: 150 | E610: =(36.495*46)/100 -> 16.787700000000001
B611: Long grain, boiled 5 min (Canada) | C611: 38 | D611: 150 | E611: =(36.495*38)/100 -> 13.8681
B612: Long grain, boiled, 10 min (USA)5 | C612: 61 | D612: 150 | E612: =(36.495*61)/100 -> 22.261949999999999
B613: Long grain, boiled 15 min (Canada) | C613: 47 | D613: 150 | E613: =(36.495*47)/100 -> 17.152649999999998
B614: Long grain, boiled 25 min (Canada) | C614: 46 | D614: 150 | E614: =(36.495*46)/100 -> 16.787700000000001
B615: mean of thirteen studies | C615: 47±3 | D615: 150 | E615: =(36*47)/100 -> 16.92
A616: =A601+1 -> 301 | B616: Parboiled rice, eaten as part of a traditional Indian meal (India)5 | C616: 99
A617: =A616+1 -> 302 | B617: Parboiled, low-amylose
B618: Bangladeshi rice variety BR2, parboiled (12% amylose) | C618: 51 | D618: 150 | E618: =(38.09*51)/100 -> 19.425900000000002
B619: Parboiled, low-amylose, Pelde, Sungold (Rice Growers Co-op., Australia) | C619: 87±7 | D619: 150 | E619: =(39.48*87)/100 -> 34.3476
A620: =A617+1 -> 303 | B620: Parboiled, high-amylose
B621: Parboiled, high-amylose (28%), Doongara (Rice Growers Co-op., Australia) | C621: 50±6 | D621: 150 | E621: =(38.56*50)/100 -> 19.28
B622: Bangladeshi rice variety BR16, parboiled (28% amylose) | C622: =50*0.7 -> 35 | D622: 150 | E622: =(37.46*35)/100 -> 13.111000000000001
B623: Bangladeshi rice variety BR16, traditionally parboiled (27% amylose) | C623: 32 | D623: 150 | E623: =(38.26531*32)/100 -> 12.244899199999999
B624: Bangladeshi rice variety BR16, pressure parboiled (27% amylose) | C624: 27 | D624: 150 | E624: =(41.2*27)/100 -> 11.124000000000001
B625: Bangladeshi rice variety BR4, parboiled (27% amylose) | C625: 33 | D625: 150 | E625: =(38.145*33)/100 -> 12.587850000000001
B626: Mean of 5 studies | C626: 35±4 | D626: 150 | E626: =(38.726*35)/100 -> 13.554099999999998
A627: =A620+1 -> 304 | B627: Rye, whole kernels
B628: Rye, whole kernels (Canada) | C628: 29 | D628: 50 (dry) | E628: =(37.88*29)/100 -> 10.985199999999999
B629: Rye, whole kernels, pressure cooked (15 psi) 30 min in 2 L water (Canada) | C629: 34 | D629: 50 (dry) | E629: =(37.88*34)/100 -> 12.879200000000001
B630: Rye, whole kernels (Canada) | C630: 39 | D630: 50 (dry) | E630: =(37.88*39)/100 -> 14.773200000000001
B631: mean of three studies | C631: 34±3 | D631: 50 (dry) | E631: =(37.88*34)/100 -> 12.879200000000001
B632: Wheat
A633: =A627+1 -> 305 | B633: Wheat, whole kernels
B634: Wheat, whole kernels (Triticum aestivum) (India)11 | C634: 30±9 | D634: 50 (dry) | E634: =(37.5*30)/100 -> 11.25
B635: Wheat, whole kernels (Canada) | C635: 42 | D635: 50 (dry) | E635: =(32.895*42)/100 -> 13.815900000000001
B636: Wheat, whole kernels, pressure cooked (15 psi) 30 min in 2 L water (Canada) | C636: 44 | D636: 50 (dry) | E636: =(32.895*44)/100 -> 14.473800000000001
B637: Wheat, whole kernels (Canada) | C637: 48 | D637: 50 (dry) | E637: =(32.895*48)/100 -> 15.7896
B638: mean of four studies | C638: 41±3 | D638: 50 (dry) | E638: =(34.046*41)/100 -> 13.95886
A639: =A633+1 -> 306 | B639: Wheat, type NS(India) | C639: 90 | D639: 50 (dry) | E639: =(37.5*90)/100 -> 33.75
A640: =A639+1 -> 307 | B640: Wheat, precooked kernels
B641: Durum wheat, precooked, cooked 20 min (Ebly, Chateaudun, France) | C641: 52±4 | D641: 50 (dry) | E641: =(36.5*52)/100 -> 18.98
B642: Durum wheat, precooked, cooked 10 min (Ebly, France) | C642: 50±5 | D642: 50 (dry) | E642: =(33.2*50)/100 -> 16.6
B643: Durum wheat, precooked in pouch, reheated in microwave, Ebly Express (Ebly, France) | C643: 40±5 | D643: 125 | E643: =(39.3*40)/100 -> 15.72
B644: Quick cooking (White Wings, Sydney, NSW, Australia) | C644: 54±11 | D644: 150 | E644: =(46.584*54)/100 -> 25.155360000000002
A645: =A640+1 -> 308 | B645: Semolina
B646: Semolina, roasted at 105 °C then gelatinised with water (India) | C646: 55±9
B647: Semolina, steamed and gelatinised (India) | C647: 54±13
B648: mean of two studies | C648: 55±1 | D648: 150 | E648: =(10.65*55)/100 -> 5.8574999999999999
A649: =A645+1 -> 309 | B649: Cracked wheat (bulgur/bourghul)
B650: Bulgur, boiled (Canada) | C650: 46
B651: Bulgur, boiled in 800 mL water 20 min (Canada) | C651: 46
B652: Bulgur, boiled 20 min (Canada) | C652: 46
B653: Bulgur, boiled 20 min (Canada) | C653: 53
B654: mean of four studies | C654: 48±2 | D654: 150 | E654: =(25.8*48)/100 -> 12.384
B656: COOKIES
B657: Arrowroot
A658: =A649+1 -> 310 | B658: Arrowroot (McCormicks's, Interbare Foods, Toronto, Canada) | C658: 63 | D658: 25 | E658: =(20.032*63)/100 -> 12.62016
A659: =A658+1 -> 311 | B659: Arrowroot plus (McCormicks's, Canada) | C659: 62 | D659: 25 | E659: =(18.08*62)/100 -> 11.209599999999998
A660: =A659+1 -> 312 | B660: Milk Arrowroot™ (Arnotts, Sydney, NSW, Australia) | C660: 69±7 | D660: 25 | E660: =(17.65*69)/100 -> 12.1785
B661: mean of three studies | C661: 65±2 | D661: 25 | E661: =(65*18.5873)/100 -> 12.081744999999998
A662: =A660+1 -> 313 | B662: Barquette Abricot (LU, Ris, Orangis, France) | C662: 71±6 | D662: 40 | E662: =(32.02*71)/100 -> 22.734200000000001
A663: =A662+1 -> 314 | B663: Bebe Dobre Rano Chocolate (Opavia/LU, Czech Republic) | C663: 57±9 | D663: 50 | E663: =(33*57)/100 -> 18.81
A664: =A663+1 -> 315 | B664: Bebe Dobre Rano Honey and Hazelnuts (Opavia/LU, Czech Republic) | C664: 51±9 | D664: 50 | E664: =(33.5*51)/100 -> 17.085000000000001
A665: =A664+1 -> 316 | B665: Bebe Jemne Susenky (Opavia/LU, Czech Republic) | C665: 67±11 | D665: 25 | E665: =(20.16*67)/100 -> 13.507200000000001
A666: =A665+1 -> 317 | B666: Digestives
B667: Digestives (Canada) | C667: 55
B668: Digestives (Canada) | C668: 59±7
B669: Digestives, Peak Freans (Nabisco Ltd., Toronto, Canada) | C669: 62
B670: mean of three studies | C670: 59±2 | D670: 25 | E670: =(16.491*59)/100 -> 9.7296899999999997
A671: =A666+1 -> 318 | B671: Digestives, gluten-free (maize starch) (Nutricia Dietary Care Ltd., Redish, Stockport, UK) | C671: 58 | D671: 25 | E671: =(17.123*58)/100 -> 9.9313400000000005
A672: =A671+1 -> 319 | B672: Evergreen met Krenten (LU, Netherlands) | C672: 66±12 | D672: 38 | E672: =(21.28*66)/100 -> 14.0448
A673: =A672+1 -> 320 | B673: Golden Fruit (Griffin's Foods Ltd., Auckland, New Zealand) | C673: 77±25 | D673: 25 | E673: =(17.15*77)/100 -> 13.205499999999999
A674: =A673+1 -> 321 | B674: Graham Wafers (Christie Brown & Co., Toronto, Canada) | C674: 74 | D674: 25 | E674: =(18.493*74)/100 -> 13.68482
A675: =A674+1 -> 322 | B675: Gran'Dia Banana, Oats and Honey (LU, Brazil) | C675: 28±5 | D675: 30 | E675: =(23*28)/100 -> 6.44
A676: =A675+1 -> 323 | B676: Grany en-cas Abricot (LU, France) | C676: 55±6 | D676: 30 | E676: =(16.40625*55)/100 -> 9.0234375
A677: =A676+1 -> 324 | B677: Grany en-cas Fruits des bois (LU, France) | C677: 50±5 | D677: 30 | E677: =(14.34375*50)/100 -> 7.171875
A678: =A677+1 -> 325 | B678: Grany Rush Apricot (LU, Netherlands) | C678: 62±3 | D678: 30 | E678: =(19.8*62)/100 -> 12.276000000000002
A679: =A678+1 -> 326 | B679: Highland Oatmeal™ (Westons biscuits, Sydney, NSW, Australia) | C679: 55±8 | D679: 25 | E679: =(18.25*55)/100 -> 10.0375
A680: =A679+1 -> 327 | B680: Highland Oatcakes (Walker's Shortbread Ltd., Aberlour-on-Spey, Scotland) | C680: 57 | D680: 25 | E680: =(14.564*57)/100 -> 8.3014799999999997
A681: =A680+1 -> 328 | B681: LU P'tit Déjeuner Chocolat (LU, France) | C681: 42±5 | D681: 50 | E681: =(34.0741*42)/100 -> 14.311122000000001
A682: =A681+1 -> 329 | B682: LU P'tit Déjeuner Miel et Pépites Chocolat (LU, France) | C682: 45±5 | D682: 50 | E682: =(35.093*45)/100 -> 15.791850000000002
B683: LU P'tit Déjeuner Miel et Pépites Chocolat (LU, France) | C683: 52±3 | D683: 50 | E683: =(34.72*52)/100 -> 18.054400000000001
B684: LU P'tit Déjeuner Miel et Pépites Chocolat (LU, France) | C684: 49±8 | D684: 50 | E684: =(34.72*52)/100 -> 18.054400000000001
B685: mean of three studies | C685: 49±2 | D685: 50 | E685: =(34.84433*49)/100 -> 17.0737217
A686: =A682+1 -> 330 | B686: Maltmeal wafer (Griffin's Foods Ltd., New Zealand) | C686: 50±10 | D686: 25 | E686: =(17.175*50)/100 -> 8.5875000000000004
A687: =A686+1 -> 331 | B687: Morning Coffee™ (Arnotts, Australia) | C687: 79±6 | D687: 25 | E687: =(19.05*79)/100 -> 15.0495
A688: =A687+1 -> 332 | B688: Nutrigrain Fruits des bois (Kellogg's, France) | C688: 57±4 | D688: 35 | E688: =(22.7973*57)/100 -> 12.994460999999999
A689: =A688+1 -> 333 | B689: Oatmeal (Canada) | C689: 54±4 | D689: 25 | E689: =(17.175*54)/100 -> 9.2744999999999997
A690: =A689+1 -> 334 | B690: Oro (Saiwa, Italy) | C690: 61±9 | D690: 40 | E690: =(32*61)/100 -> 19.52
B691: Oro (Saiwa, Italy) | C691: 67±17 | D691: 40 | E691: =(31.6*67)/100 -> 21.172000000000004
B692: mean of two studies | C692: 64±3 | D692: 40 | E692: =(31.8*64)/100 -> 20.352
A693: =A690+1 -> 335 | B693: Petit LU Normand (LU, France) | C693: 51±3 | D693: 25 | E693: =(18.7*51)/100 -> 9.536999999999999
A694: =A693+1 -> 336 | B694: Petit LU Roussillon (LU, France) | C694: 48±4 | D694: 25 | E694: =(17.8*48)/100 -> 8.5440000000000005
A695: =A694+1 -> 337 | B695: Prince Energie+ (LU, France) | C695: 73±5 | D695: 25 | E695: =(17.3*73)/100 -> 12.629000000000001
A696: =A695+1 -> 338 | B696: Prince fourré chocolat (LU, France) | C696: 53±5
B697: Prince fourré chocolat (LU, France) | C697: 50±5
B698: mean of two studies | C698: 52±2 | D698: 45 | E698: =(30.273*52)/100 -> 15.741959999999999
A699: =A696+1 -> 339 | B699: Prince Meganana Chocolate (LU, Spain) | C699: 49±12 | D699: 50 | E699: =(36.1*49)/100 -> 17.689
A700: =A699+1 -> 340 | B700: Prince Petit Déjeuner Vanille (LU, France and Spain) | C700: 45±6 | D700: 50 | E700: =(36.3*45)/100 -> 16.335000000000001
A701: =A700+1 -> 341 | B701: Rich Tea (Canada) | C701: 55±4 | D701: 25 | E701: =(18.9*55)/100 -> 10.395
A702: =A701+1 -> 342 | B702: Sablé des Flandres (LU, France) | C702: 57±10 | D702: 20 | E702: =(14.7*57)/100 -> 8.3789999999999996
A703: =A702+1 -> 343 | B703: Shortbread (Arnotts, Australia) | C703: 64±8 | D703: 25 | E703: =(15.5*64)/100 -> 9.92
A704: =A703+1 -> 344 | B704: Shredded Wheatmeal™ (Arnotts, Australia) | C704: 62±4 | D704: 25 | E704: =(17.775*62)/100 -> 11.0205
A705: =A704+1 -> 345 | B705: Snack Right Fruit Slice (97% fat-free) (Arnott's, Australia) | C705: 45±3 | D705: 25 | E705: =(18.9*45)/100 -> 8.5050000000000008
A706: =A705+1 -> 346 | B706: Thé (LU, France) | C706: 41±7 | D706: 20 | E706: =(15.75*41)/100 -> 6.4574999999999996
A707: =A706+1 -> 347 | B707: Vanilla Wafers (Christie Brown & Co., Canada) | C707: 77 | D707: 25 | E707: =(17.75*77)/100 -> 13.6675
A708: =A707+1 -> 348 | B708: Véritable Petit Beurre (LU, France) | C708: 51±8 | D708: 25 | E708: =(17.8*51)/100 -> 9.0780000000000012
B710: CRACKERS
A711: =A708+1 -> 349 | B711: Breton wheat crackers (Dare Foods Ltd., Kitchener, Canada) | C711: 67 | D711: 25 | E711: =(14.205*67)/100 -> 9.5173500000000004
A712: =A711+1 -> 350 | B712: Corn Thins, puffed corn cakes, gluten-free (Real Foods, St Peters, NSW, Australia) | C712: 87±10 | D712: 25 | E712: =(20.26*87)/100 -> 17.626200000000001
A713: =A712+1 -> 351 | B713: Cream Cracker (LU Triumfo, Brazil) | C713: 65±11 | D713: 25 | E713: =(16.625*65)/100 -> 10.80625
A714: =A713+1 -> 352 | B714: High-calcium cracker (Danone, Malaysia) | C714: 52±8 | D714: 25 | E714: =(17.25*52)/100 -> 8.97
A715: =A714+1 -> 353 | B715: Jatz™, plain salted craker biscuits (Arnotts, Australia) | C715: 55±5 | D715: 25 | E715: =(17.475*55)/100 -> 9.6112500000000001
A716: =A715+1 -> 354 | B716: Puffed Crispbread (Westons, Australia) | C716: 81±9 | D716: 25 | E716: =(18.5*81)/100 -> 14.984999999999999
A717: =A716+1 -> 355 | B717: Puffed rice cakes
B718: Puffed rice cakes, white (Rice Growers Co-op., Leeton, NSW, Australia) | C718: 82±11 | D718: 25 | E718: 17
B719: Rice cakes, Calrose rice (low-amylose) (Rice Growers Co-op., Australia) | C719: 91±7 | D719: 25 | E719: 19
B720: Rice cakes, Doongara rice (high-amylose) (Rice Growers Co-op., Australia) | C720: 61±5 | D720: 25 | E720: 13
B721: mean of three studies | C721: 78±9 | D721: 25 | E721: =(21*81)/100 -> 17.01
A722: =A717+1 -> 356 | B722: Rye crispbread
B723: Rye crispbread (Canada) | C723: 63 | D723: 25 | E723: =(16.425*63)/100 -> 10.347750000000001
B724: Ryvita™ (Canada) | C724: 69±10 | D724: 25 | E724: =(16.425*69)/100 -> 11.33325
B725: High-fiber rye crispbread (Ryvita Company Ltd., Poole, Dorset, UK) | C725: 59 | D725: 25 | E725: =(15.1524*59)/100 -> 8.9399160000000002
B726: Rye crispbread (Ryvita Company Ltd., UK) | C726: 63 | D726: 25 | E726: =(17.66*63)/100 -> 11.1258
B727: mean of four studies | C727: 64±2 | D727: 25 | E727: =(16.4156*64)/100 -> 10.505984000000002
A728: =A722+1 -> 357 | B728: Kavli™ Norwegian Crispbread (Players Biscuits, Sydney, NSW, Australia) | C728: 71±7 | D728: 25 | E728: =(16.25*71)/100 -> 11.5375
A729: =A728+1 -> 358 | B729: Sao™, plain square crackers (Arnotts, Australia) | C729: 70±9 | D729: 25 | E729: =(16.75*70)/100 -> 11.725
A730: =A729+1 -> 359 | B730: Stoned Wheat Thins (Christie Brown & Co., Canada) | C730: 67 | D730: 25 | E730: =(17.4*67)/100 -> 11.657999999999999
A731: =A730+1 -> 360 | B731: Water cracker
B732: Water cracker (Canada) | C732: 63±9 | D732: 25 | E732: =(17.794*63)/100 -> 11.21022
B733: Water cracker (Arnotts, Australia) | C733: 78±11 | D733: 25 | E733: =(17.794*78)/100 -> 13.87932
B734: mean of two studies | C734: 71±8 | D734: 25 | E734: =(17.794*71)/100 -> 12.63374
A735: =A731+1 -> 361 | B735: Premium Soda Crackers (Christie Brown & Co., Canada) | C735: 74 | D735: 25 | E735: =(16.73*74)/100 -> 12.3802
A736: =A735+1 -> 362 | B736: Vita-wheat™, original, crispbread (Arnott's, Australia) | C736: 55±4 | D736: 25 | E736: =(18.786*55)/100 -> 10.3323
B738: DAIRY PRODUCTS AND ALTERNATIVES
B739: Custard
A740: =A736+1 -> 363 | B740: No Bake Egg Custard, prepared from powder with whole milk (Nestlé, Sydney, NSW, Australia) | C740: 35±2 | D740: 100 | E740: =(16.7*35)/100 -> 5.8449999999999998
A741: =A740+1 -> 364 | B741: Custard, home made from milk, wheat starch, and sugar (Australia) | C741: 43±10 | D741: 100 | E741: =(16.5*43)/100 -> 7.0949999999999998
A742: =A741+1 -> 365 | B742: TRIM™, reduced-fat custard (Pauls Ltd., South Brisbane, Qld, Australia) | C742: 37±4 | D742: 100 | E742: =(15.41*37)/100 -> 5.7016999999999998
B743: mean of three studies | C743: 38±2 | D743: 100 | E743: =(16.2*38)/100 -> 6.1560000000000006
A744: =A742+1 -> 366 | B744: Ice cream, Regular/NS
B745: Ice cream, NS (Canada) | C745: 36±8
B746: Ice cream (half vanilla, half chocolate) (Italy) | C746: 57
B747: Ice cream, NS(USA) | C747: 62
B748: Ice cream, chocolate flavored (USA) | C748: 68±15
B749: Ice cream (half vanilla, half chocolate) (Italy) | C749: 80
B750: mean of five studies | C750: 61±7 | D750: 50 | E750: =(12.95*61)/100 -> 7.8994999999999997
A751: =A744+1 -> 367 | B751: Ice cream, Reduced- or Low-fat
B752: Ice cream, low-fat, vanilla, 'Light' (Peter's, Sydney, NSW, Australia) | C752: 50±8 | D752: 50 | E752: =(6*50)/100 -> 3
B753: Ice-cream, low-fat (1.2 % fat), Prestige Light rich vanilla (Norco, Lismore, NSW, Australia)6 | C753: 47±5 | D753: 50 | E753: =(10.2*47)/100 -> 4.7939999999999996
B754: Ice-cream, low-fat (1.4% fat), Prestige Light traditional toffee (Norco, Australia)6 | C754: 37±4 | D754: 50 | E754: =(14.4*37)/100 -> 5.3280000000000003
B755: Ice-cream, reduced-fat (7.1 % fat), Prestige golden macadamia (Norco, Australia)6 | C755: 39±3 | D755: 50 | E755: =(11.8*39)/100 -> 4.6020000000000003
A756: =A751+1 -> 368 | B756: Ice cream, Premium (high-fat)
B757: Ice cream, premium, Ultra chocolate, 15% fat (Sara Lee, Gosford, NSW, Australia) | C757: 37±3 | D757: 50 | E757: =(9.47*37)/100 -> 3.5039000000000002
B758: Ice cream, premium, French vanilla, 16% fat (Sara Lee, Australia) | C758: 38±3 | D758: 50 | E758: =(9.006*38)/100 -> 3.4222800000000002
A759: =A756+1 -> 369 | B759: Milk, full-fat
B760: Full-fat (Italy) | C760: 11
B761: Full-fat (3% fat, Skånemejerier, Malmö, Sweden)6 | C761: =30*0.7 -> 21
B762: Full-fat (Italy) | C762: 24
B763: Full-fat cow's milk, fresh (Dairy Farmers, Sydney, NSW, Australia) | C763: 31±2
B764: Full-fat (Canada) | C764: 34±6
B765: Full-fat (USA) | C765: 40
B766: mean of five studies | C766: 27±4 | D766: 250 | E766: =(11.58*27)/100 -> 3.1266000000000003
A767: =A759+1 -> 370 | B767: Fermented cow's milk (ropy milk, långfil, 3% fat) (Arla, Gävle, Sweden)6 | C767: 11
A768: =A767+1 -> 371 | B768: Fermented cow's milk (filmjölk, 3% fat) (Skånemejerier, Malmö, Sweden)6 | C768: 11
B769: mean of two foods | C769: 11
A770: =A768+1 -> 372 | B770: Milk, full-fat, plus bran
B771: Full-fat + 20g wheat bran (Italy) | C771: 25
B772: Full-fat + 20g wheat bran (Italy) | C772: 28
B773: mean of two studies | C773: 27±2 | D773: 250 | E773: =(11.58*27)/100 -> 3.1266000000000003
A774: =A770+1 -> 373 | B774: Milk, skim (Canada) | C774: 32±5 | D774: 250 | E774: =(12.548*32)/100 -> 4.0153600000000003
A775: =A774+1 -> 374 | B775: Milk, condensed, sweetened (Nestlé, Sydney, NSW, Australia) | C775: 61±6 | D775: 250 | E775: =(136*61)/100 -> 82.96
A776: =A775+1 -> 375 | B776: Milk, low-fat, chocolate, with aspartame, Lite White™ (Dairy Farmers, Australia) | C776: 24±6 | D776: 250 | E776: =(14.5*24)/100 -> 3.48
A777: =A776+1 -> 376 | B777: Milk, low-fat, chocolate, with sugar, Lite White™ (Dairy Farmers, Australia) | C777: 34±4 | D777: 250 | E777: =(25.75*34)/100 -> 8.7550000000000008
A778: =A777+1 -> 377 | B778: Mousse, reduced-fat, prepared from commerical mousse mix with water
B779: Butterscotch, 1.9% fat (Nestlé, Australia) | C779: 36±4 | D779: 50 | E779: =(10.08*36)/100 -> 3.6288
B780: Chocolate, 2% fat (Nestlé, Australia) | C780: 31±4 | D780: 50 | E780: =(10.88*31)/100 -> 3.3728000000000002
B781: Hazelnut, 2.4% fat (Nestlé, Australia) | C781: 36±4 | D781: 50 | E781: =(10.24*36)/100 -> 3.6863999999999999
B782: Mango, 1.8% fat (Nestlé, Australia) | C782: 33±5 | D782: 50 | E782: =(10.88*33)/100 -> 3.5904000000000003
B783: Mixed berry, 2.2% fat (Nestlé, Australia) | C783: 36±5 | D783: 50 | E783: =(10.24*36)/100 -> 3.6863999999999999
B784: Strawberry, 2.3% fat (Nestlé, Australia) | C784: 32±3 | D784: 50 | E784: =(10.08*32)/100 -> 3.2256
B785: mean of six foods | C785: 34±1 | D785: 50 | E785: =(10.4*34)/100 -> 3.536
A786: =A778+1 -> 378 | B786: Pudding
B787: instant, chocolate, made from powder and whole milk (White Wings, Sydney, NSW, Australia) | C787: 47±4 | D787: 100 | E787: =(15.9*47)/100 -> 7.4730000000000008
B788: instant, vanilla, made from powder and whole milk (White Wings, Australia) | C788: 40±4 | D788: 100 | E788: =(16.1*40)/100 -> 6.44
B789: mean of two foods | C789: 44±4 | D789: 100 | E789: =(16*44)/100 -> 7.04
A790: =A786+1 -> 379 | B790: Yoghurt
B791: Yoghurt, type NS (Canada) | C791: 36±4 | D791: 200 | E791: =(9.32*36)/100 -> 3.3552
A792: =A790+1 -> 380 | B792: Low-fat yoghurt
B793: Low-fat, fruit, aspartame, Ski™ (Dairy Farmers, Australia) | C793: 14±4 | D793: 200 | E793: =(12.8*14)/100 -> 1.7920000000000003
B794: Low-fat, fruit, sugar, Ski™ (Dairy Farmers, Australia) | C794: 33±7 | D794: 200 | E794: =(30.8*33)/100 -> 10.164
B795: Low-fat (0.9%), fruit, wild strawberry (Ski d'lite™, Dairy Farmers, Australia) | C795: 31±14 | D795: 200 | E795: =(30.4*31)/100 -> 9.4239999999999995
A796: =A792+1 -> 381 | B796: Non-fat yoghurt, sweetened with acesulfame K and Splenda
B797: Diet Vaalia™, exotic fruits (Pauls Ltd., Australia)6 | C797: 23±2 | D797: 200 | E797: =(16*23)/100 -> 3.68
B798: Diet Vaalia™, mango (Pauls Ltd., Australia)6 | C798: 23±2 | D798: 200 | E798: =(14.4*23)/100 -> 3.3119999999999998
B799: Diet Vaalia™, mixed berry (Pauls Ltd., Australia)6 | C799: 25±3 | D799: 200 | E799: =(13*25)/100 -> 3.25
B800: Diet Vaalia™, strawberry (Pauls Ltd., Australia)6 | C800: 23±2 | D800: 200 | E800: =(12.6*23)/100 -> 2.8980000000000001
B801: Diet Vaalia™, vanilla (Pauls Ltd, Australia)6 | C801: 23±2 | D801: 200 | E801: =(12.8*23)/100 -> 2.9440000000000004
B802: mean of five foods | C802: 24±1 | D802: 200 | E802: =(13.76*24)/100 -> 3.3024
A803: =A796+1 -> 382 | B803: Reduced-fat yoghurt
B804: Reduced-fat, Vaalia™, apricot & mango (Pauls Ltd., Australia)6 | C804: 26±4 | D804: 200 | E804: =(30*26)/100 -> 7.8
B805: Reduced-fat, Vaalia™, french vanilla (Pauls Ltd., Australia)6 | C805: 26±4 | D805: 200 | E805: =(9.99*26)/100 -> 2.5973999999999999
B806: Reduced-fat, Extra-Lite™, strawberry (Pauls Ltd., Australia)6 | C806: 28±4 | D806: 200 | E806: =(33.023*28)/100 -> 9.2464400000000015
B807: mean of three foods | C807: 27±1 | D807: 200 | E807: =(24.3*27)/100 -> 6.5609999999999999
A808: =A803+1 -> 383 | B808: Yoghurt drink, reduced-fat, Vaalia™, tropical passionfruit (Pauls Ltd., Australia)6 | C808: 38±4 | D808: 200 | E808: =(29.024*38)/100 -> 11.029120000000001
B809: Soy-based dairy product alternatives
A810: =A808+1 -> 384 | B810: Soy milks (containing maltodextrin)
B811: Soy milk, full-fat (3%), 0 mg calcium, Original (So Natural Foods, Taren Point, NSW, Australia)6 | C811: 44±5 | D811: 250 | E811: =(17.453*44)/100 -> 7.6793200000000006
B812: Soy milk, full-fat (3%), 120 mg calcium, Calciforte (So Natural Foods, Australia)6 | C812: 36±4 | D812: 250 | E812: =(17.736*36)/100 -> 6.3849599999999995
B813: Soy milk, reduced-fat (1.5%), 120 mg calcium, Light (So Natural Foods, Australia)6 | C813: 44±3 | D813: 250 | E813: =(17.453*44)/100 -> 7.6793200000000006
A814: =A810+1 -> 385 | B814: Soy milk drinks
B815: Soy smoothie drink, banana, 1% fat (So Natural Foods, Australia)6 | C815: 30±3 | D815: 250 | E815: =(21.981*30)/100 -> 6.5943000000000005
B816: Soy smoothie drink, chocolate hazelnut, 1% fat (So Natural Foods, Australia)6 | C816: 34±3 | D816: 250 | E816: =(24.81*34)/100 -> 8.4353999999999996
B817: mean of two drinks | C817: 32±2 | D817: 250 | E817: =(23.3955*32)/100 -> 7.4865599999999999
B818: Up & Go™, cocoa malt flavor (soy milk, rice cereal liquid breakfast)6 | C818: 43±5 | D818: 250 | E818: =(25.943*43)/100 -> 11.15549
B819: (Sanitarium, Berkeley Vale, NSW, Australia)
B820: Up & Go™, original malt flavor (soy milk, rice cereal liquid breakfast)6 | C820: 46±5 | D820: 250 | E820: =(23.585*46)/100 -> 10.8491
B821: (Sanitarium, Australia)
B822: mean of two drinks | C822: 45±2 | D822: 250 | E822: =(24.764*45)/100 -> 11.143799999999999
B823: Xpress™, chocolate (soy bean, cereal and legume extract drink with fructose)6 | C823: 39±2 | D823: 250 | E823: =(33.962*39)/100 -> 13.24518
B824: (So Natural Foods, Australia)
A825: =A814+1 -> 386 | B825: Soy yoghurt
B826: Soy yoghurt, peach and mango, 2% fat, sugar (So Natural Foods, Australia)6 | C826: 50±3 | D826: 200 | E826: =(26*50)/100 -> 13
A827: =A825+1 -> 387 | B827: Tofu-based frozen dessert, chocolate with high-fructose (24%) corn syrup (USA) | C827: 115±14 | D827: 50 | E827: =(8.5*115)/100 -> 9.7750000000000004
B829: FRUIT AND FRUIT PRODUCTS
A830: =A827+1 -> 388 | B830: Apples, raw
B831: Apple, NS (Denmark) | C831: =40*0.7 -> 28 | D831: 120 | E831: =(13.216*28)/100 -> 3.7004800000000002
B832: Apple, Braeburn (New Zealand)6 | C832: 32±4 | D832: 120 | E832: =(12.568*32)/100 -> 4.0217599999999996
B833: Apple, NS (Canada) | C833: 34 | D833: 120 | E833: =(15.528*34)/100 -> 5.2795199999999998
B834: Apple, Golden Delicious (Canada) | C834: 39±3 | D834: 120 | E834: =(15.528*39)/100 -> 6.0559199999999995
B835: Apple, NS(USA) | C835: 40 | D835: 120 | E835: =(15.528*40)/100 -> 6.2111999999999998
B836: Apple, NS (Italy) | C836: 44 | D836: 120 | E836: =(13.33*44)/100 -> 5.8651999999999997
B837: mean of six studies | C837: 38±2 | D837: 120 | E837: =(14.5*38)/100 -> 5.51
A838: =A830+1 -> 389 | B838: Apple juice
B839: Apple juice, unsweetened, reconstituted (Berrivale Orchards Ltd, Berri, SA, Australia) | C839: 39±5 | D839: 250 | E839: =(25.286*39)/100 -> 9.8615399999999998
B840: Apple juice, unsweetened (USA) | C840: 40 | D840: 250 | E840: =(28.95*40)/100 -> 11.58
B841: Apple juice, unsweetened (Allens, Toronto, Canada) | C841: 41 | D841: 250 | E841: =(29.6*41)/100 -> 12.136000000000001
B842: mean of three studies | C842: 40±1 | D842: 250 | E842: =(27.9453*40)/100 -> 11.17812
A843: =A838+1 -> 390 | B843: Apple, dried (Australia) | C843: 29±5 | D843: 60 | E843: =(34.314*29)/100 -> 9.95106
B844: Apricots
A845: =A843+1 -> 391 | B845: Apricots, raw, NS (Italy) | C845: 57 | D845: 120 | E845: =(9.12*57)/100 -> 5.1983999999999995
A846: =A845+1 -> 392 | B846: Apricots, canned in light syrup (Riviera, Aliments Caneast Foods, Montreal, Canada ) | C846: 64 | D846: 120 | E846: =(18.81*64)/100 -> 12.038399999999999
A847: =A846+1 -> 393 | B847: Apricots, dried (Australia) | C847: 30±7 | D847: 60 | E847: =(26.64*30)/100 -> 7.9920000000000009
B848: Apricots, dried (Wasco foods, Montreal, Canada) | C848: 32 | D848: 60 | E848: =(30.3*32)/100 -> 9.6959999999999997
B849: mean of two studies | C849: 31±1 | D849: 60 | E849: =(28.47*31)/100 -> 8.8256999999999994
A850: =A847+1 -> 394 | B850: Apricot fruit bar, pureed dried apricot filling in wholemeal pastry | C850: 50±8 | D850: 50 | E850: =(33.95*50)/100 -> 16.975000000000001
B851: (Mother Earth, Auckland, New Zealand)
A852: =A850+1 -> 395 | B852: Apricot fruit spread, reduced sugar (Glen Ewin Jams, Para Hills, SA, Australia) | C852: 55±7 | D852: 30 | E852: =(12.931*55)/100 -> 7.1120499999999991
A853: =A852+1 -> 396 | B853: Apricot Fruity Bitz™, vitamin and mineral enriched dried fruit snack | C853: 42±3 | D853: 15 | E853: =(11.5*42)/100 -> 4.83
B854: (Blackmores Ltd., Balgowlah, NSW, Australia)
A855: =A853+1 -> 397 | B855: Banana, raw
B856: Banana (Canada) | C856: 46 | D856: 120 | E856: =(25.236*46)/100 -> 11.608560000000001
B857: Banana (Italy) | C857: 58 | D857: 120 | E857: =(23.08*58)/100 -> 13.386399999999998
B858: Banana (Canada) | C858: 58 | D858: 120 | E858: =(25.236*58)/100 -> 14.636880000000001
B859: Banana (Canada) | C859: 62±9 | D859: 120 | E859: =(25.236*62)/100 -> 15.646320000000001
B860: Banana (South Africa) | C860: 70±5 | D860: 120 | E860: =(23.08*70)/100 -> 16.155999999999999
B861: Banana, ripe (all yellow) (USA) | C861: 51 | D861: 120 | E861: =(25.236*51)/100 -> 12.87036
B862: Banana, under-ripe (Denmark) | C862: 30 | D862: 120 | E862: =(20.9*30)/100 -> 6.27
B863: Banana, slightly under-ripe (yellow with green sections) (USA) | C863: 42 | D863: 120 | E863: =(25.236*42)/100 -> 10.599120000000001
B864: Banana, over-ripe (yellow flecked with brown) (USA) | C864: 48 | D864: 120 | E864: =(25.236*48)/100 -> 12.11328
B865: Banana, over-ripe (Denmark) | C865: 52 | D865: 120 | E865: =(20.4*52)/100 -> 10.607999999999999
B866: mean of 10 studies | C866: 52±4 | D866: 120 | E866: =(23.8876*52)/100 -> 12.421551999999998
A867: =A855+1 -> 398 | B867: Banana, processed fruit fingers, Heinz Kidz™ (H J Heinz, Malvern, Vic, Australia) | C867: 61±11 | D867: 30 | E867: =(19.6*61)/100 -> 11.956000000000001
A868: =A867+1 -> 399 | B868: Breadfruit (Artocarpus altilis), raw (Australia)6 | C868: 68 | D868: 120 | E868: =(26.664*68)/100 -> 18.131520000000002
A869: =A868+1 -> 400 | B869: Cherries, raw, NS(Canada) | C869: 22 | D869: 120 | E869: =(12.405*22)/100 -> 2.7290999999999999
A870: =A869+1 -> 401 | B870: Chico (Zapota zapotilla coville), raw (Philippines)6 | C870: 40 | D870: 120 | E870: =(29.4*40)/100 -> 11.76
A871: =A870+1 -> 402 | B871: Cranberry juice
B872: Cranberry juice cocktail (Ocean Spray, Melbourne, Vic, Australia) | C872: 52±3 | D872: 250 | E872: =(30.9*52)/100 -> 16.067999999999998
B873: Cranberry juice cocktail (Ocean Spray Inc., Lakeville-Middleboro, MA, USA) | C873: 68±3 | D873: 250 | E873: =(35.417*68)/100 -> 24.083560000000002
B874: Cranberry juice drink, Ocean Spray® (Gerber Ltd., Bridgewater, Somerset, UK) | C874: 56±4 | D874: 250 | E874: =(29.3*56)/100 -> 16.408000000000001
A875: =A871+1 -> 403 | B875: Custard apple, raw, flesh only (Australia) | C875: 54±2 | D875: 120 | E875: =(18.96*54)/100 -> 10.2384
A876: =A875+1 -> 404 | B876: Dates, dried (Australia) | C876: 103±21 | D876: 60 | E876: =(40.343*103)/100 -> 41.553290000000004
A877: =A876+1 -> 405 | B877: Figs, dried, tenderised, Dessert Maid brand (Ernest Hall & Sons, Sydney, NSW, Australia) | C877: 61±6 | D877: 60 | E877: =(25.8*61)/100 -> 15.738
A878: =A877+1 -> 406 | B878: Fruit Cocktail, canned (Delmonte Canadian Canners Ltd., Hamilton, Canada) | C878: 55 | D878: 120 | E878: =(15.71*55)/100 -> 8.6405000000000012
A879: =A878+1 -> 407 | B879: Grapefruit, raw (Canada) | C879: 25 | D879: 120 | E879: =(10.92*25)/100 -> 2.73
A880: =A879+1 -> 408 | B880: Grapefruit juice, unsweetened (Sunpac, Toronto, Canada) | C880: 48 | D880: 250 | E880: =(19.747*48)/100 -> 9.4785599999999999
A881: =A880+1 -> 409 | B881: Grapes, raw
B882: Grapes, NS(Canada) | C882: 43 | D882: 120 | E882: =(16.77*43)/100 -> 7.2111000000000001
B883: Grapes, NS (Italy) | C883: =70*0.7 -> 49 | D883: 120 | E883: =(18.75*49)/100 -> 9.1875
B884: mean of two studies | C884: 46±3 | D884: 120 | E884: =(17.76*46)/100 -> 8.1696000000000009
B885: Grapes, black, Waltham Cross (Australia) | C885: 59 | D885: 120 | E885: =(17.83*59)/100 -> 10.519699999999998
A886: =A881+1 -> 410 | B886: Kiwi fruit, raw
B887: Kiwi fruit, Hayward (New Zealand)6 | C887: 47±4 | D887: 120 | E887: =(11.692*47)/100 -> 5.4952399999999999
B888: Kiwi fruit (Australia)6 | C888: 58±7 | D888: 120 | E888: =(11.692*58)/100 -> 6.7813599999999994
B889: mean of two studies | C889: 53±6 | D889: 120 | E889: =(11.692*53)/100 -> 6.1967600000000003
A890: =A886+1 -> 411 | B890: Lychee, canned in syrup and drained, Narcissus brand (China) | C890: 79±8 | D890: 120 | E890: =(20.4*79)/100 -> 16.116
A891: =A890+1 -> 412 | B891: Mango, raw
B892: Mango (Mangifera indica) (Philippines)6 | C892: 41 | D892: 120 | E892: =(19.68*41)/100 -> 8.0687999999999995
B893: Mango (Mangifera indica) (Australia)6 | C893: 51±3 | D893: 120 | E893: =(15.081*51)/100 -> 7.6913099999999996
B894: Mango, ripe (Mangifera indica) (India)11 | C894: 60±16 | D894: 120 | E894: =(15*60)/100 -> 9
B895: mean of three studies | C895: 51±5 | D895: 120 | E895: =(16.587*51)/100 -> 8.4593699999999998
A896: =A891+1 -> 413 | B896: Mango, low-fat frozen fruit dessert, Frutia™ (Weis Frozen Foods, Toowong, Qld, Australia) | C896: 42±3 | D896: 100 | E896: =(23*42)/100 -> 9.66
A897: =A896+1 -> 414 | B897: Marmalade, orange (Australia) | C897: 48±9 | D897: 30 | E897: =(19.6154*48)/100 -> 9.4153920000000006
A898: =A897+1 -> 415 | B898: Oranges, raw
B899: Oranges, NS (Denmark) | C899: 31 | D899: 120 | E899: =(10.7143*31)/100 -> 3.3214330000000003
B900: Oranges, NS (South Africa) | C900: 33±6 | D900: 120 | E900: =(10*33)/100 -> 3.3
B901: Oranges, NS (Canada) | C901: 40±3 | D901: 120 | E901: =(11.22*40)/100 -> 4.4880000000000004
B902: Oranges, NS (Italy) | C902: 48 | D902: 120 | E902: =(11.1524*48)/100 -> 5.3531519999999997
B903: Oranges (Sunkist, Van Nuys, CA, USA) | C903: 48 | D903: 120 | E903: =(11.22*48)/100 -> 5.3856000000000002
B904: Oranges NS(Canada) | C904: 51 | D904: 120 | E904: =(11.22*51)/100 -> 5.7222
B905: mean of six studies | C905: 42±3 | D905: 120 | E905: =(10.921*42)/100 -> 4.5868199999999995
A906: =A898+1 -> 416 | B906: Orange juice
B907: Orange Juice (Canada) | C907: 46±6 | D907: 250 | E907: =(25.5*46)/100 -> 11.73
B908: Orange juice, unsweetened, reconstituted concentrate, Quelch brand (Berri Ltd., Australia) | C908: 53±6 | D908: 250 | E908: =(17.79*53)/100 -> 9.4286999999999992
B909: Orange juice, reconstituted from frozen concentrate (USA) | C909: 57±6 | D909: 250 | E909: =(26.45*57)/100 -> 15.076499999999999
B910: mean of three studies | C910: 52±3 | D910: 250 | E910: =(23.247*52)/100 -> 12.08844
A911: =A906+1 -> 417 | B911: Paw paw/papaya, raw
B912: Paw paw (Carica papaya) (Australia)6 | C912: 56±6 | D912: 120 | E912: =(8.32*56)/100 -> 4.6592000000000002
B913: Paw paw (papaya), ripe (India)11 | C913: 60±16 | D913: 120 | E913: =(29.0323*60)/100 -> 17.41938
B914: Papaya (Carica papaya) (Philippines)6 | C914: 60 | D914: 120 | E914: =(14.52*60)/100 -> 8.7119999999999997
B915: mean of three studies | C915: 59±1 | D915: 120 | E915: =(17.291*59)/100 -> 10.201689999999999
B916: Peaches
A917: =A911+1 -> 418 | B917: Peach, raw (Canada) | C917: 28 | D917: 120 | E917: =(13.379*28)/100 -> 3.7461199999999995
B918: Peach, raw (Italy) | C918: =80*0.7 -> 56 | D918: 120 | E918: =(8.29*56)/100 -> 4.6423999999999994
B919: mean of two studies | C919: 42±14 | D919: 120 | E919: =(10.8347*42)/100 -> 4.5505740000000001
A920: =A917+1 -> 419 | B920: Peach, canned in natural juice (Goulburn Valley, Ardmona Foods, Mooroopna, Vic, Australia) | C920: 30±4 | D920: 120 | E920: =(11.1692*30)/100 -> 3.3507600000000002
B921: Peach, canned in natural juice (SPC Ltd., Shepparton, Vic, Australia) | C921: 45±6 | D921: 120 | E921: =(11.1692*45)/100 -> 5.0261399999999998
B922: mean of two studies | C922: 38±8 | D922: 120 | E922: =(11.1692*38)/100 -> 4.2442960000000003
A923: =A920+1 -> 420 | B923: Peach, canned in heavy syrup (Letona Foods, Hawthorn East, Vic, Australia) | C923: 58±11 | D923: 120 | E923: =(14.954*58)/100 -> 8.6733200000000004
A924: =A923+1 -> 421 | B924: Peach, canned in light syrup (Delmonte, Canadian Canners Ltd.) | C924: 52 | D924: 120 | E924: =(17.63*52)/100 -> 9.1676000000000002
A925: =A924+1 -> 422 | B925: Peach, canned in reduced-sugar syrup, SPC Lite (SPC Ltd., Australia) | C925: 62±9 | D925: 120 | E925: =(17.28*62)/100 -> 10.713600000000001
B926: Pears
A927: =A925+1 -> 423 | B927: Pear, raw, NS(Canada) | C927: 33 | D927: 120 | E927: =(12.71*33)/100 -> 4.1943000000000001
A928: =A927+1 -> 424 | B928: Pear, Winter Nellis, raw (New Zealand)6 | C928: 34±4 | D928: 120 | E928: =(11.986*34)/100 -> 4.07524
A929: =A928+1 -> 425 | B929: Pear, Bartlett, raw (Canada) | C929: 41 | D929: 120 | E929: =(8.39*41)/100 -> 3.4399000000000002
A930: =A929+1 -> 426 | B930: Pear, raw, NS (Italy) | C930: =60*0.7 -> 42 | D930: 120 | E930: =(10.714*42)/100 -> 4.4998800000000001
B931: mean of four studies | C931: 38±2 | D931: 120 | E931: =(10.95*38)/100 -> 4.1609999999999996
A932: =A930+1 -> 427 | B932: Pear halves, canned in reduced-sugar syrup, SPC Lite (SPC Ltd., Australia) | C932: 25±6 | D932: 120 | E932: =(14.4*25)/100 -> 3.6
A933: =A932+1 -> 428 | B933: Pear halves, canned in natural juice (SPC Ltd., Australia) | C933: 43±15 | D933: 120 | E933: =(12.67*43)/100 -> 5.4480999999999993
A934: =A933+1 -> 429 | B934: Pear, canned in pear juice, Bartlett (Delmonte, Canadian Canners Ltd.) | C934: 44 | D934: 120 | E934: =(10.91*44)/100 -> 4.8003999999999998
B935: Pineapple
A936: =A934+1 -> 430 | B936: Pineapple, raw (Australia)6 | C936: 66±7 | D936: 120 | E936: =(9.6*66)/100 -> 6.3360000000000003
B937: Pineapple (Ananas comosus), raw (Philippines)6 | C937: 51 | D937: 120 | E937: =(15.6*51)/100 -> 7.9560000000000004
B938: mean of two studies | C938: 59±8 | D938: 120 | E938: =(12.6*59)/100 -> 7.4340000000000002
A939: =A936+1 -> 431 | B939: Pineapple juice, unsweetened (Dole Packaged Foods, Toronto, Canada) | C939: 46 | D939: 250 | E939: =(33.512*46)/100 -> 15.415520000000001
B940: Plums
A941: =A939+1 -> 432 | B941: Plum, raw, NS (Canada) | C941: 24 | D941: 120 | E941: =(13.812*24)/100 -> 3.31488
B942: Plum, raw, NS (Italy) | C942: 53 | D942: 120 | E942: =(10.6952*53)/100 -> 5.6684559999999999
B943: mean of two studies | C943: 39±15 | D943: 120 | E943: =(12.2536*39)/100 -> 4.7789039999999998
A944: =A941+1 -> 433 | B944: Prunes, pitted (Sunsweet Growers Inc., Yuba City, CA, USA) | C944: 29±4 | D944: 60 | E944: =(33.378*29)/100 -> 9.6796199999999999
A945: =A944+1 -> 434 | B945: Raisins (Canada) | C945: 64±11 | D945: 60 | E945: =(44.464*64)/100 -> 28.456959999999999
A946: =A945+1 -> 435 | B946: Rockmelon/Cantaloupe, raw (Australia)6 | C946: 65±9 | D946: 120 | E946: =(5.673*65)/100 -> 3.6874500000000001
A947: =A946+1 -> 436 | B947: Strawberries, fresh, raw (Sydney, NSW, Australia)6 | C947: 40±7 | D947: 120 | E947: =(3.2276*40)/100 -> 1.2910399999999997
A948: =A947+1 -> 437 | B948: Strawberry jam | C948: 51±10 | D948: 30 | E948: =(20.19231*51)/100 -> 10.2980781
A949: =A948+1 -> 438 | B949: Strawberry processed fruit bars, Real Fruit Bars (Uncle Toby's, Australia) | C949: 90±12 | D949: 30 | E949: =(25.59*90)/100 -> 23.030999999999999
A950: =A949+1 -> 439 | B950: Sultanas | C950: 56±11 | D950: 60 | E950: =(45*56)/100 -> 25.2
A951: =A950+1 -> 440 | B951: Tomato juice, no added sugar (Berri Ltd., Berri, SA, Australia)6 | C951: 38±4 | D951: 250 | E951: =(9.216*38)/100 -> 3.5020799999999999
A952: =A951+1 -> 441 | B952: Tropical Fruity Bitz™, vitamin and mineral enriched dried fruit snack | C952: 41±3 | D952: 15 | E952: =(11.4*41)/100 -> 4.6740000000000004
B953: (Blackmores Ltd., Australia)
A954: =A952+1 -> 442 | B954: Vitari, wild berry, non-dairy, frozen fruit dessert (Nestlé, Sydney, NSW, Australia) | C954: 59±8 | D954: 100 | E954: =(20.93*59)/100 -> 12.348699999999999
A955: =A954+1 -> 443 | B955: Watermelon, raw (Australia)6 | C955: 72±13 | D955: 120 | E955: =(6.031*72)/100 -> 4.34232
A956: =A955+1 -> 444 | B956: Wild Berry Fruity Bitz™, vitamin and mineral enriched dried fruit snack | C956: 35±4 | D956: 15 | E956: =(11.7*35)/100 -> 4.0949999999999998
B957: (Blackmores Ltd., Australia)
B959: INFANT FORMULA AND WEANING FOODS
A960: =A956+1 -> 445 | B960: Formula
B961: Infasoy™, soy-based, milk-free (Wyeth Nutritionals, Baulkham Hills, NSW, Australia)6 | C961: 55±6 | D961: 100 mL | E961: =(6.9*54.8)/100 -> 3.7812000000000001
B962: Karicare™ gold starter formula with omega plsu LCP oils (Nutricia, Auckland, New Zealand)6 | C962: 35±5 | D962: 100 mL | E962: =(7*34.9)/100 -> 2.4429999999999996
B963: Nan-1™ infant formula with iron (Nestlé, Sydney, NSW, Australia)6 | C963: 30±6 | D963: 100 mL | E963: =(7.6*29.9)/100 -> 2.2723999999999998
B964: S-26™ infant formula (Wyeth Nutritionals, Australia)6 | C964: 36±6 | D964: 100 mL | E964: =(7.2*36.4)/100 -> 2.6208
B965: Weaning Foods
A966: =A960+1 -> 446 | B966: Farex™ baby rice (Heinz Wattie's Ltd., Malvern, Vic, Australia)6 | C966: 95±13 | D966: 87 | E966: =(6*95)/100 -> 5.7
A967: =A966+1 -> 447 | B967: Robinsons First Tastes from 4 months (Nutricia, Wells, UK)
B968: Apple, apricot and banana cereal6 | C968: 56±8 | D968: 75 | E968: 7
B969: Creamed porridge6 | C969: 59±8 | D969: 75 | E969: =(9.2*58.7)/100 -> 5.4003999999999994
B970: Rice pudding6 | C970: 59±6 | D970: 75 | E970: =(11*59)/100 -> 6.49
A971: =A967+1 -> 448 | B971: Heinz for Baby from 4 months (Heinz Wattie's Ltd., Australia)
B972: Chicken and noodles with vegetables, strained6 | C972: 67±11 | D972: 120 | E972: =(7.2*67)/100 -> 4.8240000000000007
B973: Sweetcorn and rice6 | C973: 65±13 | D973: 120 | E973: =(14.769*65.4)/100 -> 9.658926000000001
B975: LEGUMES AND NUTS
A976: =A971+1 -> 449 | B976: Baked Beans
B977: Baked Beans, canned (Canada) | C977: 40±3
B978: Baked Beans, canned haricot/navy beans in tomato sauce | C978: =80*0.7 -> 56
B979: (Libby, McNeill & Libby, Chatham, Canada)
B980: mean of two studies | C980: 48±8 | D980: 150 | E980: =(15.464*48)/100 -> 7.4227200000000009
A981: =A976+1 -> 450 | B981: Beans, dried, boiled
B982: Beans, dried, type NS(Italy) | C982: 36 | D982: 150 | E982: =(29.865*36)/100 -> 10.751399999999999
B983: Beans, dried, type NS(Italy) | C983: 20 | D983: 150 | E983: =(29.865*20)/100 -> 5.9729999999999999
B984: mean of two studies | C984: 29±9 | D984: 150 | E984: =(29.865*29)/100 -> 8.6608499999999999
A985: =A981+1 -> 451 | B985: Blackeyed beans/peas (Cowpeas), boiled
B986: Blackeyed beans (Canada) | C986: 50 | D986: 150 | E986: =(30.455*50)/100 -> 15.227499999999999
B987: Blackeyed beans (Canada) | C987: 33±4 | D987: 150 | E987: =(30.455*33)/100 -> 10.05015
B988: mean of two studies | C988: 42±9 | D988: 150 | E988: =(30.455*42)/100 -> 12.791099999999998
A989: =A985+1 -> 452 | B989: Butter Beans
B990: Butter beans (South Africa) | C990: 28±7 | D990: 150 | E990: =(19.549*28)/100 -> 5.4737199999999993
B991: Butter beans, dried, cooked 1.25 h (South Africa) | C991: 29±8 | D991: 150 | E991: =(19.549*29)/100 -> 5.6692099999999996
B993: Butter beans (Canada) | C993: 36±4 | D993: 150 | E993: =(19.549*36)/100 -> 7.0376399999999997
B994: mean of three studies | C994: 31±3 | D994: 150 | E994: =(19.549*31)/100 -> 6.0601900000000004
B995: Butter beans, dried, boiled + 5g sucrose (South Africa) | C995: 30±2 | D995: 150 | E995: =(19.549*30)/100 -> 5.8647
B997: Butter beans, dried, boiled + 10g sucrose (South Africa) | C997: 31±2 | D997: 150 | E997: =(19.549*31)/100 -> 6.0601900000000004
B999: Butter beans, dried, boiled + 15g sucrose (South Africa) | C999: 54±4 | D999: 150 | E999: =(19.549*54)/100 -> 10.55646
A1001: =A989+1 -> 453 | B1001: Chickpeas (Garbanzo beans, Bengal gram), boiled
B1002: Chickpeas (Cicer arietinum Linn), dried, soaked, boiled 35 min (Philippines) | C1002: 10 | D1002: 150 | E1002: =(29.715*10)/100 -> 2.9714999999999998
B1003: Chickpeas, dried, boiled (Canada) | C1003: 31 | D1003: 150 | E1003: =(29.715*31)/100 -> 9.2116499999999988
B1004: Chickpeas (Canada) | C1004: 33 | D1004: 150 | E1004: =(29.715*33)/100 -> 9.8059500000000011
B1005: Chickpeas (Canada) | C1005: 36±5 | D1005: 150 | E1005: =(29.715*36)/100 -> 10.6974
B1006: mean of four studies | C1006: 28±6 | D1006: 150 | E1006: =(29.715*28)/100 -> 8.3201999999999998
A1007: =A1001+1 -> 454 | B1007: Chickpeas, canned in brine (Lancia-Bravo Foods Ltd., Toronto, Canada) | C1007: 42 | D1007: 150 | E1007: =(22.32*42)/100 -> 9.3744000000000014
A1008: =A1007+1 -> 455 | B1008: Chickpeas, curry, canned (Canasia Foods Ltd., Scarborough, Canada) | C1008: 41 | D1008: 150 | E1008: =(16.304*41)/100 -> 6.684639999999999
A1009: =A1008+1 -> 456 | B1009: Haricot/Navy beans
B1010: Haricot/Navy beans, pressure cooked at 15 psi for 25 min (King Grains, Toronto, Canada) | C1010: 29 | D1010: 150 | E1010: =(32.6087*29)/100 -> 9.4565229999999989
B1011: Haricot/Navy beans, dried, boiled (Canada) | C1011: 30 | D1011: 150 | E1011: =(29.865*30)/100 -> 8.9594999999999985
B1012: Haricot/Navy beans, boiled (Canada) | C1012: 31±6 | D1012: 150 | E1012: =(29.865*31)/100 -> 9.2581499999999988
B1013: Haricot/Navy beans (King Grains, Canada) | C1013: 39 | D1013: 150 | E1013: =(29.865*39)/100 -> 11.647349999999999
B1014: Haricot/Navy beans, pressure cooked at15 psi for 25 min (King Grains, Canada) | C1014: 59 | D1014: 150 | E1014: =(32.6087*59)/100 -> 19.239132999999999
B1015: mean of five studies | C1015: 38±6 | D1015: 150 | E1015: =(30.96248*38)/100 -> 11.765742399999999
A1016: =A1009+1 -> 457 | B1016: Kidney Beans
B1017: Kidney/white bean (Phaseolus vulgaris Linn), soaked, boiled 17 min (Philippines) | C1017: 13 | D1017: 150 | E1017: =(24.615*13)/100 -> 3.1999499999999999
B1018: Kidney beans (Phaseolus vulgaris) (India) | C1018: 19 | D1018: 150 | E1018: =(24.615*19)/100 -> 4.6768499999999991
B1019: Kidney beans (USA)5 | C1019: 23 | D1019: 150 | E1019: =(24.615*23)/100 -> 5.6614499999999994
B1020: Kidney beans, dried, boiled (France) | C1020: 23±1 | D1020: 150 | E1020: =(24.615*23)/100 -> 5.6614499999999994
B1021: Kidney beans (Phaseolus vulgaris L.), red, soaked 20 min, boiled 70 min (Sweden) | C1021: 25 | D1021: 150 | E1021: =(24.615*25)/100 -> 6.1537499999999996
B1022: Kidney beans (Canada) | C1022: 29±8 | D1022: 150 | E1022: =(24.615*29)/100 -> 7.1383499999999991
B1023: Kidney beans, dried, boiled (Canada) | C1023: 42 | D1023: 150 | E1023: =(24.615*42)/100 -> 10.338299999999998
B1024: Kidney beans (Canada) | C1024: 46 | D1024: 150 | E1024: =(24.615*46)/100 -> 11.322899999999999
B1025: mean of eight studies | C1025: 28±4 | D1025: 150 | E1025: =(24.615*28)/100 -> 6.892199999999999
A1026: =A1016+1 -> 458 | B1026: Kidney beans (Phaseolus vulgaris L.) - autoclaved | C1026: 34 | D1026: 150 | E1026: =(24.615*34)/100 -> 8.3690999999999995
A1027: =A1026+1 -> 459 | B1027: Kidney beans, canned (Lancia-Bravo Foods Ltd., Canada) | C1027: 52 | D1027: 150 | E1027: =(17.4*52)/100 -> 9.048
A1028: =A1027+1 -> 460 | B1028: Kidney beans, dried, soaked 12 h, stored moist 24 h, steamed 1 h (India)11 | C1028: 70±11 | D1028: 150 | E1028: =(24.615*70)/100 -> 17.230499999999999
A1029: =A1028+1 -> 461 | B1029: Black bean (Phaseolus vulgaris Linn), soaked overnight, cooked 45 min (Philippines) | C1029: 20 | D1029: 150 | E1029: =(24.615*20)/100 -> 4.9229999999999992
A1030: =A1029+1 -> 462 | B1030: Lentils, type NS
B1031: Lentils, type NS (USA) | C1031: 28
B1032: Lentils, type NS (Canada) | C1032: 29±3
B1033: mean of two studies | C1033: 29±1 | D1033: 150 | E1033: =(18.36*28.5)/100 -> 5.2325999999999997
A1034: =A1030+1 -> 463 | B1034: Lentils, green
B1035: Lentils, green, dried, boiled (Canada) | C1035: 22 | D1035: 150 | E1035: =(18.36*22)/100 -> 4.0391999999999992
B1036: Lentils, green, dried, boiled (France) | C1036: 30±15 | D1036: 150 | E1036: =(18.36*30)/100 -> 5.5079999999999991
B1037: Lentils, green, dried, boiled (Australia) | C1037: 37±3 | D1037: 150 | E1037: =(14.2*37)/100 -> 5.2539999999999996
B1038: mean of three studies | C1038: 30±4 | D1038: 150 | E1038: =(16.973*30)/100 -> 5.091899999999999
A1039: =A1034+1 -> 464 | B1039: Lentils, green, canned in brine (Lancia-Bravo Foods Ltd., Canada) | C1039: 52 | D1039: 150 | E1039: =(17.281*52)/100 -> 8.9861199999999997
A1040: =A1039+1 -> 465 | B1040: Lentils, red
B1041: Lentils, red, dried, boiled (Canada) | C1041: 18 | D1041: 150 | E1041: =(18.36*18)/100 -> 3.3048000000000002
B1042: Lentils, red, dried, boiled (Canada) | C1042: 21 | D1042: 150 | E1042: =(18.36*21)/100 -> 3.8555999999999999
B1043: Lentils, red, dried, boiled (Canada) | C1043: 31 | D1043: 150 | E1043: =(18.36*31)/100 -> 5.6915999999999993
B1044: Lentils, red, dried, boiled (Canada) | C1044: 32 | D1044: 150 | E1044: =(18.36*32)/100 -> 5.8751999999999995
B1045: mean of four studies | C1045: 26±4 | D1045: 150 | E1045: =(18.36*26)/100 -> 4.7736000000000001
A1046: =A1040+1 -> 466 | B1046: Lima beans, baby, frozen, reheated in microwave oven (York, Canada Packers, Toronto, Canada) | C1046: 32 | D1046: 150 | E1046: =(30*32)/100 -> 9.6
A1047: =A1046+1 -> 467 | B1047: Marrowfat peas
B1048: Marrowfat peas, dried, boiled (USA) | C1048: 31
B1049: Marrowfat peas, dried, boiled (Canada) | C1049: 47±3
B1050: mean of two studies | C1050: 39±8 | D1050: 150 | E1050: =(19.21*39)/100 -> 7.4919000000000002
A1051: =A1047+1 -> 468 | B1051: Mung beans
B1052: Mung bean (Phaseolus areus Roxb), soaked, boiled 20 min (Philippines) | C1052: 31 | D1052: 150 | E1052: =(17.31*31)/100 -> 5.3661000000000003
B1053: Mung bean, fried (Australia) | C1053: 53±8
B1054: Mung bean, germinated (Australia) | C1054: 25±4 | D1054: 150 | E1054: =(17.31*25)/100 -> 4.3274999999999997
B1055: Mung bean, pressure cooked (Australia) | C1055: 42±5 | D1055: 150 | E1055: =(17.31*42)/100 -> 7.2702
A1056: =A1051+1 -> 469 | B1056: Peas, dried, boiled (Australia) | C1056: 22 | D1056: 150 | E1056: =(8.82353*22)/100 -> 1.9411765999999999
A1057: =A1056+1 -> 470 | B1057: Pigeon Pea (Cajanus cajan Linn. Huth.), soaked, boiled 45 min (Philippines) | C1057: 22 | D1057: 150 | E1057: =(19.935*22)/100 -> 4.3856999999999999
A1058: =A1057+1 -> 471 | B1058: Pinto beans
B1059: Pinto beans, dried, boiled (Canada) | C1059: 39 | D1059: 150 | E1059: =(25.575*39)/100 -> 9.9742499999999996
B1060: Pinto beans, canned in brine (Lancia-Bravo Foods Ltd., Canada) | C1060: 45 | D1060: 150 | E1060: =(21.8659*45)/100 -> 9.8396550000000005
A1061: =A1058+1 -> 472 | B1061: Romano beans (Canada) | C1061: 46 | D1061: 150 | E1061: =(18.34*46)/100 -> 8.436399999999999
A1062: =A1061+1 -> 473 | B1062: Soya beans
B1063: Soya beans, dried, boiled (Canada) | C1063: 15±5 | D1063: 150 | E1063: =(5.88*15)/100 -> 0.88200000000000001
B1064: Soya beans, dried, boiled (Australia) | C1064: 20±3 | D1064: 150 | E1064: =(5.88*20)/100 -> 1.1759999999999999
B1065: mean of two studies | C1065: 18±3 | D1065: 150 | E1065: =(5.88*18)/100 -> 1.0584
B1066: Soya beans, canned (Canada) | C1066: 14±2 | D1066: 150 | E1066: =(5.88*14)/100 -> 0.82319999999999993
A1067: =A1062+1 -> 474 | B1067: Split peas, yellow, boiled 20 min (Nupack, Mississauga, Canada) | C1067: 32 | D1067: 150 | E1067: =(19.215*32)/100 -> 6.1487999999999996
B1069: MEAL REPLACEMENT PRODUCTS
A1070: =A1067+1 -> 475 | B1070: Hazelnut & Apricot bar (Dietworks, South Yarra, Vic, Australia) | C1070: 42±7 | D1070: 50 | E1070: =(22.45*42)/100 -> 9.4290000000000003
A1071: =A1070+1 -> 476 | B1071: L.E.A.N™ products (Usana Inc., Salt Lake City, UT, US)
B1072: L.E.A.N Fibergy™ bar, Harvest Oat | C1072: 45±4 | D1072: 50 | E1072: =(29.17*45)/100 -> 13.1265
B1073: Nutrimeal™, drink powder, Dutch Chocolate | C1073: 26±3 | D1073: 250 | E1073: =(12.642*26)/100 -> 3.2869200000000003
B1074: L.E.A.N (Life long) Nutribar™, Peanut Crunch | C1074: 30±4 | D1074: 40 | E1074: =(18.53659*30)/100 -> 5.5609770000000003
B1075: L.E.A.N (Life long) Nutribar™, Chocolate Crunch | C1075: 32±4 | D1075: 40 | E1075: =(18.53659*32)/100 -> 5.9317088
B1076: mean of two Nutri bars | C1076: 31±1 | D1076: 40 | E1076: =(18.53659*31)/100 -> 5.7463428999999993
B1077: Worldwide Sport Nutrition reduced-carbohydrate products (2000 formulations)
B1078: (Worldwide Sport Nutritional Supplements Inc., Largo, FL, US)
A1079: =A1071+1 -> 477 | B1079: Designer chocolate, sugar-free6 | C1079: 14±3 | D1079: 35 | E1079: =(21.5385*14)/100 -> 3.01539
A1080: =A1079+1 -> 478 | B1080: Burn-it™ bars
B1081: Chocolate deluxe6 | C1081: 29±3 | D1081: 50 | E1081: =(8*29)/100 -> 2.32
B1082: Peanut butter6 | C1082: 23±3 | D1082: 50 | E1082: =(6*23)/100 -> 1.38
A1083: =A1080+1 -> 479 | B1083: Pure-protein™ bars
B1084: Chewy choc-chip6 | C1084: 30±4 | D1084: 80 | E1084: =(13.846*30)/100 -> 4.1538000000000004
B1085: Chocolate deluxe6 | C1085: 38±4 | D1085: 80 | E1085: =(12.8205*38)/100 -> 4.8717899999999998
B1086: Peanut butter6 | C1086: 22±4 | D1086: 80 | E1086: =(9.231*22)/100 -> 2.0308199999999998
B1087: Strawberry shortcake6 | C1087: 43±4 | D1087: 80 | E1087: =(12.8205*43)/100 -> 5.5128149999999998
B1088: White chocolate mousse6 | C1088: 40±4 | D1088: 80 | E1088: =(14.872*40)/100 -> 5.9488000000000003
A1089: =A1083+1 -> 480 | B1089: Pure-protein™ cookies
B1090: Choc-chip cookie dough6 | C1090: 25±3 | D1090: 55 | E1090: =(10.804*25)/100 -> 2.7010000000000001
B1091: Coconut6 | C1091: 42±5 | D1091: 55 | E1091: =(8.8393*42)/100 -> 3.7125059999999994
B1092: Peanut butter6 | C1092: 37±7 | D1092: 55 | E1092: =(8.8393*37)/100 -> 3.2705410000000001
A1093: =A1089+1 -> 481 | B1093: Ultra pure-protein™ shakes
B1094: Cappuccino | C1094: 47±6 | D1094: 250 | E1094: =(1.33*47)/100 -> 0.6251000000000001
B1095: Frosty chocolate | C1095: 37±6 | D1095: 250 | E1095: =(2.665*37)/100 -> 0.98605000000000009
B1096: Strawberry shortcake | C1096: 42±4 | D1096: 250 | E1096: =(1.33*42)/100 -> 0.55859999999999999
B1097: Vanilla ice cream | C1097: 32±5 | D1097: 250 | E1097: =(2.665*32)/100 -> 0.8528
B1099: MIXED MEALS AND CONVENIENCE FOODS
A1100: =A1093+1 -> 482 | B1100: Chicken nuggets, frozen, reheated in microwave oven 5 min (Savings, Grocery Holdings, | C1100: 46±4 | D1100: 100 | E1100: =(16.3*46)/100 -> 7.4980000000000011
B1101: Tooronga, Vic, Australia)
A1102: =A1100+1 -> 483 | B1102: Fish Fingers (Canada) | C1102: 38±6 | D1102: 100 | E1102: =(19.13*38)/100 -> 7.2693999999999992
A1103: =A1102+1 -> 484 | B1103: Greek lentil stew with a bread roll, home made (Australia) | C1103: 40±5 | D1103: 360 | E1103: =(36.81*40)/100 -> 14.724
A1104: =A1103+1 -> 485 | B1104: Kugel (Polish dish containing egg noodles, sugar, cheese and raisins) (Israel) | C1104: 65±6 | D1104: 150 | E1104: =(48.42*65)/100 -> 31.473000000000003
A1105: =A1104+1 -> 486 | B1105: Lean Cuisine™, French style chicken with rice, reheated (Nestlé, Sydney, NSW, Australia)6 | C1105: 36±6 | D1105: 400 | E1105: =(68*36)/100 -> 24.48
A1106: =A1105+1 -> 487 | B1106: Pies, beef, party size (Farmland, Grocery Holdings, Australia) | C1106: 45±6 | D1106: 100 | E1106: =(26.8*45)/100 -> 12.06
A1107: =A1106+1 -> 488 | B1107: Pizza
B1108: Pizza, cheese (Pillsbury Canada Ltd., Toronto, Canada) | C1108: 60 | D1108: 100 | E1108: =(26.79*60)/100 -> 16.073999999999998
B1109: Pizza, plain baked dough, served with parmesan cheese and tomato sauce (Italy) | C1109: 80 | D1109: 100 | E1109: =(27*80)/100 -> 21.6
B1110: Pizza, Super Supreme, pan (11.4% fat) (Pizza Hut, Sydney, NSW, Australia) | C1110: 36±6 | D1110: 100 | E1110: =(24.2*36)/100 -> 8.7119999999999997
B1111: Pizza, Super Supreme, thin and crispy (13.2 % fat) (Pizza Hut, Australia) | C1111: 30±4 | D1111: 100 | E1111: =(22.206*30)/100 -> 6.6617999999999995
B1112: Pizza, Vegetarian Supreme, thin and crispy (7.8 % fat) (Pizza Hut, Australia)6 | C1112: 49±6 | D1112: 100 | E1112: =(25.253*49)/100 -> 12.37397
A1113: =A1107+1 -> 489 | B1113: Sausages, NS(Canada) | C1113: 28±6 | D1113: 100 | E1113: =(2.7*28)/100 -> 0.75600000000000012
A1114: =A1113+1 -> 490 | B1114: Sirloin chop with mixed vegetables and mashed potato, home made (Australia) | C1114: 66±12 | D1114: 360 | E1114: =(52.853*66)/100 -> 34.882980000000003
A1115: =A1114+1 -> 491 | B1115: Spaghetti bolognaise, home made (Australia) | C1115: 52±9 | D1115: 360 | E1115: =(48*52)/100 -> 24.96
A1116: =A1115+1 -> 492 | B1116: Stirfried vegetables with chicken and boiled white rice, home made (Australia) | C1116: 73±17 | D1116: 360 | E1116: =(74.94*73)/100 -> 54.706199999999995
A1117: =A1116+1 -> 493 | B1117: Sushi
B1118: Sushi, salmon (from 'I Love Sushi' chain store, Sydney, NSW, Australia)6 | C1118: 48±8 | D1118: 100 | E1118: =(36.179*48)/100 -> 17.365920000000003
B1119: Sushi, roasted sea algae, vinegar and rice (Japan) | C1119: 55 | D1119: 100 | E1119: =(37.21*55)/100 -> 20.465499999999999
B1120: Mean of two studies | C1120: 52±4 | D1120: 100 | E1120: =(36.6924*52)/100 -> 19.080047999999998
A1121: =A1117+1 -> 494 | B1121: White boiled rice, grilled beefburger, cheese, and butter (France) | C1121: 27 | D1121: 440 | E1121: =(50*27)/100 -> 13.5
B1122: White boiled rice, grilled beefburger, cheese and butter (France) | C1122: 22 | D1122: 440 | E1122: =(50*22)/100 -> 11
B1123: Mean in two groups of subjects | C1123: 25±2 | D1123: 440 | E1123: =(50*25)/100 -> 12.5
B1124: White bread with toppings
A1125: =A1121+1 -> 495 | B1125: White wheat flour bread, butter, cheese, regular cow's milk and fresh cucumber (Sweden)6 | C1125: 55 | D1125: 200 | E1125: =(68.243*55)/100 -> 37.533649999999994
A1126: =A1125+1 -> 496 | B1126: White wheat flour bread, butter, yoghurt and pickled cucumber (Sweden)6 | C1126: 39 | D1126: 200 | E1126: =(28.103*39)/100 -> 10.96017
A1127: =A1126+1 -> 497 | B1127: White bread with butter (Canada) | C1127: 59 | D1127: 100 | E1127: =(48.31*59)/100 -> 28.5029
A1128: =A1127+1 -> 498 | B1128: White bread with skim milk cheese (Canada) | C1128: 55 | D1128: 100 | E1128: =(47.2*55)/100 -> 25.96
A1129: =A1128+1 -> 499 | B1129: White bread with butter and skim milk cheese (Canada) | C1129: 62 | D1129: 100 | E1129: =(37.64*62)/100 -> 23.336799999999997
A1130: =A1129+1 -> 500 | B1130: White/wholemeal wheat bread with peanut butter (Canada) | C1130: 51 | D1130: 100 | E1130: =(44.4*51)/100 -> 22.644000000000002
B1131: White/wholemeal wheat bread with peanut butter (Canada) | C1131: 67 | D1131: 100 | E1131: =(44.4*67)/100 -> 29.747999999999998
B1132: mean of two studies | C1132: 59±8 | D1132: 100 | E1132: =(44.4*59)/100 -> 26.195999999999998
B1134: NUTRITIONAL SUPPORT PRODUCTS
A1135: =A1130+1 -> 501 | B1135: Choicedm™, vanilla (Mead Johnson Nutritionals, Evansville, IN, US) | C1135: 23±4 | D1135: 237mL | E1135: 6
A1136: =A1135+1 -> 502 | B1136: Enercal Plus™, made from powder (Wyeth-Ayerst International Inc., Madison, NJ, US) | C1136: 61±13 | D1136: 237mL | E1136: 24
A1137: =A1136+1 -> 503 | B1137: Ensure™ (Abbott Australasia, Kurnell, NSW, Australia) | C1137: 50±8 | D1137: 237mL | E1137: 19
A1138: =A1137+1 -> 504 | B1138: Ensure™, vanilla (Abbott Australasia) | C1138: 48±3 | D1138: 250mL | E1138: =(34.2*48)/100 -> 16.416
A1139: =A1138+1 -> 505 | B1139: Ensure™ bar, chocolate fudge brownie (Abbott Australasia) | C1139: 43±3 | D1139: 38 | E1139: =(19.5*43)/100 -> 8.3849999999999998
A1140: =A1139+1 -> 506 | B1140: Ensure Plus™, vanilla (Abbott Australasia) | C1140: 40±4 | D1140: 237mL | E1140: =(47.3*40)/100 -> 18.92
A1141: =A1140+1 -> 507 | B1141: Ensure Pudding™, old fashioned vanilla (Abbott Laboratories Inc., Ashland, OH, USA) | C1141: 36±4 | D1141: 113 | E1141: =(26*36)/100 -> 9.36
A1142: =A1141+1 -> 508 | B1142: Glucerna™, vanilla (Abbott Laboratories Inc., USA)6 | C1142: 31±2 | D1142: 237mL | E1142: =(22.8*31)/100 -> 7.0680000000000005
A1143: =A1142+1 -> 509 | B1143: Jevity™ (Abbott Australasia) | C1143: 48±3 | D1143: 237mL | E1143: =(35.9*48)/100 -> 17.231999999999999
A1144: =A1143+1 -> 510 | B1144: Resource Diabetic™, French vanilla (Novartis Nutrition Corp., Young America, MN, USA)6 | C1144: 34±3 | D1144: 237mL | E1144: =(23.4*34)/100 -> 7.9559999999999995
A1145: =A1144+1 -> 511 | B1145: Resource Diabetic™, Swiss chocolate (Novartis, Auckland, New Zealand) | C1145: 16±4 | D1145: 237mL | E1145: 7
A1146: =A1145+1 -> 512 | B1146: Resource™ thickened orange juice, honey consistency (Novartis, New Zealand) | C1146: 47±9 | D1146: 237mL | E1146: 18
A1147: =A1146+1 -> 513 | B1147: Resource™ thickened orange juice, nectar consistency (Novartis, New Zealand) | C1147: 54±7 | D1147: 237mL | E1147: 19
A1148: =A1147+1 -> 514 | B1148: Resource™ fruit beverage, peach flavour (Novartis, New Zealand) | C1148: 40±8 | D1148: 237mL | E1148: 16
A1149: =A1148+1 -> 515 | B1149: Sustagen™, Dutch Chocolate (Mead Johnson, Bristol Myers Squibb, Rydalmere, NSW, Australia) | C1149: 31±4 | D1149: 250mL | E1149: =(41.2*31)/100 -> 12.772
A1150: =A1149+1 -> 516 | B1150: Sustagen™ Hospital with extra fiber, drink made from powdered mix (Mead Johnson, Australia) | C1150: 33±4 | D1150: 250mL | E1150: 15
A1151: =A1150+1 -> 517 | B1151: Sustagen™ Instant Pudding, vanilla, made from powdered mix (Mead Johnson, Australia) | C1151: 27±3 | D1151: 250 | E1151: =(47.4744*27)/100 -> 12.818087999999999
A1152: =A1151+1 -> 518 | B1152: Ultracal™ with fiber (Mead Johnson, Evansville, IN, USA) | C1152: 40 | D1152: 237 mL | E1152: =(29*40)/100 -> 11.6
B1154: PASTA and NOODLES
A1155: =A1152+1 -> 519 | B1155: Capellini (Primo Foods Ltd., Toronto, Canada) | C1155: 45 | D1155: 180 | E1155: =(44.874*45)/100 -> 20.193300000000001
A1156: =A1155+1 -> 520 | B1156: Corn pasta, gluten-free (Orgran Natural Foods, Carrum Downs, Vic, Australia) | C1156: 78±10 | D1156: 180 | E1156: =(41.598*78)/100 -> 32.446439999999996
A1157: =A1156+1 -> 521 | B1157: Fettucine, egg
B1158: Fettucine, egg | C1158: 32±4 | D1158: 180 | E1158: =(46.08*32)/100 -> 14.7456
B1159: Fettucine, egg (Mother Earth Fine Foods, Rowville, Vic, Australia) | C1159: 47±6 | D1159: 180 | E1159: =(46.08*47)/100 -> 21.657599999999999
B1160: mean of two studies | C1160: 40±8 | D1160: 180 | E1160: =(46.08*40)/100 -> 18.431999999999999
A1161: =A1157+1 -> 522 | B1161: Gluten-free pasta, maize starch, boiled 8 min (UK) | C1161: 54 | D1161: 180 | E1161: =(41.598*54)/100 -> 22.46292
A1162: =A1161+1 -> 523 | B1162: Gnocchi, NS (Latina, Pillsbury Australia Ltd., Mt. Waverley, Vic, Australia) | C1162: 68±9 | D1162: 180 | E1162: =(48.42*68)/100 -> 32.925600000000003
A1163: =A1162+1 -> 524 | B1163: Instant noodles
B1164: Instant 'two-minute' noodles, Maggi® (Nestlé, Sydney, NSW, Australia) | C1164: 46±5
B1165: Instant 'two-minute' noodles, Maggi® (Nestlé, Auckland, New Zealand) | C1165: 48±8
B1166: Instant noodles (Mr Noodle, Vancouver, Canada) | C1166: 47
B1167: mean of three studies | C1167: 47±1 | D1167: 180 | E1167: =(39.6*47)/100 -> 18.612000000000002
A1168: =A1163+1 -> 525 | B1168: Linguine
B1169: Thick, durum wheat, white, fresh (Sweden) | C1169: 43 | D1169: 180 | E1169: =(47.952*43)/100 -> 20.619359999999997
B1170: Thick, fresh, durum wheat flour, 0.6% w/w monoglycerides, boiled 8 min (Sweden) | C1170: 48 | D1170: 180 | E1170: =(47.952*48)/100 -> 23.016959999999997
B1171: mean of two studies | C1171: 46±3 | D1171: 180 | E1171: =(47.952*46)/100 -> 22.057919999999999
B1172: Thin, durum wheat (Sweden) | C1172: 49 | D1172: 180 | E1172: =(47.952*49)/100 -> 23.496480000000002
B1173: Thin, fresh, durum wheat flour, 0.6% w/w monoglycerides, boiled 3 min (Sweden) | C1173: 61 | D1173: 180 | E1173: =(47.952*61)/100 -> 29.250720000000001
B1174: Thin, fresh, durum wheat with 39% w/w egg, (Sweden) | C1174: 45 | D1174: 180 | E1174: =(41.058*45)/100 -> 18.476099999999999
B1175: Thin, fresh, with 0.6% w/w monoglycerides and 30% w/w egg, boiled 3 min (Sweden) | C1175: 53 | D1175: 180 | E1175: =(41.058*53)/100 -> 21.760740000000002
B1176: mean of four studies | C1176: 52±3 | D1176: 180 | E1176: =(44.505*52)/100 -> 23.142600000000002
A1177: =A1168+1 -> 526 | B1177: Mung bean noodles
B1178: Lungkow beanthread noodles (National Cereals, Oils & Foodstuffs, Qingdao & Guangdong, China) | C1178: 26 | D1178: 180 | E1178: =(45.36*26)/100 -> 11.7936
B1179: Mung bean noodles (Longkou beanthread), dried, boiled (Yantai cereals, China) | C1179: 39±9 | D1179: 180 | E1179: =(45.36*39)/100 -> 17.6904
B1180: mean of two studies | C1180: 33±7
A1181: =A1177+1 -> 527 | B1181: Macaroni
B1182: Macaroni, plain, boiled 5 min (Lancia-Bravo Foods Ltd., Canada) | C1182: 45 | D1182: 180 | E1182: =(48.73*45)/100 -> 21.9285
B1183: Macaroni, plain, boiled (Turkey) | C1183: 48 | D1183: 180 | E1183: =(48.73*48)/100 -> 23.3904
B1184: mean of two studies | C1184: 47±2 | D1184: 180 | E1184: =(47.952*47)/100 -> 22.537439999999997
B1185: Macaroni and Cheese, boxed (Kraft General Foods Canada Inc., Don Mills, Ontario) | C1185: 64 | D1185: 180 | E1185: =(50.746*64)/100 -> 32.477440000000001
A1186: =A1181+1 -> 528 | B1186: Ravioli, durum wheat flour, meat filled, boiled (Australia) | C1186: 39±1 | D1186: 180 | E1186: =(38.338*39)/100 -> 14.95182
A1187: =A1186+1 -> 529 | B1187: Rice noodles/pasta
B1188: Rice noodles, dried, boiled (Thai World, Bangkok, Thailand) | C1188: 61±6 | D1188: 180 | E1188: =(38.52*61)/100 -> 23.497200000000003
B1189: Rice noodles, freshly made, boiled (Sydney, NSW, Australia) | C1189: 40±4 | D1189: 180 | E1189: =(38.52*40)/100 -> 15.408000000000001
B1190: Rice pasta, brown, boiled 16 min (Rice Grower's Co-op., Leeton, NSW, Australia) | C1190: 92±8 | D1190: 180 | E1190: =(37.8*92)/100 -> 34.775999999999996
B1191: Rice and maize pasta, gluten-free, Ris'O'Mais (Orgran Foods, Carrum Downs, Vic, Australia) | C1191: 76±6 | D1191: 180 | E1191: =(48.6*76)/100 -> 36.936
B1192: Rice vermicelli, Kongmoon (National Cereals, Oils & Foodstuffs, China) | C1192: 58 | D1192: 180 | E1192: =(38.52*58)/100 -> 22.341600000000003
B1193: Spaghetti
A1194: =A1187+1 -> 530 | B1194: Spaghetti, gluten-free, rice and split pea, canned in tomato sauce (Orgran Foods, Australia) | C1194: 68±9 | D1194: 220 | E1194: =(27.3*68)/100 -> 18.564
A1195: =A1194+1 -> 531 | B1195: Spaghetti, protein enriched, boiled 7 min (Catelli Plus, Catelli Ltd., Montreal, Canada) | C1195: 27 | D1195: 180 | E1195: =(51.984*27)/100 -> 14.035679999999999
A1196: =A1195+1 -> 532 | B1196: Spaghetti, white, boiled 5 min
B1197: Boiled 5 min (Lancia-Bravo Foods Ltd., Canada) | C1197: 32 | D1197: 180 | E1197: =(47.952*32)/100 -> 15.34464
B1198: Boiled 5 min (Canada) | C1198: 34 | D1198: 180 | E1198: =(47.952*34)/100 -> 16.30368
B1199: Boiled 5 min (Canada) | C1199: 40 | D1199: 180 | E1199: =(47.952*40)/100 -> 19.180799999999998
B1200: Boiled 5 min (Middle East) | C1200: 44 | D1200: 180 | E1200: =(47.952*44)/100 -> 21.098879999999998
B1201: mean of four studies | C1201: 38±3 | D1201: 180 | E1201: =(47.952*38)/100 -> 18.22176
A1202: =A1196+1 -> 533 | B1202: Spaghetti, white or type NS, boiled 10-15 min
B1203: White, durum wheat, boiled 10 min in salty water (Barilla, Parma, Italy)12 | C1203: 58 | D1203: 180 | E1203: =(47.952*58)/100 -> 27.812159999999999
B1204: White, durum wheat flour, boiled 12 min (Starhushålls, Kungsörnen AB, Järna, Sweden) | C1204: 47 | D1204: 180 | E1204: =(47.952*47)/100 -> 22.537439999999997
B1205: White, durum wheat flour, 0.6% w/w monoglycerides, boiled 12 min (Sweden) | C1205: 53 | D1205: 180 | E1205: =(47.952*53)/100 -> 25.414560000000002
B1206: Boiled 15 min (Lancia-Bravo Foods Ltd., Canada) | C1206: 32 | D1206: 180 | E1206: =(47.952*32)/100 -> 15.34464
B1207: Boiled 15 min (Lancia-Bravo Foods Ltd., Canada) | C1207: 36 | D1207: 180 | E1207: =(47.952*36)/100 -> 17.262719999999998
B1208: Boiled 15 min (Canada) | C1208: 41 | D1208: 180 | E1208: =(47.952*41)/100 -> 19.660319999999999
B1209: White, boiled 15 min in salted water (Unico, Concord, Canada) | C1209: 44±3 | D1209: 180 | E1209: =(47.952*44)/100 -> 21.098879999999998
B1210: mean of seven studies | C1210: 44±3 | D1210: 180 | E1210: =(47.952*44)/100 -> 21.098879999999998
A1211: =A1202+1 -> 534 | B1211: Spaghetti, white or type NS, boiled 20 min
B1212: White, durum wheat, boiled 20 min (Australia) | C1212: 58±7 | D1212: 180 | E1212: =(44.3*58)/100 -> 25.693999999999996
B1213: Durum wheat, boiled 20 min (USA) | C1213: 64±15 | D1213: 180 | E1213: =(42.9*64)/100 -> 27.456
B1214: mean of two studies | C1214: 61±3 | D1214: 180 | E1214: =(43.6*61)/100 -> 26.596
A1215: =A1211+1 -> 535 | B1215: Spaghetti, white, boiled
B1216: White (Denmark) | C1216: 33 | D1216: 180 | E1216: =(47.952*33)/100 -> 15.824159999999999
B1217: White, durum wheat (Catelli Ltd, Montreal, Canada) | C1217: 34 | D1217: 180 | E1217: =(47.952*34)/100 -> 16.30368
B1218: White (Australia) | C1218: 38 | D1218: 180 | E1218: =(44.3*38)/100 -> 16.834
B1219: White (Canada) | C1219: 42 | D1219: 180 | E1219: =(47.952*42)/100 -> 20.13984
B1220: White (Canada) | C1220: 48 | D1220: 180 | E1220: =(47.952*48)/100 -> 23.016959999999997
B1221: White (Vetta, Greens Foods, Glendenning, NSW, Australia) | C1221: 49±7 | D1221: 180 | E1221: =(44.3*49)/100 -> 21.706999999999997
B1222: White (Canada) | C1222: 50±8 | D1222: 180 | E1222: =(47.952*50)/100 -> 23.975999999999999
B1223: mean of seven studies | C1223: 42±3 | D1223: 180 | E1223: =(46.91*42)/100 -> 19.702199999999998
A1224: =A1215+1 -> 536 | B1224: Spaghetti, white, durum wheat semolina (Panzani, Marseilles, France)
B1225: Boiled in 0.7% salted water for 11 min | C1225: 59±15 | D1225: 180 | E1225: =(47.952*59)/100 -> 28.291679999999996
B1226: Boiled in 0.7% salted water for 16.5 min | C1226: 65±15 | D1226: 180 | E1226: =(47.952*65)/100 -> 31.168800000000001
B1227: Boiled in 0.7% salted water for 22 min | C1227: 46±10 | D1227: 180 | E1227: =(47.952*46)/100 -> 22.057919999999999
B1228: mean of three cooking times | C1228: 57±6 | D1228: 180 | E1228: =(47.952*57)/100 -> 27.332640000000001
A1229: =A1224+1 -> 537 | B1229: Spaghetti, wholemeal, boiled
B1230: Wholemeal (USA) | C1230: 32 | D1230: 180 | E1230: =(44.259*32)/100 -> 14.162879999999999
B1231: Wholemeal (Canada) | C1231: 42±4 | D1231: 180 | E1231: =(39.672*42)/100 -> 16.662240000000001
B1232: mean of two studies | C1232: 37±5 | D1232: 180 | E1232: =(41.9655*37)/100 -> 15.527235000000001
A1233: =A1229+1 -> 538 | B1233: Spirali, durum wheat, white, boiled to al denté texture (Vetta, Australia) | C1233: 43±10 | D1233: 180 | E1233: =(44.3*43)/100 -> 19.048999999999999
A1234: =A1233+1 -> 539 | B1234: Split pea and soya pasta shells, gluten-free (Orgran Foods, Australia) | C1234: 29±6 | D1234: 180 | E1234: =(30.86*29)/100 -> 8.9493999999999989
A1235: =A1234+1 -> 540 | B1235: Star Pastina, white, boiled 5 minutes (Lancia-Bravo Foods Ltd., Canada) | C1235: 38 | D1235: 180 | E1235: =(47.952*38)/100 -> 18.22176
A1236: =A1235+1 -> 541 | B1236: Tortellini, cheese (Stouffer, Nestlé, Don Mills, Canada) | C1236: 50 | D1236: 180 | E1236: =(20.83*50)/100 -> 10.414999999999999
A1237: =A1236+1 -> 542 | B1237: Udon noodles, plain, reheated 5 min (Fantastic, Windsor Gardens, SA, Australia)6 | C1237: 62±8 | D1237: 180 | E1237: =(48.42*62)/100 -> 30.020399999999999
A1238: =A1237+1 -> 543 | B1238: Vermicelli, white, boiled (Australia) | C1238: 35±7 | D1238: 180 | E1238: =(44.3*35)/100 -> 15.505000000000001
B1240: SNACK FOODS AND CONFECTIONERY
A1241: =A1238+1 -> 544 | B1241: Burger Rings™, barbeque-flavored (Smith's Snack Food Co., Chatswood, NSW, Australia) | C1241: 90±16 | D1241: 50 | E1241: =(30.6*90)/100 -> 27.54
A1242: =A1241+1 -> 545 | B1242: Chocolate, milk, plain
B1243: Chocolate, milk, plain with sucrose (Belgium)6 | C1243: 34±5 | D1243: 50 | E1243: =(22.034*34)/100 -> 7.4915599999999998
B1244: Chocolate, milk (Cadbury's Confectionery, Ringwood, Vic, Australia) | C1244: 49±6 | D1244: 50 | E1244: =(29.55*49)/100 -> 14.4795
B1245: Chocolate, milk, Dove® (Mars Confectionery, Ballarat, Vic, Australia) | C1245: 45±8 | D1245: 50 | E1245: =(29.55*45)/100 -> 13.297499999999999
B1246: Chocolate, milk (Nestlé, Sydney, NSW, Australia) | C1246: 42±8 | D1246: 50 | E1246: =(30.862*42)/100 -> 12.96204
B1247: mean of four studies | C1247: 43±3 | D1247: 50 | E1247: =(27.999*43)/100 -> 12.039569999999999
B1248: Chocolate, milk, plain, low-sugar with maltitol (Belgium)6 | C1248: 35±16 | D1248: 50 | E1248: =(21.6*35)/100 -> 7.56
A1249: =A1242+1 -> 546 | B1249: Chocolate, white, Milky Bar® (Nestlé, Australia) | C1249: 44±6 | D1249: 50 | E1249: =(29*44)/100 -> 12.76
A1250: =A1249+1 -> 547 | B1250: Corn chips
B1251: Corn chips, plain, salted (Doritos™ original, Smith's Snack Food Co., Australia, 1998) | C1251: 42±4 | D1251: 50 | E1251: =(25.4*42)/100 -> 10.667999999999999
B1252: Corn chips, plain, salted (Doritos™ original, Smith's Snack Food Co., Australia, 1985) | C1252: 72 | D1252: 50 | E1252: =(25.4*72)/100 -> 18.288
B1253: Nachips™ (Old El Paso Foods Co., Canada) | C1253: 74 | D1253: 50 | E1253: =(28.57*74)/100 -> 21.1418
B1254: mean of three studies | C1254: 63±10 | D1254: 50 | E1254: =(26.457*63)/100 -> 16.667909999999999
A1255: =A1250+1 -> 548 | B1255: Fruit Bars
B1256: Apricot filled fruit bar (pureed dried apricot filling in wholemeal pastry) | C1256: 50±8 | D1256: 50 | E1256: =(33.95*50)/100 -> 16.975000000000001
B1257: (Mother Earth, Auckland, New Zealand)
B1258: Heinz Kidz™ Fruit Fingers, banana (HJ Heinz, Malvern, Vic, Australia) | C1258: 61±11 | D1258: 30 | E1258: =(19.6*61)/100 -> 11.956000000000001
B1259: Real Fruit Bars, strawberry (Uncle Toby's, Wahgunyah, Vic, Australia) | C1259: 90±12 | D1259: 30 | E1259: =(25.65*90)/100 -> 23.085000000000001
B1260: Roll-Ups®, processed fruit snack (Uncle Toby's, Australia) | C1260: 99±12 | D1260: 30 | E1260: =(24.57*99)/100 -> 24.324299999999997
A1261: =A1255+1 -> 549 | B1261: Fruity Bitz™, vitamin and mineral enriched dried fruit snacks
B1262: Fruity Bitz™, apricot (Blackmores Ltd., Balgowlah, NSW, Australia) | C1262: 42±3 | D1262: 15 | E1262: =(11.5*42)/100 -> 4.83
B1263: Fruity Bitz™, berry (Blackmores Ltd., Australia) | C1263: 35±4 | D1263: 15 | E1263: =(11.7*35)/100 -> 4.0949999999999998
B1264: Fruity Bitz™, tropical (Blackmores Ltd., Australia) | C1264: 41±3 | D1264: 15 | E1264: =(11.4*41)/100 -> 4.6740000000000004
B1265: mean of three flavours | C1265: 39±2 | D1265: 15 | E1265: =(11.53*39)/100 -> 4.4966999999999997
A1266: =A1261+1 -> 550 | B1266: Jelly beans
B1267: Jelly beans, assorted colors (Allen's, Nestle, Sydney, NSW, Australia) | C1267: 80±8
B1268: Jelly beans, assorted colors (Savings, Grocery Holdings, Tooronga, Vic, Australia) | C1268: 76±6
B1269: mean of two studies | C1269: 78±2 | D1269: 30 | E1269: =(27.93*78)/100 -> 21.785399999999999
A1270: =A1266+1 -> 551 | B1270: Kudos Whole Grain Bars, chocolate chip (M & M/Mars, Hackettstown, NJ, USA) | C1270: 62±8 | D1270: 50 | E1270: =(32.045*62)/100 -> 19.867900000000002
A1271: =A1270+1 -> 552 | B1271: Life Savers®, peppermint candy (Nestlé, Australia) | C1271: 70±6 | D1271: 30 | E1271: =(29.5*70)/100 -> 20.65
A1272: =A1271+1 -> 553 | B1272: M & M's®, peanut (Mars Confectionery, Australia) | C1272: 33±3 | D1272: 30 | E1272: =(17.118*33)/100 -> 5.6489399999999996
A1273: =A1272+1 -> 554 | B1273: Mars Bar®
B1274: Mars Bar® (Mars Confectionery, Australia) | C1274: 62±8 | D1274: 60 | E1274: =(39.8*62)/100 -> 24.675999999999998
B1275: Mars Bar® (M&M/Mars, USA) | C1275: 68±12 | D1275: 60 | E1275: =(39.8*68)/100 -> 27.063999999999997
B1276: mean of two studies | C1276: 65±3 | D1276: 60 | E1276: =(39.8*65)/100 -> 25.87
A1277: =A1273+1 -> 555 | B1277: Muesli bar containing dried fruit (Uncle Toby's, Australia) | C1277: 61±7 | D1277: 30 | E1277: =(20.64*61)/100 -> 12.590399999999999
A1278: =A1277+1 -> 556 | B1278: Nougat, Jijona (La Fama, Spain) | C1278: 32 | D1278: 30 | E1278: =(11.905*32)/100 -> 3.8095999999999997
A1279: =A1278+1 -> 557 | B1279: Nutella®, chocolate hazelnut spread (Ferrero Australia, Milson's Point, NSW, Australia) | C1279: 33±4 | D1279: 20 | E1279: =(11.8*33)/100 -> 3.8940000000000001
B1280: Nuts
A1281: =A1279+1 -> 558 | B1281: Cashew nuts, salted (Coles Supermarkets, Australia)6 | C1281: 22±5 | D1281: 50 | E1281: =(12.794*22)/100 -> 2.8146800000000001
A1282: =A1281+1 -> 559 | B1282: Peanuts
B1283: Peanuts, crushed (South Africa)6 | C1283: 7±4 | D1283: 50 | E1283: =(4.17*7)/100 -> 0.29189999999999999
B1284: Peanuts (Canada)6 | C1284: 13±6 | D1284: 50 | E1284: =(6.755*13)/100 -> 0.87814999999999999
B1285: Peanuts (Mexico)6 | C1285: 23 | D1285: 50 | E1285: =(6.755*23)/100 -> 1.5536500000000002
B1286: mean of three studies | C1286: 14±8 | D1286: 50 | E1286: =(5.893*14)/100 -> 0.82501999999999998
A1287: =A1282+1 -> 560 | B1287: Popcorn
B1288: Popcorn, plain, cooked in microwave oven (Green's Foods, Glendenning, NSW, Australia) | C1288: 55±7 | D1288: 20 | E1288: =(10.75*55)/100 -> 5.9124999999999996
B1289: Popcorn, plain, cooked in microwave oven (Uncle Toby's, Australia) | C1289: 89 | D1289: 20 | E1289: =(10.75*89)/100 -> 9.5675000000000008
B1290: mean of two studies | C1290: 72±17 | D1290: 20 | E1290: =(10.75*72)/100 -> 7.74
A1291: =A1287+1 -> 561 | B1291: Pop Tarts™, double choc (Kellogg's, Pagewood, NSW, Australia) | C1291: 70±2 | D1291: 50 | E1291: =(34.5*70)/100 -> 24.15
A1292: =A1291+1 -> 562 | B1292: Potato crisps
B1293: Potato crisps, plain, salted (Arnott's, Homebush, NSW, Australia) | C1293: 57 | D1293: 50 | E1293: =(17.97*57)/100 -> 10.242899999999999
B1294: Potato crisps, plain, salted (Canada) | C1294: 51±7 | D1294: 50 | E1294: =(24.2*51)/100 -> 12.342000000000001
B1295: mean of two studies | C1295: 54±3 | D1295: 50 | E1295: =(21.085*54)/100 -> 11.385900000000001
A1296: =A1292+1 -> 563 | B1296: Pretzels, oven-baked, traditional wheat flavour (Parker's, Smith's Snack Food Co., Australia) | C1296: 83±9 | D1296: 30 | E1296: =(19.5*83)/100 -> 16.184999999999999
A1297: =A1296+1 -> 564 | B1297: Skittles® (Mars Confectionery, Australia) | C1297: 70±5 | D1297: 50 | E1297: =(45.32*70)/100 -> 31.724
A1298: =A1297+1 -> 565 | B1298: Snack bars
B1299: Snack bar, Apple Cinnamon (Con Agra Inc., Omaha, NE, USA) | C1299: 40±8 | D1299: 50 | E1299: =(29.3*40)/100 -> 11.72
B1300: Snack bar, Peanut Butter & Choc-Chip (Con Agra Inc., USA) | C1300: 37±6 | D1300: 50 | E1300: =(27.3*37)/100 -> 10.101000000000001
A1301: =A1298+1 -> 566 | B1301: Snickers Bar®
B1302: Snickers Bar® (Mars Confectionery, Australia) | C1302: 41±5 | D1302: 60 | E1302: =(36*41)/100 -> 14.76
B1303: Snickers Bar® (M&M/Mars, USA) | C1303: 68 | D1303: 60 | E1303: =(34.026*68)/100 -> 23.13768
B1304: mean of two studies | C1304: 55±14 | D1304: 60 | E1304: =(35.013*55)/100 -> 19.257149999999999
A1305: =A1301+1 -> 567 | B1305: Twisties™, cheese-flavoured, extruded snack, rice and corn (Smith's Snackfood Co., Australia) | C1305: 74±5 | D1305: 50 | E1305: =(29.2*74)/100 -> 21.607999999999997
A1306: =A1305+1 -> 568 | B1306: Twix® Cookie Bar, caramel (M&M/Mars, USA) | C1306: 44±6 | D1306: 60 | E1306: =(38.688*44)/100 -> 17.022720000000003
B1308: SPORTS BARS
A1309: =A1306+1 -> 569 | B1309: Power Bar®
B1310: Power Bar®, chocolate (Powerfood Inc., Berkeley, CA, USA) | C1310: 58±5
B1311: Power Bar®, chocolate (Powerfood Inc., Berkeley, CA, USA) | C1311: 53
B1312: mean of two studies | C1312: 56±3 | D1312: 65 | E1312: =(42*56)/100 -> 23.52
A1313: =A1309+1 -> 570 | B1313: Ironman PR bar®, chocolate (PR Nutrition, San Diego, CA, USA) | C1313: 39 | D1313: 65 | E1313: =(26.32*39)/100 -> 10.264800000000001
B1315: SOUPS
A1316: =A1313+1 -> 571 | B1316: Black Bean (Wil-Pack Foods, San Pedro, CA, USA) | C1316: 64 | D1316: 250 | E1316: =(27.054*64)/100 -> 17.31456
A1317: =A1316+1 -> 572 | B1317: Green Pea, canned (Campbell Soup Co Ltd., Toronto, Canada) | C1317: 66 | D1317: 250 | E1317: =(41.391*66)/100 -> 27.318059999999999
A1318: =A1317+1 -> 573 | B1318: Lentil, canned (Unico, Concord, Canada) | C1318: 44 | D1318: 250 | E1318: =(20.56*44)/100 -> 9.0464000000000002
A1319: =A1318+1 -> 574 | B1319: Minestrone, Traditional, Country Ladle™ (Campbell's Soups, Homebush, NSW, Australia)6 | C1319: 39±3 | D1319: 250 | E1319: =(18.276*39)/100 -> 7.1276400000000004
A1320: =A1319+1 -> 575 | B1320: Noodle soup (traditional Turkish soup with stock and noodles) | C1320: 1 | D1320: 250 | E1320: =(8.925*1)/100 -> 8.925000000000001E-2
A1321: =A1320+1 -> 576 | B1321: Split Pea (Wil-Pak Foods, USA) | C1321: 60 | D1321: 250 | E1321: =(27.075*60)/100 -> 16.245000000000001
A1322: =A1321+1 -> 577 | B1322: Tarhana soup (traditional Turkish soup with wheat flour, yoghurt, tomato, peppers) | C1322: 20
A1323: =A1322+1 -> 578 | B1323: Tomato soup (Canada) | C1323: 38±9 | D1323: 250 | E1323: =(16.95*38)/100 -> 6.4409999999999998
B1325: SUGARS AND SUGAR ALCOHOLS
A1326: =A1323+1 -> 579 | B1326: Blue Agave cactus nectar, high-fructose
B1327: Organic Agave Cactus Nectar, light, 90% fructose (Western Commerce Corp., City of Industry, | C1327: 11±1 | D1327: 10 | E1327: =(7.851*11)/100 -> 0.86360999999999999
B1328: CA, USA)6
B1329: Organic Agave Cactus Nectar, light, 97% fructose (Western Commerce Corp., USA)6 | C1329: 10±1 | D1329: 10 | E1329: =(7.851*10)/100 -> 0.78510000000000002
A1330: =A1326+1 -> 580 | B1330: Fructose
B1331: 25g portion (Sweeten Less, Maximum Nutrition Inc., Toronto, Canada)6 | C1331: 11
B1332: 50g portion (Sweeten Less, Maximum Nutrition Inc., Toronto, Canada) | C1332: 12
B1333: 50g portion | C1333: 20±5
B1334: 50g portion | C1334: 21
B1335: 50g portion (Sigma Chemical Company, St. Louis, MO, USA) | C1335: 24
B1336: 25g portion, fed with oats28 | C1336: 25
B1337: mean of six studies | C1337: 19±2 | D1337: 10 | E1337: =(10*19)/100 -> 1.9
A1338: =A1330+1 -> 581 | B1338: Glucose
B1339: 50 g portion (dextrose) | C1339: 85
B1340: 25g portion, fed with oats28 | C1340: 92
B1341: 50 g portion | C1341: 93
B1342: 50 g portion (dextrose) | C1342: 96
B1343: 50 g portion | C1343: 96
B1344: 50 g portion (Bio-Health, Dawson Traders Ltd., Toronto, Canada) | C1344: 96
B1345: 50 g portion | C1345: 100
B1346: 50 g portion (Glucodin™ glucose tablets, Boots, North Ryde, NSW, Australia) | C1346: 102±9
B1347: 25 g portion (Bio-Health, Canada)6 | C1347: 103
B1348: 50 g portion (dextrose) | C1348: 111
B1349: 100 g portion (Bio-Health, Canada)12 | C1349: 114
B1350: mean of 11 studies | C1350: 99±3 | D1350: 10 | E1350: =(10*99)/100 -> 9.9
B1351: Glucose consumed with American ginseng (Panax quinquefolius L.)
A1352: =A1338+1 -> 582 | B1352: 25 g glucose (Glucodex solution, Rougier Inc., Chambly, Quebec) with 3 g dried ginseng5 | C1352: 78 | D1352: 10 | E1352: =(10*78)/100 -> 7.8
A1353: =A1352+1 -> 583 | B1353: 25 g glucose (Glucodex) 40 min after 3 g dried ginseng5 | C1353: 80
B1354: 25 g glucose (Glucodex) 40 min before 3 g dried ginseng5 | C1354: 76
B1355: mean in two groups of subjects | C1355: 78±2 | D1355: 10 | E1355: =(10*78)/100 -> 7.8
A1356: =A1353+1 -> 584 | B1356: Glucose consumed with gum/fiber
B1357: 46 g Glucose + 15 g apple and orange fiber extract (FITA, Chatswood, NSW, Australia) | C1357: 79±3 | D1357: 10 | E1357: =(8.2*79)/100 -> 6.4779999999999998
B1358: (total carbohydrate content of drink = 50 g)
B1359: 50 g Glucose + 14.5 g guar gum | C1359: 62 | D1359: 10 | E1359: =(10*62)/100 -> 6.2
B1360: 50 g Glucose + 14.5 g oat gum (78% oat ß-glucan) | C1360: 57 | D1360: 10 | E1360: =(10*57)/100 -> 5.7
B1361: 100 g Glucose + 20 g acacia gum7 | C1361: 85 | D1361: 10 | E1361: =(10*85)/100 -> 8.5
A1362: =A1356+1 -> 585 | B1362: Glucose consumed with a mixed meal
B1363: 30 g glucose with 150 g grilled beefburger, 30 g cheese, 10 g butter | C1363: 55
B1364: (total meal contained 50 g carbohydrate) (France)
B1365: 30 g glucose with 150 g grilled beefburger, 30 g cheese, 10 g butter | C1365: 57
B1366: (total meal contained 50 g carbohydrate) (France)
B1367: mean in two groups of subjects | C1367: 56±1 | D1367: 250 | E1367: =(35*56)/100 -> 19.6
A1368: =A1362+1 -> 586 | B1368: Honey
B1369: Locust honey (Romania)6 | C1369: 32 | D1369: 25 | E1369: =(20.83*32)/100 -> 6.6655999999999995
B1370: Yellow box (46% fructose) (Australia)6 | C1370: 35±4 | D1370: 25 | E1370: =(18.3*35)/100 -> 6.4050000000000002
B1371: Stringy Bark (52% fructose) (Australia)6 | C1371: 44±4 | D1371: 25 | E1371: =(20.575*44)/100 -> 9.052999999999999
B1372: Red Gum (35% fructose) (Australia)6 | C1372: 46±3 | D1372: 25 | E1372: =(18.4725*46)/100 -> 8.4973500000000008
B1373: Iron Bark (34% fructose) (Australia)6 | C1373: 48±3 | D1373: 25 | E1373: =(14.975*48)/100 -> 7.1879999999999997
B1374: Yapunya (42 % fructose) (Australia)6 | C1374: 52±5 | D1374: 25 | E1374: =(16.925*52)/100 -> 8.8010000000000002
B1375: Pure (Capilano Honey Ltd., Richlands, Qld, Australia) | C1375: 58±6 | D1375: 25 | E1375: =(20.75*58)/100 -> 12.035
B1376: Commercial Blend (38% fructose) (WA blend, Capilano Honey Ltd., Australia)6 | C1376: 62±3 | D1376: 25 | E1376: =(17.55*62)/100 -> 10.881000000000002
B1377: Salvation Jane (32% fructose) (Australia)6 | C1377: 64±5 | D1377: 25 | E1377: =(15.4*64)/100 -> 9.8559999999999999
B1378: Commercial Blend (28% fructose) (NSW blend, Capilano Honey Ltd., Australia)6 | C1378: 72±6 | D1378: 25 | E1378: =(12.6*72)/100 -> 9.0719999999999992
B1379: Honey, NS(Canada)6 | C1379: 87±8 | D1379: 25 | E1379: =(20.55*87)/100 -> 17.878500000000003
B1380: mean of 11 types of honey | C1380: 55±5 | D1380: 25 | E1380: =(17.9025*55)/100 -> 9.8463750000000001
A1381: =A1368+1 -> 587 | B1381: Lactose
B1382: 50 g lactose (Sigma Chemical Company, USA) | C1382: 43
B1383: 25 g lactose (BDH, Poole, UK)6 | C1383: 48
B1384: 25 g lactose28 | C1384: 48
B1385: mean of three studies | C1385: 46±2 | D1385: 10 | E1385: =(10*46)/100 -> 4.6
A1386: =A1381+1 -> 588 | B1386: 50 g maltose | C1386: 105±12 | D1386: 10 | E1386: =(10*105)/100 -> 10.5
A1387: =A1386+1 -> 589 | B1387: Sucrose
B1388: 50 g sucrose (Sigma Chemical Company, USA) | C1388: 58
B1389: 50 g sucrose (Redpath Sugars, Toronto, Canada) | C1389: 58
B1390: 50 g sucrose | C1390: 59±10
B1391: 50 g sucrose | C1391: 60
B1392: 25 g sucrose (Redpath Sugars, Canada)6 | C1392: 60
B1393: 25 g sucrose28 | C1393: 64
B1394: 50 g sucrose | C1394: 65±9
B1395: 100 g sucrose (Redpath Sugars, Canada)12 | C1395: 65
B1396: 30 g sucrose29 | C1396: 82
B1397: 25 g sucrose6 | C1397: 110±21
B1398: mean of 10 studies | C1398: 68±5 | D1398: 10 | E1398: =(68*10)/100 -> 6.8
B1399: Sugar alcohols and sugar-replacement compounds
A1400: =A1387+1 -> 590 | B1400: Lactitol
B1401: 25 g lactitol30 | C1401: -1±7
B1402: 25 g lactitol MC (Danisco sweeteners, Redhill, Surrey, UK)30 | C1402: 3±1
B1403: mean of two studies | C1403: 2±3 | D1403: 10 | E1403: =(2*10)/100 -> 00.2
A1404: =A1400+1 -> 591 | B1404: Litesse
B1405: 25 g Litesse II, bulking agent with polydextrose and sorbitol (Danisco Sweeteners, UK)30 | C1405: 7±2 | D1405: 10 | E1405: =(7*10)/100 -> 00.7
B1406: 25 g Litesse III ultra, bulking agent with polydextrose and sorbitol (Danisco Sweeteners, UK)30 | C1406: 4±2 | D1406: 10 | E1406: =(10*4)/100 -> 00.4
A1407: =A1404+1 -> 592 | B1407: Maltitol-based sweeteners or bulking agents
B1408: 25 g Malbit CR (87% maltitol) (Cerestar, Vilvoorde, Belgium)30 | C1408: 30±12 | D1408: 10 | E1408: =(10*30)/100 -> 3
B1409: 25 g Maltidex 100 (> 72% maltitol) (Cerestar, Vilvoorde, Belgium)30 | C1409: 44±11 | D1409: 10 | E1409: =(10*44)/100 -> 4.4
B1410: 25 g Malbit CH (99% maltitol) (Cerestar, Vilvoorde, Belgium)30 | C1410: 73±29 | D1410: 10 | E1410: =(10*73)/100 -> 7.3
B1411: 25 g Maltidex 200 (50% maltitol) (Cerestar, Vilvoorde, Belgium)30 | C1411: 89±28 | D1411: 10 | E1411: =(10*89)/100 -> 8.9
A1412: =A1407+1 -> 593 | B1412: Xylitol
B1413: 25 g xylitol30 | C1413: 7±7
B1414: 25 g Xylitol C (Danisco Sweeteners, UK)30 | C1414: 8±2
B1415: mean of two studies | C1415: 8±1 | D1415: 10 | E1415: =(8*10)/100 -> 00.8
B1417: VEGETABLES
A1418: =A1412+1 -> 594 | B1418: Broad beans (Canada)6 | C1418: 79±16 | D1418: 80 | E1418: =(11.4*79)/100 -> 9.0060000000000002
A1419: =A1418+1 -> 595 | B1419: Green peas
B1420: Pea, frozen, boiled (Canada)6 | C1420: 39 | D1420: 80 | E1420: =(7.008*39)/100 -> 2.73312
B1421: Pea, frozen, boiled (Canada)6 | C1421: 51±6 | D1421: 80 | E1421: =(7.008*51)/100 -> 3.5740800000000004
B1422: Pea, green (Pisum Sativum) (India)11 | C1422: 54±14 | D1422: 80 | E1422: =(7.008*54)/100 -> 3.7843200000000001
B1423: mean of three studies | C1423: 48±5 | D1423: 80 | E1423: =(7.008*48)/100 -> 3.3638400000000002
A1424: =A1419+1 -> 596 | B1424: Pumpkin (South Africa) | C1424: 75±9 | D1424: 80 | E1424: =(4.44*75)/100 -> 3.33
A1425: =A1424+1 -> 597 | B1425: Sweet corn
B1426: Sweet corn, 'Honey & Pearl' variety (New Zealand) | C1426: 37±12 | D1426: 80 | E1426: =(15.909*37)/100 -> 5.8863300000000001
B1427: Sweet corn on the cob, boiled 20 min (Sydney, Australia) | C1427: 48 | D1427: 80 | E1427: =(15.909*48)/100 -> 7.6363200000000004
B1428: Sweet corn (Canada) | C1428: 59±11 | D1428: 80 | E1428: =(17.848*59)/100 -> 10.53032
B1429: Sweet corn, boiled (USA) | C1429: 60 | D1429: 80 | E1429: =(17.848*60)/100 -> 10.708799999999998
B1430: Sweet corn, boiled (USA) | C1430: 60 | D1430: 80 | E1430: =(17.848*60)/100 -> 10.708799999999998
B1431: Sweet corn (South Africa) | C1431: 62±5 | D1431: 80 | E1431: =(17.848*62)/100 -> 11.065760000000001
B1432: mean of six studies | C1432: 54±4 | D1432: 80 | E1432: =(17.202*54)/100 -> 9.289080000000002
B1433: Sweet corn, whole kernel, diet-pack, Featherweight, canned, drained, heated (USA) | C1433: 46 | D1433: 80 | E1433: =(14.34*46)/100 -> 6.5964
B1434: Sweet corn, frozen, heated in microwave (Green Giant, Pillsbury Canada Ltd., Toronto, Canada) | C1434: 47 | D1434: 80 | E1434: =(15.068*47)/100 -> 7.0819600000000005
B1435: Root vegetables
A1436: =A1425+1 -> 598 | B1436: Beetroot (Canada)6 | C1436: 64±16 | D1436: 80 | E1436: =(7.16*64)/100 -> 4.5823999999999998
A1437: =A1436+1 -> 599 | B1437: Carrots
B1438: Carrots, raw (Romania)5,6 | C1438: 16 | D1438: 80 | E1438: =(7.6923*16)/100 -> 1.2307680000000001
B1439: Carrots, peeled, boiled (Sydney, NSW, Australia)6 | C1439: 32±5 | D1439: 80 | E1439: =(4.587*32)/100 -> 1.4678399999999998
B1440: Carrots, peeled, boiled (Sydney, NSW, Australia)6 | C1440: 49±2 | D1440: 80 | E1440: =(4.587*49)/100 -> 2.2476299999999996
B1441: Carrots, NS (Canada)6 | C1441: 92±20 | D1441: 80 | E1441: =(5.728*92)/100 -> 5.2697599999999998
B1442: mean of four studies | C1442: 47±16 | D1442: 80 | E1442: =(5.648575*47)/100 -> 2.6548302499999998
A1443: =A1437+1 -> 600 | B1443: Cassava, boiled, with salt (Kenya, Africa) | C1443: 46 | D1443: 100 | E1443: 12
A1444: =A1443+1 -> 601 | B1444: Parsnips (Canada)6 | C1444: 97±19 | D1444: 80 | E1444: =(12.424*97)/100 -> 12.051279999999998
B1445: Potato
A1446: =A1444+1 -> 602 | B1446: Baked potato
B1447: Ontario, white, baked in skin (Canada) | C1447: 60 | D1447: 150 | E1447: =(30.43*60)/100 -> 18.257999999999999
A1448: =A1446+1 -> 603 | B1448: Baked, Russet Burbank potatoes
B1449: Russet, baked without fat (Canada) | C1449: 56
B1450: Russet, baked without fat, 45-60 min (USA) | C1450: 78
B1451: Russet, baked without fat (USA) | C1451: 94
B1452: Russet, baked without fat (USA) | C1452: 111
B1453: mean of four studies | C1453: 85±12 | D1453: 150 | E1453: =(30.09*85)/100 -> 25.576499999999999
A1454: =A1448+1 -> 604 | B1454: Boiled potato
B1455: Desiree, peeled, boiled 35 min (Australia) | C1455: 101±15 | D1455: 150 | E1455: =(16.8*101)/100 -> 16.968000000000004
B1456: Nardine (New Zealand) | C1456: 70±17 | D1456: 150 | E1456: =(25*70)/100 -> 17.5
B1457: Ontario, white, peeled, cut into cubes, boiled in salted water 15 min (Canada) | C1457: 58 | D1457: 150 | E1457: =(27.473*58)/100 -> 15.934339999999999
B1458: Pontiac, peeled, boiled whole for 30 min (Australia) | C1458: 56 | D1458: 150 | E1458: =(25.5*56)/100 -> 14.28
B1459: Pontiac, peeled, boiled 35 min (Australia) | C1459: 88±9 | D1459: 150 | E1459: =(18.15*88)/100 -> 15.971999999999998
B1460: Prince Edward Island, peeled, cubed, boiled in salted water 15 min (Canada) | C1460: 63 | D1460: 150 | E1460: =(17.67*63)/100 -> 11.132100000000001
B1461: Sebago, peeled, boiled 35 min (Australia) | C1461: 87±7 | D1461: 150 | E1461: =(16.5*87)/100 -> 14.355
A1462: =A1454+1 -> 605 | B1462: Boiled/cooked, white/Type NS
B1463: Type NS (Kenya, Africa) | C1463: 24 | D1463: 150 | E1463: =(27.9*24)/100 -> 6.6959999999999988
B1464: White, cooked (Romania)5 | C1464: 41 | D1464: 150 | E1464: =(30*41)/100 -> 12.3
B1465: White, boiled (Canada) | C1465: 54 | D1465: 150 | E1465: =(27.315*54)/100 -> 14.7501
B1466: Type NS, boiled (Australia) | C1466: 56 | D1466: 150 | E1466: =(19.25*56)/100 -> 10.78
B1467: Type NS, boiled in salted water (India) | C1467: 76 | D1467: 150 | E1467: =(34.1*76)/100 -> 25.916
B1468: mean of five studies | C1468: 50±9 | D1468: 150 | E1468: =(27.713*50)/100 -> 13.8565
B1469: Type NS, boiled in salted water, refrigerated, reheated (India) | C1469: 23 | D1469: 150 | E1469: =(34.1*23)/100 -> 7.8430000000000009
A1470: =A1462+1 -> 606 | B1470: Canned potatoes
B1471: Prince Edward Island, canned, microwave heated (Avon, Cobi Foods Inc., Port Williams, Canada) | C1471: 61 | D1471: 150 | E1471: =(17.67*61)/100 -> 10.778700000000001
B1472: New, canned, heated in microwave 3 min (Mint Tiny Taters, Edgell's, Cheltenham, Vic, Australia) B23 | C1472: 65±9 | D1472: 150 | E1472: =(18*65)/100 -> 11.7
B1473: mean of two studies | C1473: 63±2 | D1473: 150 | E1473: =(17.833*63)/100 -> 11.234789999999998
A1474: =A1470+1 -> 607 | B1474: French Fries
B1475: French fries, frozen, reheated in microwave (Cavendish Farms, New Annan, Canada) | C1475: 75 | D1475: 150 | E1475: =(29.412*75)/100 -> 22.059000000000001
A1476: =A1474+1 -> 608 | B1476: Instant Mashed potato
B1477: Instant (France) | C1477: 74±12
B1478: Instant (Canada) | C1478: 80±13
B1479: Instant (Edgell's Potato Whip, Edgell's, Australia) | C1479: 86
B1480: Instant (Carnation Foods Co. Ltd., Manitoba, Canada) | C1480: 86
B1481: Instant (Canada) | C1481: 88
B1482: Instant mashed potato (Idahoan Foods, Lewisville, ID, USA) | C1482: 97±6
B1483: mean of six studies | C1483: 85±3 | D1483: 150 | E1483: =(19.634*85)/100 -> 16.6889
A1484: =A1476+1 -> 609 | B1484: Mashed potato
B1485: Type NS (Canada) | C1485: 67
B1486: Type NS (South Africa) | C1486: 71±10
B1487: Type NS (France) | C1487: 83
B1488: mean of three studies | C1488: 74±5 | D1488: 150 | E1488: =(19.634*74)/100 -> 14.529159999999999
B1489: Prince Edward Island, peeled, cubed, boiled 15 min, mashed (Canada) | C1489: 73 | D1489: 150 | E1489: =(17.666*73)/100 -> 12.896179999999999
B1490: Pontiac, peeled, cubed, boiled 15 min, mashed (Australia) | C1490: 91±9 | D1490: 150 | E1490: =(19.634*91)/100 -> 17.86694
A1491: =A1484+1 -> 610 | B1491: Microwaved potato | D1491: 150 | E1491: 12
B1492: Pontiac, peeled and microwave on high for 6-7.5 min (Australia) | C1492: 79±9 | D1492: 150 | E1492: =(18.15*79)/100 -> 14.3385
B1493: Type NS, microwaved (USA) | C1493: 82 | D1493: 150 | E1493: =(32.745*82)/100 -> 26.850899999999996
A1494: =A1491+1 -> 611 | B1494: New Potato
B1495: New (Canada) | C1495: 47
B1496: New (Canada) | C1496: 54
B1497: New (Canada) | C1497: 70±8
B1498: mean of three studies | C1498: 57±7 | D1498: 150 | E1498: =(21*57)/100 -> 11.97
B1499: New, unpeeled and boiled 20 min (Australia) | C1499: 78±12 | D1499: 150 | E1499: =(21*78)/100 -> 16.38
A1500: =A1494+1 -> 612 | B1500: Steamed potato
B1501: Potato, peeled, steamed 1 h (Solanum Tuberosum) (India)11 | C1501: 65±11 | D1501: 150 | E1501: =(27.315*65)/100 -> 17.754750000000001
B1502: Potato dumplings (white wheat flour, white potatoes, boiled in salted water (Italy)) | C1502: 52 | D1502: 150 | E1502: =(45.455*52)/100 -> 23.636599999999998
A1503: =A1500+1 -> 613 | B1503: Sweet potato
B1504: Sweet potato, Ipomoea batatas (Australia) | C1504: 44 | D1504: 150 | E1504: =(25.0424*44)/100 -> 11.018656
B1505: Sweet potato, NS (Canada) | C1505: 48±6 | D1505: 150 | E1505: =(33.72*48)/100 -> 16.185600000000001
B1506: Sweet potato, peeled, cubed, boiled in salted water 15 min (Canada) | C1506: 59 | D1506: 150 | E1506: =(30.12*59)/100 -> 17.770800000000001
B1507: Sweet potato, kumara (New Zealand) | C1507: 77±12 | D1507: 150 | E1507: =(25.0424*77)/100 -> 19.282648000000002
B1508: Sweet potato, kumara (New Zealand) | C1508: 78±6 | D1508: 150 | E1508: =(25.0424*78)/100 -> 19.533072000000001
B1509: mean of five studies | C1509: 61±7 | D1509: 150 | E1509: =(27.79344*61)/100 -> 16.9539984
A1510: =A1503+1 -> 614 | B1510: Swede
B1511: Swede (rutabaga) (Canada)6 | C1511: 72±8 | D1511: 150 | E1511: =(10.41*72)/100 -> 7.4951999999999996
A1512: =A1510+1 -> 615 | B1512: Tapioca
B1513: Tapioca boiled with milk (General Mills Canada Inc., Etobicoke, Canada) | C1513: 81 | D1513: 250 | E1513: =(17.55*81)/100 -> 14.215499999999999
B1514: Tapioca (Manihot Utilissima), steamed 1 h (India)11 | C1514: 70±10 | D1514: 250 | E1514: =(17.55*70)/100 -> 12.285
A1515: =A1512+1 -> 616 | B1515: Taro
B1516: Taro (Colocasia esculenta) peeled, boiled (Australia) | C1516: 54
B1517: Taro, peeled, boiled (New Zealand) | C1517: 56±12
B1518: mean of two studies | C1518: 55±1 | D1518: 150 | E1518: =(7.5*55)/100 -> 4.125
A1519: =A1515+1 -> 617 | B1519: Yam
B1520: Yam, peeled, boiled (New Zealand) | C1520: 25±4
B1521: Yam, peeled, boiled (New Zealand) | C1521: 35±5
B1522: Yam (Canada) | C1522: 51±12
B1523: mean of three studies | C1523: 37±8 | D1523: 150 | E1523: =(35.55*37)/100 -> 13.153499999999999
B1525: INDIGENOUS OR TRADITIONAL FOODS OF DIFFERENT ETHNIC GROUPS
B1526: AFRICAN
A1527: =A1519+1 -> 618 | B1527: Brown beans (South Africa) | C1527: 24±8 | D1527: 50 (dry) | E1527: =(25*24)/100 -> 6
A1528: =A1535+1 -> 622 | B1528: Cassava, boiled, with salt (Kenya) | C1528: 46 | D1528: 100 | E1528: 12
A1529: =A1536+1 -> 624 | B1529: Ga kenkey, prepared from fermented cornmeal (Zea mays) (Ghana)31 | C1529: 12±1 | D1529: 150 | E1529: =(12.9*56)/100 -> 7.2240000000000002
A1530: =A1529+1 -> 625 | B1530: Gari, roasted cassava dough (Manihot utilissima) (Ghana)31 | C1530: 56±3 | D1530: 100 | E1530: =(27*56)/100 -> 15.12
A1531: =A1527+1 -> 619 | B1531: Gram dhal (chana dal; South Africa) | C1531: 5±3 | D1531: 50 (dry) | E1531: =(29.412*5)/100 -> 1.4706000000000001
A1532: =A1531+1 -> 620 | B1532: Maize meal porridge, unrefined, maize-meal:water = 1:3 (South Africa) | C1532: 71±6 | D1532: 50 (dry) | E1532: =(35.7143*71)/100 -> 25.357153000000004
B1533: Maize meal porridge, refined, maize-meal:water = 1:3 (South Africa) | C1533: 74±7 | D1533: 50 (dry) | E1533: =(40.323*74)/100 -> 29.839020000000001
B1534: Maize meal porridge/gruel (Kenya) | C1534: 109 | D1534: 50 (dry) | E1534: =(38.01844*109)/100 -> 41.440099599999996
A1535: =A1532+1 -> 621 | B1535: M'fino/Morogo, wild greens (South Africa) | C1535: 68±8 | D1535: 120 | E1535: =(50*68)/100 -> 34
A1536: =A1528+1 -> 623 | B1536: Millet flour porridge/gruel (Kenya) | C1536: 107
A1537: =A1530+1 -> 626 | B1537: Unripe plantain (Musa paradisiaca) (Ghana)31 | C1537: 40±4 | D1537: 120 (raw) | E1537: =(33.6*40)/100 -> 13.44
A1538: =A1537+1 -> 627 | B1538: Yam (Dyscoria species) (Ghana)31 | C1538: 66 | D1538: 150 | E1538: =(35.55*66)/100 -> 23.462999999999997
B1539: ARABIC AND TURKISH
A1540: =A1538+1 -> 628 | B1540: Hoummous (chickpea salad dip) | C1540: 6±4 | D1540: 30 | E1540: =(4.521*6)/100 -> 0.27126
A1541: =A1540+1 -> 629 | B1541: Kibbeh saynieh (made with lamb and burghul) | C1541: 61±16 | D1541: 120 | E1541: =(15*61)/100 -> 9.15
A1542: =A1541+1 -> 630 | B1542: Lebanese bread (white, unleaved), hoummous, falafel and tabbouleh | C1542: 86±12 | D1542: 120 | E1542: =(45*86)/100 -> 38.7
A1543: =A1542+1 -> 631 | B1543: Majadra (Syrian, lentils and rice) | C1543: 24±5 | D1543: 250 | E1543: =(40.96*24)/100 -> 9.8303999999999991
A1544: =A1543+1 -> 632 | B1544: Moroccan Couscous (stew of semolina, chickpeas, vegetables) | C1544: 58±9 | D1544: 250 | E1544: =(29.035*58)/100 -> 16.840299999999999
A1545: =A1544+1 -> 633 | B1545: Stuffed Grapevine Leaves (rice and lamb stuffing with tomato sauce) | C1545: 30±11 | D1545: 100 | E1545: =(15*30)/100 -> 4.5
A1546: =A1545+1 -> 634 | B1546: Tarhana soup (wheat flour, yoghurt, tomato, green pepper) | C1546: 20
A1547: =A1546+1 -> 635 | B1547: Turkish bread, white wheat flour | C1547: 87 | D1547: 30 | E1547: =(16.8*87)/100 -> 14.616000000000001
A1548: =A1547+1 -> 636 | B1548: Turkish bread, whole wheat | C1548: 49 | D1548: 30 | E1548: =(16.2*49)/100 -> 7.9379999999999997
A1549: =A1548+1 -> 637 | B1549: Turkish noodle soup | C1549: 1 | D1549: 250 | E1549: =(8.925*1)/100 -> 8.925000000000001E-2
B1550: ASIAN
A1551: =A1549+1 -> 638 | B1551: Broken rice, white, cooked in rice cooker (Lion foods, Bangkok, Thailand) | C1551: 86±10 | D1551: 150 | E1551: =(43.023*86)/100 -> 36.999780000000001
A1552: =A1551+1 -> 639 | B1552: Butter rice, warm white rice and butter (Japan) | C1552: 79 | D1552: 150 | E1552: =(51.02*79)/100 -> 40.305800000000005
A1553: =A1552+1 -> 640 | B1553: Curry rice (Japan) | C1553: 67 | D1553: 150 | E1553: =(60.6*67)/100 -> 40.602000000000004
A1554: =A1553+1 -> 641 | B1554: Curry rice with cheese (Japan) | C1554: 55 | D1554: 150 | E1554: =(48.884*55)/100 -> 26.886199999999999
A1555: =A1554+1 -> 642 | B1555: Glutinous rice, white, cooked in rice cooker (Bangsue Chia Meng Rice Co., Bangkok, Thailand) | C1555: 98±7 | D1555: 150 | E1555: 31
B1556: Glutinous rice NS (Esubi Shokuhin, Japan) | C1556: 86 | D1556: 150 | E1556: =(64.53*86)/100 -> 55.495800000000003
B1557: Mean of two studies | C1557: 92±6 | D1557: 150 | E1557: =(48.265*92)/100 -> 44.403800000000004
A1558: =A1555+1 -> 643 | B1558: Glutinous rice ball with cut glutinous cake (mochi) (Japan) | C1558: 48 | D1558: 75 | E1558: =(28.41*48)/100 -> 13.636800000000001
A1559: =A1558+1 -> 644 | B1559: Glutinous rice cake with dried sea algae (Japan) | C1559: 83 | D1559: 75 | E1559: =(38.6*83)/100 -> 32.038000000000004
A1560: =A1559+1 -> 645 | B1560: Glutaminous rice flour, instant, served warm with roasted ground soybean (Japan) | C1560: 65 | D1560: 100 | E1560: =(41.07*65)/100 -> 26.695500000000003
A1561: =A1560+1 -> 646 | B1561: Jasmine rice, white, cooked in rice cooker (Golden World Foods, Bangkok, Thailand) | C1561: 109±10 | D1561: 150 | E1561: =(42.26*109)/100 -> 46.063400000000001
A1562: =A1561+1 -> 647 | B1562: Low-protein white rice with dried sea algae (Japan) | C1562: 70 | D1562: 150 | E1562: =(60.24*70)/100 -> 42.167999999999999
A1563: =A1562+1 -> 648 | B1563: Lungkow beanthread (National Cereals, Oils & Foodstuffs, Qingdao & Guangdong, China) | C1563: 26 | D1563: 180 | E1563: =(45.36*26)/100 -> 11.7936
A1564: =A1563+1 -> 649 | B1564: Lychee, canned in syrup, drained (Narcissus brand, China) | C1564: 79±8 | D1564: 120 | E1564: =(20.4*79)/100 -> 16.116
A1565: =A1564+1 -> 650 | B1565: Mung bean noodles, dried, boiled (China) | C1565: 39±9 | D1565: 180 | E1565: =(45.36*39)/100 -> 17.6904
A1566: =A1565+1 -> 651 | B1566: Non-glutaminous rice flour, served warm with drink (Yamato Nousan, Japan) | C1566: 68 | D1566: 100 | E1566: =(50.2*68)/100 -> 34.136000000000003
A1567: =A1566+1 -> 652 | B1567: Rice cracker, plain (Sakada, Japan) | C1567: 91 | D1567: 30 | E1567: =(25.11*91)/100 -> 22.850099999999998
A1568: =A1567+1 -> 653 | B1568: Rice gruel with dried algae (Satou Co Ltd., Japan) | C1568: 81 | D1568: 250 | E1568: =(81*19.044)/100 -> 15.425640000000001
A1569: =A1568+1 -> 654 | B1569: Rice noodles, dried, boiled (Thai World, Bangkok, Thailand) | C1569: 61±6 | D1569: 180 | E1569: =(38.52*61)/100 -> 23.497200000000003
A1570: =A1569+1 -> 655 | B1570: Rice noodles, fresh, boiled (Sydney, NSW, Australia) | C1570: 40±4 | D1570: 180 | E1570: =(38.52*40)/100 -> 15.408000000000001
A1571: =A1570+1 -> 656 | B1571: Rice vermicelli, Kongmoon (National Cereals, China) | C1571: 58 | D1571: 180 | E1571: =(38.52*58)/100 -> 22.341600000000003
A1572: =A1571+1 -> 657 | B1572: Roasted rice ball (Satou Co Ltd., Japan) | C1572: 77 | D1572: 75 | E1572: =(77*26.84)/100 -> 20.666799999999999
A1573: =A1572+1 -> 658 | B1573: Salted rice ball (Satou Co Ltd., Japan) | C1573: 80 | D1573: 75 | E1573: =(80*25.51)/100 -> 20.408000000000001
A1574: =A1573+1 -> 659 | B1574: Soba noodles, instant, reheated in hot water, served with soup (Japan) | C1574: 46 | D1574: 180 | E1574: =(46*48.55)/100 -> 22.332999999999998
A1575: =A1574+1 -> 660 | B1575: Stirfried vegetables, chicken and rice, home made (Australia) | C1575: 73±17 | D1575: 360 | E1575: =(74.94*73)/100 -> 54.706199999999995
A1576: =A1575+1 -> 661 | B1576: Sushi, salmon ('I Love Sushi' chain store, Sydney, NSW, Australia)6 | C1576: 48±8 | D1576: 100 | E1576: =(36.179*48)/100 -> 17.365920000000003
B1577: Sushi, roasted sea algae, vinegar and rice (Japan) | C1577: 55 | D1577: 100 | E1577: =(37.21*55)/100 -> 20.465499999999999
B1578: Mean of two studies | C1578: 52±4 | D1578: 100 | E1578: =(52*36.6945)/100 -> 19.081139999999998
A1579: =A1576+1 -> 662 | B1579: Udon noodles, fresh, reheated (Fantastic, Windsor Gardens, SA, Australia)6 | C1579: 62±8 | D1579: 180 | E1579: =(48.42*62)/100 -> 30.020399999999999
B1580: Udon noodles, instant, with sauce and fried bean curd (Nishin Shokuhin, Japan) | C1580: 48 | D1580: 180 | E1580: =(48*47.12)/100 -> 22.617599999999996
B1581: Mean of two studies | C1581: 55±7 | D1581: 180 | E1581: =(55*47.77)/100 -> 26.273500000000002
A1582: =A1579+1 -> 663 | B1582: White rice, dried sea algae and milk, eaten together (Japan) | C1582: 57
B1583: White rice, dried sea algae and milk (milk eaten before rice) (Japan) | C1583: 56
B1584: White rice, dried sea algae and milk (milk eaten after rice) (Japan) | C1584: 55
B1585: Mean of three types | C1585: 56±1 | D1585: 300 | E1585: =(47.022*56)/100 -> 26.332319999999999
A1586: =A1582+1 -> 664 | B1586: White rice with dried fish strip (okaka) (Japan) | C1586: 79 | D1586: 150 | E1586: =(50.1*79)/100 -> 39.579000000000001
A1587: =A1586+1 -> 665 | B1587: White rice with fermented soybean (natto) (Japan) | C1587: 56 | D1587: 150 | E1587: =(56*43)/100 -> 24.08
A1588: =A1587+1 -> 666 | B1588: White rice with instant miso soup (soybean paste soup) (Japan) | C1588: 61 | D1588: 150 | E1588: =(61*46.96875)/100 -> 28.650937500000001
A1589: =A1588+1 -> 667 | B1589: White rice with low-fat milk (Japan) | C1589: 69 | D1589: 300 | E1589: =(47.022*69)/100 -> 32.445180000000001
A1590: =A1589+1 -> 668 | B1590: White rice and non-sugar yoghurt (yoghurt eaten before rice) (Japan) | C1590: 59
B1591: White rice and non-sugar yoghurt eaten together (Japan) | C1591: 58
B1592: Mean of two types | C1592: 59±1 | D1592: 150 | E1592: =(59*32.46)/100 -> 19.151400000000002
A1593: =A1590+1 -> 669 | B1593: White rice with pickled vinegar and cucumber (pickled food eaten before rice) (Japan) | C1593: 63
B1594: White rice with pickled vinegar and cucumber (pickled food eaten with rice) (Japan) | C1594: 61
B1595: Mean of two types | C1595: 62±1 | D1595: 150 | E1595: =(62*43.2)/100 -> 26.784000000000002
A1596: =A1593+1 -> 670 | B1596: White rice topped with raw egg and soy sauce (Japan) | C1596: 72 | D1596: 150 | E1596: =(72*36.2)/100 -> 26.064
A1597: =A1596+1 -> 671 | B1597: White rice with roasted ground soybean (Japan) | C1597: 56 | D1597: 150 | E1597: =(51.02*56)/100 -> 28.571200000000005
A1598: =A1597+1 -> 672 | B1598: White rice with salted dried plum (umeboshi) (Japan) | C1598: 80 | D1598: 150 | E1598: =(80*49.243)/100 -> 39.394399999999997
A1599: =A1598+1 -> 673 | B1599: White rice with sea algae rolled in sheet of toasted sea algae (Japan) | C1599: 77 | D1599: 150 | E1599: =(77*51.02)/100 -> 39.285400000000003
B1600: ASIAN INDIAN
A1601: =A1599+1 -> 674 | B1601: Amaranth, Amaranthus esculentum, popped, eaten with milk and | C1601: 97±19 | D1601: 30 | E1601: =(19*97)/100 -> 18.43
B1602: non-nutritive sweetener
A1603: =A1601+1 -> 675 | B1603: Bajra (Penniseteum typhoideum),eaten as roasted bread made from bajra flour | C1603: 55±13
B1604: Bajra (Penniseteum typhoideum) | C1604: 49
B1605: Bajra (Penniseteum typhoideum) | C1605: 67
B1606: Mean of three studies | C1606: 57±5 | D1606: 75 (dry) | E1606: =(50*57)/100 -> 28.5
A1607: =A1603+1 -> 676 | B1607: Banana, (Musa sapientum), Nendra variety, unripe, steamed 1 h 11 | C1607: 70±11 | D1607: 120 | E1607: =(44.8*70)/100 -> 31.36
A1608: =A1607+1 -> 677 | B1608: Barley (Hordeum vulgare) | C1608: 48
B1609: Barley (Hordeum vulgare) | C1609: 37
B1610: Mean in two groups of subjects | C1610: 43±6 | D1610: 150 | E1610: =(36.63*43)/100 -> 15.750900000000001
A1611: =A1608+1 -> 678 | B1611: Bengal gram dhal, chickpea (chana dal) | C1611: 11 | D1611: 150 | E1611: =(35.7143*11)/100 -> 3.9285730000000001
A1612: =A1611+1 -> 679 | B1612: Black gram, (Phaseolus mungo), soaked 12 h, stored moist 24 h, steamed 1 h 11 | C1612: 43±10 | D1612: 150 | E1612: =(17.91*43)/100 -> 7.7012999999999998
B1613: Chapatti
A1614: =A1612+1 -> 680 | B1614: Chapatti, amaranth-wheat (25:75) composite flour, served with bottle gourd and tomato curry | C1614: 66±10 | D1614: 60 | E1614: =(66*29.64)/100 -> 19.5624
A1615: =A1614+1 -> 681 | B1615: Chapatti, amaranth-wheat (50:50) composite flour, served with bottle gourd and tomato curry | C1615: 76±20 | D1615: 60 | E1615: =(76*30.42)/100 -> 23.119199999999999
A1616: =A1615+1 -> 682 | B1616: Chapatti, baisen | C1616: 27
A1617: =A1616+1 -> 683 | B1617: Chapatti, bajra | C1617: 67
B1618: Chapatti, bajra | C1618: 49
B1619: Mean in two groups of subjects | C1619: 58±9
A1620: =A1617+1 -> 684 | B1620: Chapatti, barley | C1620: 37
B1621: Chapatti, barley | C1621: 48
B1622: Mean in two groups of subjects | C1622: 42±5
A1623: =A1620+1 -> 685 | B1623: Chapatti, maize, (Zea mays) | C1623: 64
B1624: Chapatti, maize, (Zea mays) | C1624: 59
B1625: Mean in two groups of subjects | C1625: 62±3
A1626: =A1623+1 -> 686 | B1626: Chapatti, wheat, served with bottle gourd and tomato curry | C1626: 66±9 | D1626: 60 | E1626: =(66*31.68)/100 -> 20.908799999999999
A1627: =A1626+1 -> 687 | B1627: Chapatti, flour from malted wheat, moth bean (Phaseolus aconitifolius) and | C1627: 66±9 | D1627: 60 | E1627: =(38.22*66)/100 -> 25.225200000000001
B1628: bengal gram (Cicer arietinum)
A1629: =A1627+1 -> 688 | B1629: Chapatti, flour made from popped wheat, moth bean and bengal gram | C1629: 40±8 | D1629: 60 | E1629: =(40.4*35.64)/100 -> 14.39856
A1630: =A1629+1 -> 689 | B1630: Chapatti, flour from roller dried wheat, moth bean and bengal gram | C1630: 60±9 | D1630: 60 | E1630: =(37.74*59.8)/100 -> 22.568519999999999
A1631: =A1630+1 -> 690 | B1631: Chapatti, wheat flour, thin, with green gram (Phaseolus aureus) dhal | C1631: 81±4 | D1631: 200 | E1631: =(50*81)/100 -> 40.5
B1632: Chapatti, wheat flour, thin, with green gram (Phaseolus aureus) dhal | C1632: 44±3 | D1632: 200 | E1632: =(50*44)/100 -> 22
B1633: Mean in two groups of subjects | C1633: 63±19 | D1633: 200 | E1633: =(50*63)/100 -> 31.5
B1634: Cheela (thin savoury pancake made from legume flour batter)
A1635: =A1631+1 -> 691 | B1635: Cheela, bengal gram (Cicer arietinum) | C1635: 42±1 | D1635: 150 | E1635: =(28.345*42)/100 -> 11.9049
B1636: Cheela, bengal gram (Cicer arietinum), fermented batter | C1636: 36±1 | D1636: 150 | E1636: =(28.345*36)/100 -> 10.2042
A1637: =A1635+1 -> 692 | B1637: Cheela, green gram (Phaseolus aureus) | C1637: 45±1 | D1637: 150 | E1637: =(45*26.38)/100 -> 11.870999999999999
B1638: Cheela, green gram (Phaseolus aureus), fermented batter | C1638: 38±1 | D1638: 150 | E1638: =(38*26.38)/100 -> 10.0244
A1639: =A1637+1 -> 693 | B1639: Dhokla, leavened, fermented, steamed cake; dehusked chickpea and wheat semolina | C1639: 35±4
B1640: Dhokla, leavened, fermented, steamed cake; dehusked chickpea and wheat semolina | C1640: 31±6
B1641: Mean in two groups of subjects | C1641: 33±2 | D1641: 100 | E1641: =(19.54*33)/100 -> 6.448199999999999
A1642: =A1639+1 -> 694 | B1642: Dosai (parboiled and raw rice, soaked, ground, fermented and fried) with chutney | C1642: 77±3 | D1642: 150 | E1642: =(39.474*77)/100 -> 30.394979999999997
B1643: Dosai (parboiled and raw rice, soaked, ground, fermented and fried) with chutney | C1643: 55±2 | D1643: 150 | E1643: =(39.474*55)/100 -> 21.710699999999996
B1644: Mean in two groups of subjects | C1644: 66±11 | D1644: 150 | E1644: =(39.474*66)/100 -> 26.052839999999996
A1645: =A1642+1 -> 695 | B1645: Green gram, (Phaseolus aureus), soaked 12 h, stored moist 24 h, steamed 1 h 11 | C1645: 38±14 | D1645: 150 | E1645: =(16.973*38)/100 -> 6.4497399999999994
A1646: =A1645+1 -> 696 | B1646: Green gram, whole with varagu (Paspalum scorbiculatum), pressure cooked | C1646: 57±6 | D1646: 80 (dry) | E1646: =(50*57)/100 -> 28.5
A1647: =A1646+1 -> 697 | B1647: Green gram dhal with varagu (Paspalum scorbiculatum), pressure cooked | C1647: 78±12 | D1647: 78 (dry) | E1647: =(50*78)/100 -> 39
A1648: =A1647+1 -> 698 | B1648: Horse gram, (Dolichos biflorus) soaked 12 h, stored moist 24 h, steamed 1 h 11 | C1648: 51±11 | D1648: 150 | E1648: =(29*51)/100 -> 14.79
A1649: =A1648+1 -> 699 | B1649: Idli (parboiled and raw rice + black dhal, soaked, ground, fermented, steamed) with chutney | C1649: 77±2 | D1649: 250 | E1649: =(52.083*77)/100 -> 40.103909999999999
B1650: Idli (parboiled and raw rice + black dhal, soaked, ground, fermented, steamed) with chutney | C1650: 60±2 | D1650: 250 | E1650: =(52.083*60)/100 -> 31.2498
B1651: Mean in two groups of subjects | C1651: 69±9 | D1651: 250 | E1651: =(52.083*69)/100 -> 35.937269999999998
A1652: =A1649+1 -> 700 | B1652: Jowar, roasted bread made from Jowar flour (Sorghum vulgare) | C1652: 77±8 | D1652: 70 (dry) | E1652: =(50*77)/100 -> 38.5
A1653: =A1652+1 -> 701 | B1653: Laddu (popped amaranth, foxtail millet, roasted legume powder, fenugreek seeds) | C1653: 24±4
B1654: in hot sweet syrup
B1655: Laddu (popped amaranth, foxtail millet, roasted legume powder, fenugreek seeds) | C1655: 29±4
B1656: in hot sweet syrup
B1657: Mean in two groups of subjects | C1657: 27±3 | D1657: 50 | E1657: =(27*31.315)/100 -> 8.45505
A1658: =A1653+1 -> 702 | B1658: Lentil and cauliflower curry with rice (Australia) | C1658: 60±10 | D1658: 360 | E1658: =(51*60)/100 -> 30.6
A1659: =A1658+1 -> 703 | B1659: Millet/Ragi, (Eleucine coracana), dehusked, soaked 12 h, stored moist 24 h, steamed 1 h 11 | C1659: 68±10 | D1659: 150 | E1659: =(33.555*68)/100 -> 22.817399999999999
A1660: =A1659+1 -> 704 | B1660: Millet/Ragi (Eleucine coracana)11 | C1660: 84 | D1660: 70 (dry) | E1660: =(50*84)/100 -> 42
B1661: Millet/Ragi (Eleucine coracana) flour eaten as roasted bread | C1661: 104±13 | D1661: 70 (dry) | E1661: =(50*104)/100 -> 52
B1662: mean of two studies | C1662: 94±10
A1663: =A1660+1 -> 705 | B1663: Pongal (rice and roasted green gram dhal, pressure cooked) | C1663: 90±3
B1664: Pongal (rice and roasted green gram dhal, pressure cooked) | C1664: 45±2
B1665: Mean in two groups of subjects | C1665: 68±23 | D1665: 250 | E1665: =(52.083*68)/100 -> 35.416439999999994
A1666: =A1663+1 -> 706 | B1666: Poori (deep-fried wheat flour dough) with potato palya (mashed potato) | C1666: 82±2
B1667: Poori (deep-fried wheat flour dough) with potato palya (mashed potato) | C1667: 57±1
B1668: Mean in two groups of subjects | C1668: 70±13 | D1668: 150 | E1668: =(70*40.54)/100 -> 28.377999999999997
A1669: =A1666+1 -> 707 | B1669: Rajmah, Phaseolus vulgaris | C1669: 19 | D1669: 150 | E1669: =(29.762*19)/100 -> 5.6547800000000006
A1670: =A1669+1 -> 708 | B1670: Rice, (Oryza Sativa) boiled served with bottle gourd and tomato curry | C1670: 69±15 | D1670: 150 | E1670: =(38*69)/100 -> 26.22
A1671: =A1670+1 -> 709 | B1671: Semolina
B1672: Semolina (Triticum aestivum), steamed | C1672: 55±9 | D1672: 67 (dry) | E1672: =(50*55)/100 -> 27.5
B1673: Semolina (Triticum aestivum), pre-roasted | C1673: 76±6 | D1673: 67 (dry) | E1673: =(50*76)/100 -> 38
B1674: Semolina (Triticum aestivum) with fermented black gram dhal (Phaseolus mungo) | C1674: 46±12 | D1674: 71 (dry) | E1674: =(50*46)/100 -> 23
B1675: Semolina (Triticum aestivum) with fermented green gram dhal (Phaseolus aureus) | C1675: 62±20 | D1675: 71 (dry) | E1675: =(50*62)/100 -> 31
B1676: Semolina (Triticum aestivum) with fermented bengal gram dhal (Cicer arietum) | C1676: 54±7 | D1676: 71 (dry) | E1676: =(50*54)/100 -> 27
A1677: =A1671+1 -> 710 | B1677: Tapioca (Manihot utilissima), steamed 1h11 | C1677: 70±10 | D1677: 250 | E1677: =(17.55*70)/100 -> 12.285
A1678: =A1677+1 -> 711 | B1678: Varagu (Paspalum scorbiculatum), pressure cooked 15lb 12-15 min | C1678: 68±8 | D1678: 76 (dry) | E1678: =(50*68)/100 -> 34
A1679: =A1678+1 -> 712 | B1679: Upittu (roasted semolina and onions, cooked in water) | C1679: 67±3
B1680: Upittu (roasted semolina and onions, cooked in water) | C1680: 69±4
B1681: Mean in two groups of subjects | C1681: 68±1 | D1681: 150 | E1681: =(41.7*68)/100 -> 28.356000000000005
A1682: =A1679+1 -> 713 | B1682: Uppuma kedgeree (millet, legumes, fenugreek seeds; roasted and cooked in water) | C1682: 18±3
B1683: Uppuma kedgeree (millet, legumes, fenugreek seeds; roasted and cooked in water) | C1683: 19±3
B1684: Mean in two groups of subjects | C1684: 18±1 | D1684: 150 | E1684: =(32.685*18)/100 -> 5.8833000000000002
B1685: AUSTRALIAN ABORIGINAL
A1686: =A1682+1 -> 714 | B1686: Acacia aneura, mulga seed, roasted, wet ground to paste6 | C1686: 8 | D1686: 50 | E1686: =(17.1*8)/100 -> 1.3680000000000001
A1687: =A1686+1 -> 715 | B1687: Acacia coriacea, desert oak,seed bread6 | C1687: 46 | D1687: 75 | E1687: =(24.35*46)/100 -> 11.201000000000001
A1688: =A1687+1 -> 716 | B1688: Araucaria bidwillii, bunya tree nut, baked 10 min6 | C1688: 47 | D1688: 50 | E1688: =(15.9*47)/100 -> 7.4730000000000008
A1689: =A1688+1 -> 717 | B1689: Bush honey, sugar bag6 | C1689: 43 | D1689: 30 | E1689: 11
A1690: =A1689+1 -> 718 | B1690: Castanospermum australe, blackbean seed, sliced, soaked 1 wk, pounded and baked6 | C1690: 8 | D1690: 50 | E1690: =(8.8*8)/100 -> 0.70400000000000007
A1691: =A1690+1 -> 719 | B1691: Dioscorea bulbifera, cheeky yam, peeled, sliced, soaked 2 d, baked 15 min6 | C1691: 34 | D1691: 150 | E1691: =(36.15*34)/100 -> 12.290999999999999
A1692: =A1691+1 -> 720 | B1692: Macrozamia communis, cycad palm seed, sliced, soaked 1 wk, pounded, baked6 | C1692: 40±2 | D1692: 50 | E1692: =(25*40)/100 -> 10
B1693: PACIFIC ISLANDERS
A1694: =A1692+1 -> 721 | B1694: Breadfruit (Artocarpus altilis) (Australia)6 | C1694: 68 | D1694: 120 | E1694: =(26.664*68)/100 -> 18.131520000000002
A1695: =A1694+1 -> 722 | B1695: Banana/plantain, green
B1696: Green banana, boiled (New Zealand) | C1696: 38±10 | D1696: 120 | E1696: =(20.9*38)/100 -> 7.9419999999999993
A1697: =A1695+1 -> 723 | B1697: Sweet Potato
B1698: Sweet potato, Ipomoea batatas (Australia) | C1698: 44 | D1698: 150 | E1698: =(25.0424*44)/100 -> 11.018656
B1699: Sweet potato, kumara (New Zealand) | C1699: 77±12 | D1699: 150 | E1699: =(25.0424*77)/100 -> 19.282648000000002
B1700: Sweet potato, kumara (New Zealand) | C1700: 78±6 | D1700: 150 | E1700: =(25.0424*78)/100 -> 19.533072000000001
B1701: mean of three studies | C1701: 66±11 | D1701: 150 | E1701: =(27.79344*61)/100 -> 16.9539984
A1702: =A1697+1 -> 724 | B1702: Taro
B1703: Taro (Colocasia esculenta) peeled, boiled (Australia) | C1703: 54
B1704: Taro, peeled, boiled (New Zealand) | C1704: 56±12
B1705: mean of two studies | C1705: 55±1 | D1705: 150 | E1705: =(7.5*55)/100 -> 4.125
A1706: =A1702+1 -> 725 | B1706: Yam
B1707: Yam, peeled, boiled (New Zealand) | C1707: 25±4
B1708: Yam, peeled, boiled (New Zealand) | C1708: 35±5
B1709: mean of two groups of subjects | C1709: 30±5 | D1709: 150 | E1709: =(35.55*37)/100 -> 13.153499999999999
B1710: ISRAELI
A1711: =A1706+1 -> 726 | B1711: Melawach (dough made from white wheat flour and butter, fried) | C1711: 61±10
B1712: Melawach | C1712: 71±7
B1713: mean of two studies | C1713: 66±5 | D1713: 115 | E1713: =(53*66)/100 -> 34.98
A1714: =A1711+1 -> 727 | B1714: Melawach + 15 g locust bean (Ceratonia siliqua) fiber (soluble) | C1714: 31±6 | D1714: 130 | E1714: =(53*31)/100 -> 16.43
A1715: =A1714+1 -> 728 | B1715: Melawach + 15 g maize cob fiber (insoluble) | C1715: 59±10 | D1715: 130 | E1715: =(53*59)/100 -> 31.27
A1716: =A1715+1 -> 729 | B1716: Melawach + 15 g lupin (Lupinus albus) fiber | C1716: 72±10 | D1716: 130 | E1716: =(53*72)/100 -> 38.16
B1717: PIMA INDIAN
A1718: =A1716+1 -> 730 | B1718: Acorns, stewed with venison (Quercus emoryi)6 | C1718: 16±1 | D1718: 100 | E1718: =(5.5*16)/100 -> 00.88
A1719: =A1718+1 -> 731 | B1719: Cactus jam (Stenocereus thurberi) | C1719: 91 | D1719: 30 | E1719: =(20.328*91)/100 -> 18.498480000000001
A1720: =A1719+1 -> 732 | B1720: Corn hominy (Zea mays)6 | C1720: 40±5 | D1720: 150 | E1720: =(30*40)/100 -> 12
A1721: =A1720+1 -> 733 | B1721: Fruit Leather (Stenocereus thurberi) | C1721: 70 | D1721: 30 | E1721: =(24.21*70)/100 -> 16.946999999999999
A1722: =A1721+1 -> 734 | B1722: Lima beans broth (Phaseolus lunatus)6 | C1722: 36±3 | D1722: 250 | E1722: =(32*36)/100 -> 11.52
A1723: =A1722+1 -> 735 | B1723: Mesquite cakes (Prosopis velutina)6 | C1723: 25±3 | D1723: 60 | E1723: =(3.72*25)/100 -> 00.93
A1724: =A1723+1 -> 736 | B1724: Tortilla (Zea mays and Olneya tesota) | C1724: 38 | D1724: 60 | E1724: =(24.84*38)/100 -> 9.4391999999999996
A1725: =A1724+1 -> 737 | B1725: White teparies broth (Phaseolus acutifolius)6 | C1725: 31±3 | D1725: 250 | E1725: =(31.75*31)/100 -> 9.8424999999999994
A1726: =A1725+1 -> 738 | B1726: Yellow teparies broth (Phaseolus acutifolius)6 | C1726: 29±3 | D1726: 250 | E1726: =(26.25*29)/100 -> 7.6124999999999998
B1727: SOUTH AMERICAN
A1728: =A1726+1 -> 739 | B1728: Arepa, corn bread cake, made with corn flour (Mexico) | C1728: 72 | D1728: 100 | E1728: =(42.86*72)/100 -> 30.859200000000001
A1729: =A1728+1 -> 740 | B1729: Arepa, made from ordinary dehulled dent corn flour (25% amylose) 9, 34 | C1729: 81 | D1729: 100 | E1729: =(42.86*81)/100 -> 34.7166
A1730: =A1729+1 -> 741 | B1730: Arepa, made from dehulled high-amylose (70%) corn flour 9, 34 | C1730: 44 | D1730: 100 | E1730: =(25*44)/100 -> 11
A1731: =A1730+1 -> 742 | B1731: Black Beans | C1731: 30 | D1731: 150 | E1731: =(30*22.515)/100 -> 6.7545000000000002
A1732: =A1731+1 -> 743 | B1732: Brown Beans | C1732: 38 | D1732: 150 | E1732: =(24.615*38)/100 -> 9.3536999999999981
A1733: =A1732+1 -> 744 | B1733: Corn tortilla (Mexican) | C1733: 52 | D1733: 50 | E1733: =(23.85*52)/100 -> 12.402000000000001
A1734: =A1733+1 -> 745 | B1734: Corn tortilla, served with refried mashed pinto beans and tomato sauce (Mexican) | C1734: 39 | D1734: 100 | E1734: =(23.1*39)/100 -> 9.0090000000000003
A1735: =A1734+1 -> 746 | B1735: Corn tortilla, fried, with mashed potato, fresh tomato and lettuce (Mexican) | C1735: 78 | D1735: 100 | E1735: =(14.5*78)/100 -> 11.31
A1736: =A1735+1 -> 747 | B1736: Nopal (prickly pear cactus) | C1736: 7 | D1736: 100 | E1736: =(5.97*7)/100 -> 0.41789999999999999
A1737: =A1736+1 -> 748 | B1737: Pinto beans, boiled in salted water | C1737: 14 | D1737: 150 | E1737: =(25.485*14)/100 -> 3.5678999999999998
A1738: =A1737+1 -> 749 | B1738: Wheat tortilla (Mexican) | C1738: 30 | D1738: 50 | E1738: =(26.04*30)/100 -> 7.8119999999999994
A1739: =A1738+1 -> 750 | B1739: Wheat tortilla served with refried pinto beans and tomato sauce (Mexican) | C1739: 28 | D1739: 100 | E1739: =(28*18.06)/100 -> 5.0567999999999991
B1741: Footnotes:
B1742: 1NS, not specified; type 1 and type 2, subjects with type 1 and type 2 diabetes; AUC, area under the curve. Serving sizes
B1743: in grams unless specified otherwise.
B1744: 2The published tables show GI values based on glucose=100 and on white bread=100.
B1745: 3Estimated by multiplying the food’s listed GI value with glucose as the reference food by the listed g carbohydrate per
B1746: serving and dividing by 100.
B1747: 4Human Nutrition Unit (Sydney University, Australia), unpublished observations, 1995–2002.
B1748: 5The low GI may be explained by the inclusion of rolled oats in the recipe.
B1749: 6Portions of the test food and the reference food contained 25 g carbohydrate.
B1750: 7V Lang (Danone Vitapole Company, Le Plessis-Robinson, France), unpublished observations, 1996–2000.
B1751: 8GI calculated from the AUC for glucose.
B1752: 9GI calculated by using a mathematical formula based on results from an in vitro starch hydrolysis assay.
B1753: 10Impaired glucose tolerance.
B1754: 11Both the test food and the reference food contained 75 g carbohydrate.
B1755: 12Both the test food and the reference food contained 100 g carbohydrate.
B1756: 13Values based on 0.5 g carbohydrate/kg body wt.
B1757: 14AUC measured over 3 h for only 5 time points (0, 30, 60, 120, and 180 min).
B1758: 15GI corrected for added milk and adjusted to represent a 50-g carbohydrate portion size.
B1759: 16Made from raw oats that were cooked for 20 min.
B1760: 17Used as reference food and given a GI of 100. The GI of the test food was measured by expressing the glucose AUC
B1761: value for the test food as a percentage of the AUC value for wheat chapatti.
B1762: 18GI calculated from AUC food/AUC glucose formula. The AUC value was calculated over 3 h for 5 time points only.
B1763: 19J Dzieniszewski, J Ciok (National Food and Nutrition Institute, Poland), unpublished observations, 1996–2001.
B1764: 20J Brand-Miller, S Holt (Sydney University, Australia), and V Lang (Danone Vitapole Company, Le Plessis-Robinson,
B1765: France), unpublished observations, 2000 and 2001.
B1766: 21M Champ (INRA, France) and V Lang (Danone Vitapole Company, France), unpublished observations, 1998.
B1767: 22AUC measured over 3 h for only 4 time points (0, 1, 2, and 3 h).
B1768: 23AUC calculated as the area above fasting to 3 h only.
B1769: 24AUC measured over 5 h, but blood samples taken at hourly intervals only.
B1770: 25Potato used as reference food with a GI fixed at 80. The GI of the test food was calculated by expressing the test
B1771: food’s glucose AUC value as a percentage of the potato’s AUC value.
B1772: 26White rice was used as the reference food, but glucose was also tested and had a GI of 122. The observed GI was
B1773: multiplied by 100 and then divided by 122 to convert it to a GI on the glucose scale (ie, glucose = reference food with a
B1774: GI of 100).
B1775: 27Blood glucose measured at 30-min intervals.
B1776: 28GI for sugars calculated from the glycemic response for a meal of sugar and rolled oats minus the glycemic response
B1777: for the oats alone.
B1778: 29Both the test food and the reference food contained 30 g carbohydrate.
B1779: 30Total weight of the test food was 25 g, whereas reference food contained 25 g available carbohydrate. The carbohydrate
B1780: content of the test food was assumed to be 100% available, which may be an overestimate.
B1781: 31Eaten as part of a mixed meal with fish, tomato, and onion sauce.
B1782: 32AUC measured over 2 h for 4 time points (0, 30, 60, and 120 min).
B1783: 33AUC measured over 4 h for only 6 time points (0, 30, 60, 120, 180, and 240 min).
B1784: 34Both the test food and the reference food contained 45 g carbohydrate.
B1785: 35Reference food was an ordinary corn flour arepa.
B1787: Additional Foods:
B1789: Sports drinks and energy foods:
B1790: GatorLode (Orange) | C1790: 100
B1791: Gatorade (Orange) | C1791: 89
B1792: XLR8 (Orange) | C1792: 68
B1793: Poweraid (Orange) | C1793: 65
B1794: Cytomax (Orange) | C1794: 62
B1795: Allsport (Orange) | C1795: 53
B1796: Cliff bar (Cookies & Cream) | C1796: 101
B1797: Power bar (Chocolate) | C1797: 83
B1798: PR-bar (Cookies 'N Cream) | C1798: 81
B1799: MET-Rx bar (Vanilla) | C1799: 74
B1800: GatorPro (Chocolate) meal | C1800: 89
B1801: Optifuel meal | C1801: 78
B1802: Ensure (Vanilla) meal | C1802: 75
B1803: Boost High Protein (Vanilla) meal | C1803: 59
B1804: MET-Rx (Vanilla) meal | C1804: 58
B1805: Boost (Vanilla) meal | C1805: 53
B1806: Source: Randall J. Gretebeck et al., “Glycemic index of popular sports drinks and energy foods,”
B1807: Journal of the American Dietetic Association, March 2002, pp. 415-417.
B1809: Dates:
B1810: bahri dates | C1810: 50
B1811: khalas dates | C1811: 36
B1812: bo ma'an dates | C1812: 31
B1813: Source: Campbell J. Miller et al., “Glycemic index of 3 varieties of dates,” Saudi Medical
B1814: Journal, May 2002, pp. 536-538.